,CUI1,CUI2
3284,Traumatic delivery,"Damage to pelvic joints and ligaments, unspecified as to episode of care or not applicable"
3285,Traumatic delivery,Other specified obstetric trauma
3286,Traumatic delivery,"Other specified obstetrical trauma, unspecified as to episode of care or not applicable"
3287,Traumatic delivery,"Other specified obstetrical trauma, delivered, with or without mention of antepartum condition"
3288,Traumatic delivery,"Other specified obstetrical trauma, delivered, with mention of postpartum complication"
3289,Traumatic delivery,"Other specified obstetrical trauma, antepartum condition or complication"
3290,Traumatic delivery,"Other specified obstetrical trauma, postpartum condition or complication"
3291,Low density lipoprotein increased,Low density lipoprotein increased
3292,Dental Pulp Diseases,Pulp and periapical tissue disease
3293,Dental Pulp Diseases,Other and unspecified diseases of pulp and periapical tissues
3294,"Hodgkin's disease, lymphocytic depletion of lymph nodes of multiple sites","Hodgkin's disease, lymphocytic depletion of lymph nodes of multiple sites"
3295,Hodgkin's disease lymphocyte depletion type stage IV,Hodgkin's disease lymphocyte depletion type stage IV
3296,Diaper Rash,Diaper Rash
3297,Dental Developmental Disorder,Tooth eruption disorder
3298,Dental Developmental Disorder,Tooth development and eruption disorder
3299,Dental Developmental Disorder,Disturbance of tooth formation
3300,Dental Developmental Disorder,Other specified disorders of tooth development and eruption
3301,Diabetic uveitis,Diabetic uveitis
3302,Obstructed diaphragmatic hernia,"Diaphragmatic hernia with obstruction, but without mention of gangrene"
3303,Fetal diethylstilbestrol syndrome,Diethylstilbestrol [DES] affecting fetus via placenta or breast milk
3304,Fetal diethylstilbestrol syndrome,Fetal diethylstilbestrol syndrome
3305,Intervertebral Disk Displacement,Displacement of thoracic or lumbar intervertebral disc without myelopathy
3306,Optic Disk Drusen,Optic Disk Drusen
3307,Optic Disk Drusen,Crater-like holes of optic disc
3308,Discoloration of skin,Other dyschromia
3309,Tooth Discoloration,Posteruptive color change of tooth
3310,Tooth Discoloration,Posteruptive color change of tooth
3311,Graft-vs-Host Disease,Graft-vs-Host Disease
3312,Isoimmune hemolytic disease,"Erythroblastosis, Fetal"
3313,Isoimmune hemolytic disease,"Erythroblastosis, Fetal"
3314,Isoimmune hemolytic disease,"Erythroblastosis, Fetal"
3315,Isoimmune hemolytic disease,"Erythroblastosis, Fetal"
3316,Rhesus hemolytic disease of newborn,Hemolytic disease of fetus OR newborn due to RhD isoimmunization
3317,Rhesus hemolytic disease of newborn,Hemolytic disease of fetus OR newborn due to RhD isoimmunization
3318,Hodgkin's disease lymphocyte predominance type stage III,"Hodgkin's disease, lymphocytic-histiocytic predominance of lymph nodes of multiple sites"
3319,Hodgkin's disease lymphocyte predominance type stage IV,"Hodgkin's disease, lymphocytic-histiocytic predominance, unspecified site, extranodal and solid organ sites"
3320,Hodgkin's disease nodular sclerosis stage IV,"Hodgkin's disease, nodular sclerosis, unspecified site, extranodal and solid organ sites"
3321,Dislocations,"Other joint derangement, NEC, involving unspecified site in MDR22_0"
3322,Dislocations,"Simple dislocation, multiple and ill-defined sites"
3323,Dislocations,"Internal derangement of knee, other"
3324,Dislocations,Other derangement of joint
3325,Dislocations,"Other joint derangement, NEC, involving shoulder region in MDR22_0"
3326,Dislocations,"Other joint derangement, NEC, involving upper arm in MDR22_0"
3327,Dislocations,"Other joint derangement, NEC, involving forearm in MDR22_0"
3328,Dislocations,"Other joint derangement, NEC, involving hand in MDR22_0"
3329,Dislocations,"Other joint derangement, NEC, involving pelvic region and thigh in MDR22_0"
3330,Dislocations,"Other joint derangement, NEC, involving lower leg in MDR22_0"
3331,Dislocations,"Other joint derangement, NEC, involving ankle and foot in MDR22_0"
3332,Dislocations,"Other joint derangement, NEC, involving other specified sites in MDR22_0"
3333,Dislocations,"Other joint derangement, NEC, involving multiple sites in MDR22_0"
3334,Dislocations,"Unspecified joint derangement, pelvic region and thigh"
3335,Dislocations,"Unspecified joint derangement, ankle and foot"
3336,Dislocations,"Unspecified derangement of joint, other specified sites"
3337,Dislocations,"Unspecified joint derangement, multiple sites"
3338,Dislocations,"Closed dislocation of elbow, other"
3339,Dislocations,"Open dislocation of elbow, other"
3340,Dislocations,"Closed dislocation of wrist, other"
3341,Dislocations,"Other dislocation of knee, simple"
3342,Dislocations,"Other dislocation of knee, compound"
3343,Dislocations,"Closed dislocation of foot, other"
3344,Dislocations,"Open dislocation of foot, other"
3345,Dislocations,"Compound dislocation, multiple and ill-defined sites"
3346,Dislocations,"Other joint derangement, NEC, involving unspecified site in MDR22_0"
3347,Dislocations,"Dislocation at other location, closed"
3348,Dislocations,"Dislocation at other specified location, closed"
3349,Dislocations,"Dislocation at other location, open"
3350,Dislocations,"Dislocation at other specified location, open"
3351,Dislocations,Multiple ill-defined dislocations
3352,Dislocations,"Other specified dislocation of knee, closed"
3353,Dislocations,"Open dislocation, other location"
3354,Dislocations,Other specified internal derangement of knee
3355,Dislocations,Joint dislocation NEC
3356,Dislocations,Temporomandibular joint dislocation
3357,Dislocations,"Other specified dislocation of knee, open"
3358,Dislocations,"Closed dislocation, other location"
3359,Pathological dislocation of joint,"Pathological dislocation of joint, pelvic region and thigh"
3360,Pathological dislocation of joint,Pathological dislocation of the ankle and/or foot
3361,Pathological dislocation of joint,"Pathological dislocation of joint, other specified sites"
3362,Pathological dislocation of joint,Pathological dislocation of multiple joints
3363,Dislocation of joint of spine,Open dislocation of multiple cervical vertebrae
3364,Dislocation of joint of spine,Closed dislocation of thoracic and/or lumbar spine
3365,Dislocation of joint of spine,Open dislocation of thoracic and/or lumbar spine
3366,Dislocation of joint of spine,"Closed dislocation, vertebra, other"
3367,Dislocation of joint of spine,Open dislocation of other vertebra
3368,Dislocation of joint of spine,"Closed dislocation, vertebra, other"
3369,Dislocation of joint of spine,Open dislocation of thoracic and/or lumbar spine
3370,Dislocation of joint of spine,Open dislocation of other vertebra
3371,Dislocation of joint of spine,Closed dislocation of thoracic and/or lumbar spine
3372,Dislocation of joint of spine,Open dislocation of other vertebra
3373,Dislocation of joint of spine,"Closed dislocation, vertebra, other"
3374,Extrapyramidal Disorders,Extrapyramidal and movement disorders
3375,Extrapyramidal Disorders,Other extrapyramidal diseases and abnormal movement disorders
3376,Extrapyramidal Disorders,Other extrapyramidal diseases and abnormal movement disorders
3377,Extrapyramidal Disorders,Other extrapyramidal diseases and abnormal movement disorders
3378,Extrapyramidal Disorders,Extrapyramidal Disorders
3379,Extrapyramidal Disorders,Extrapyramidal disorder NEC
3380,Extrapyramidal Disorders,Extrapyramidal Disorders
3381,Sensory disorder of eyelid,Sensory disorder of eyelid
3382,Hemorrhagic Disorders,Other specified hemorrhagic conditions
3383,Hemorrhagic Disorders,Hemorrhagic Disorders
3384,Hemorrhagic Disorders,Purpura and other hemorrhagic conditions
3385,Hemorrhagic Disorders,Purpura and other hemorrhagic conditions
3386,Hemorrhagic Disorders,Other specified hemorrhagic conditions
3387,Hemorrhagic Disorders,Hemorrhagic Disorders
3388,Iron Metabolism Disorders,Iron Metabolism Disorders
3389,Disorder of magnesium metabolism,Disorder of magnesium metabolism
3390,Urination Disorders,Other specified abnormality of urination
3391,Disorder of nipple,"Cracked nipple associated with childbirth, unspecified as to episode of care or not applicable"
3392,Disorder of nipple,"Cracked nipple associated with childbirth, delivered, with mention of postpartum complication"
3393,Disorder of nipple,"Cracked nipple associated with childbirth, antepartum condition or complication"
3394,Disorder of nipple,"Cracked nipple associated with childbirth, postpartum condition or complication"
3395,Disorder of nipple,"Cracked nipple associated with childbirth, delivered, with or without mention of antepartum condition"
3396,Vascular disorder of penis,Vascular disorder of penis
3397,Speech Disorders,Other speech disturbances
3398,Speech Disorders,Speech Disorders
3399,Speech Disorders,Speech disorder NEC in MDR
3400,Fetal Distress,"Fetal distress, affecting management of mother, unspecified as to episode of care or not applicable"
3401,Fetal Distress,"Fetal distress, affecting management of mother, delivered, with or without mention of antepartum condition"
3402,Fetal Distress,"Foetal distress before onset of labour, in liveborn infant"
3403,Fetal Distress,"Foetal distress first noted during labour, in liveborn infant"
3404,Fetal Distress,"Fetal distress, affecting management of mother, unspecified as to episode of care or not applicable"
3405,Drug ineffective,Lack of Efficacy
3406,Duodenal ulcer with hemorrhage,Acute duodenal ulcer with hemorrhage AND obstruction
3407,Duodenal ulcer with hemorrhage,"Duodenal ulcer, chronic or unspecified with hemorrhage"
3408,Duodenal ulcer with hemorrhage,"Chronic or unspecified duodenal ulcer with hemorrhage, with obstruction"
3409,Duodenal ulcer with hemorrhage,"Duodenal ulcer, chronic or unspecified with hemorrhage"
3410,Duodenal ulcer with hemorrhage,"Chronic or unspecified duodenal ulcer with hemorrhage, without mention of obstruction"
3411,Duodenal ulcer with hemorrhage,"Duodenal ulcer haemorrhage, obstructive"
3412,Duodenal Obstruction,Other obstruction of duodenum
3413,"Duodenal ulcer perforation, obstructive","Chronic or unspecified duodenal ulcer with perforation, with obstruction"
3414,"Duodenal ulcer, obstructive","Acute duodenal ulcer without mention of hemorrhage or perforation, with obstruction"
3415,"Duodenal ulcer, obstructive","Chronic duodenal ulcer without mention of hemorrhage or perforation, with obstruction"
3416,"Duodenal ulcer, obstructive","Duodenal ulcer, unspec as acute or chronic, w/o ment of hemorrhage or perforation, with obstruction"
3417,"Duodenal ulcer, obstructive","Duodenal ulcer, unspec as acute or chronic, w/o ment of hemorrhage or perforation, with obstruction"
3418,"Duodenal ulcer, obstructive","Chronic duodenal ulcer without mention of hemorrhage or perforation, with obstruction"
3419,Duodenal ulcer perforation,Acute duodenal ulcer with hemorrhage AND perforation
3420,Duodenal ulcer perforation,"Acute duodenal ulcer with hemorrhage and perforation, without mention of obstruction"
3421,Duodenal ulcer perforation,"Acute duodenal ulcer with hemorrhage, with perforation AND with obstruction"
3422,Duodenal ulcer perforation,"Duodenal ulcer, chronic or unspecified with perforation"
3423,Duodenal ulcer perforation,"Chronic or unspecified duodenal ulcer with perforation, without mention of obstruction"
3424,Duodenal ulcer perforation,"Duodenal ulcer, chronic or unspecified with both hemorrhage and perforation"
3425,Duodenal ulcer perforation,"Chronic or unspecified duodenal ulcer with hemorrhage and perforation, with obstruction"
3426,Duodenal ulcer perforation,Acute duodenal ulcer with hemorrhage AND perforation
3427,Duodenal ulcer perforation,Acute duodenal ulcer with hemorrhage AND perforation
3428,Duodenal ulcer perforation,"Duodenal ulcer, chronic or unspecified with both hemorrhage and perforation"
3429,Duodenal ulcer perforation,"Chronic or unspecified duodenal ulcer with hemorrhage and perforation, w/o ment of obstruction"
3430,Duodenal ulcer perforation,"Duodenal ulcer haemorrhage and perforation, obstructive"
3431,Duodenal ulcer perforation,Duodenal ulcer with hemorrhage AND perforation
3432,Duodenal ulcer perforation,Duodenal ulcer with hemorrhage AND perforation
3433,Duodenal ulcer perforation,Duodenal ulcer with hemorrhage AND perforation
3434,Duodenal ulcer perforation,Duodenal ulcer with hemorrhage AND perforation
3435,Duodenal ulcer perforation,Duodenal ulcer with hemorrhage AND perforation
3436,Duodenal ulcer perforation,Duodenal ulcer with hemorrhage AND perforation
3437,Duodenal ulcer perforation,Duodenal ulcer with hemorrhage AND perforation
3438,Reticuloendothelial dysfunction,Reticuloendothelial blockade
3439,Dysplasia of vagina,Vaginal intraepithelial neoplasia grade 1
3440,Dysplasia of vagina,Vaginal intraepithelial neoplasia grade 2
3441,Dyspnea on exertion,Dyspnea on exertion
3442,Dyspnea on exertion,Dyspnea on exertion
3443,Dyspnea on exertion,Dyspnea on exertion
3444,Paroxysmal nocturnal dyspnea,Paroxysmal nocturnal dyspnea
3445,Retinal Dystrophies,retinal dystrophy in systemic or cerebroretinal lipidoses
3446,Retinal Dystrophies,retinal dystrophy in other systemic disorders and syndromes
3447,Retinal Dystrophies,Vitreoretinal dystrophy
3448,Retinal Dystrophies,Other dystrophies primarily involving the sensory retina
3449,Retinal Dystrophies,Dystrophies primarily involving the retinal pigment epithelium
3450,Retinal Dystrophies,Dystrophies primarily involving Bruch's membrane
3451,Tuberculosis of ear,"Tuberculosis of ear, bacteriological or histological examination unknown (at present)"
3452,"Encephalomyelitis, Eastern Equine","Encephalomyelitis, Eastern Equine"
3453,Infected eczema,Infective dermatitis of eyelid of types resulting in deformity
3454,Infected eczema,Other infective dermatitis of eyelid
3455,Embolism of renal vein,Embolism and thrombosis of the renal vein
3456,Positron-Emission Tomography,Positron-Emission Tomography
3457,Venezuelan equine encephalomyelitis,Venezuelan equine encephalomyelitis
3458,"Encephalomyelitis, Western Equine","Encephalomyelitis, Western Equine"
3459,Subacute endocarditis,Subacute Bacterial Endocarditis
3460,Endocrine myopathy,Myopathy in endocrine diseases classified elsewhere
3461,Endometrial hypertrophy,Endometrial hypertrophy
3462,Enlargement of lacrimal gland,Chronic enlargement of lacrimal gland
3463,Enterovirus meningitis,Enterovirus meningitis
3464,Enterovirus meningitis,Enterovirus meningitis
3465,Enterovirus meningitis,Enterovirus meningitis
3466,Eosinophilic meningitis,Eosinophilic meningitis
3467,Tuberculosis of epididymis,"Tuberculosis of epididymis, bacteriological or histological examination not done"
3468,Tuberculosis of epididymis,"Tuberculosis of epididymis, bacteriological or histological examination unknown (at present)"
3469,Tuberculosis of epididymis,"Tuberculosis of epididymis, unspecified"
3470,Absence Epilepsy,Absence attacks
3471,Erection increased,Erection increased (exc priapism)
3472,Erection increased,Erection increased (exc priapism)
3473,Systemic lupus erythematosus rash,Systemic lupus erythematosus rash
3474,Erythraemic myelosis (in remission),"Acute erythremia and erythroleukemia, in remission"
3475,Palmar-plantar erythrodysesthesia syndrome,Palmar-plantar erythrodysesthesia syndrome
3476,Euphoric mood,Laughter
3477,Euphoric mood,Euphoric mood
3478,Pain in limb,Pain in right arm
3479,Pain in limb,Pain in (r) calf
3480,Pain in limb,Pain in limb
3481,Pain in limb,Pain in (l) foot
3482,Pain in limb,Pain in (r) foot
3483,Gonococcal infection of eye,Other gonococcal eye infection
3484,Hypoesthesia eye,Corneal anesthesia and hypoesthesia
3485,Hypoesthesia eye,Analgesia of cornea
3486,Superficial injury of eye,Superficial injury of eye AND/OR adnexa
3487,Superficial injury of eye,Superficial injury of eyelid AND/OR periocular area
3488,Superficial injury of eye,Other and unspecified superficial injuries of eye
3489,Facial swelling (finding),swelling lips & face
3490,Facial swelling (finding),swelling of face & neck
3491,Postsurgical ovarian failure,Postablative ovarian failure
3492,Postsurgical ovarian failure,Postsurgical ovarian failure
3493,Testicular failure postoperative,Postsurgical testicular hypofunction
3494,Plasmodium falciparum infection,Plasmodium falciparum infection
3495,Female infertility,"Infertility, female, of other specified origin"
3496,Female infertility,Female infertility associated with anovulation
3497,Female infertility,Female infertility of pituitary - hypothalamic origin
3498,Female infertility,Female infertility of tubal origin
3499,Female infertility,"Infertility, female, of cervical or vaginal origin"
3500,Female infertility,"Infertility, female, of cervical or vaginal origin"
3501,Female infertility,"Infertility, female, of other specified origin"
3502,Femoral hernia with gangrene,"Unilateral or unspecified femoral hernia, with gangrene"
3503,Femoral hernia with gangrene,"Femoral hernia with gangrene, unilateral or unspecified, recurrent"
3504,Obstructed femoral hernia,"Femoral hernia with obstruction, unilateral or unspecified (not specified as recurrent)"
3505,Obstructed femoral hernia,"Femoral hernia with obstruction, unilateral or unspecified, recurrent"
3506,Femoral Fractures,"Fracture of unspecified trochanteric section of femur, open"
3507,Femoral Fractures,Fracture of other and unspecified parts of femur
3508,Femoral Fractures,"Fracture of shaft or unspecified part of femur, closed"
3509,Femoral Fractures,Other closed fracture of lower end of femur
3510,Femoral Fractures,Other open fracture of lower end of femur
3511,Femoral Fractures,Femoral Fractures
3512,Femoral Fractures,Fractured femur (excl neck)
3513,Fissure in skin,Fissure in skin
3514,Ocular fistula,Ocular fistula causing hypotony of eye
3515,High fetal head,"High head at term, unspecified as to episode of care or not applicable"
3516,High fetal head,High head at term - delivered
3517,High fetal head,"High head at term, antepartum condition or complication"
3518,Unstable lie,"Unstable lie, unspecified as to episode of care or not applicable"
3519,Unstable lie,Unstable lie - delivered
3520,Unstable lie,"Unstable lie, antepartum condition or complication"
3521,Fetal Malnutrition,Fetal malnutrition without mention of light-for-dates
3522,Fetal Malnutrition,"Fetal malnutrition without mention of ""light-for-dates"", 1,000-1,249 grams"
3523,Fetal Malnutrition,"Fetal malnutrition without mention of ""light-for-dates"", 2,000-2,499 grams"
3524,Fetal Malnutrition,"Fetal malnutrition without mention of ""light-for-dates"", 1,250-1,499 grams"
3525,Fetal Malnutrition,"Fetal malnutrition without mention of ""light-for-dates"", 1,500-1,749 grams"
3526,Fetal Malnutrition,"Fetal malnutrition without mention of ""light-for-dates"", 1,750-1,999 grams"
3527,Fetal Malnutrition,"Fetal malnutrition without mention of ""light-for-dates"", 2,500 grams and over"
3528,Fetal Malnutrition,"Fetal malnutrition without mention of ""light-for-dates"", 500-749 grams"
3529,Fetal Malnutrition,"Fetal malnutrition without mention of ""light-for-dates"", less than 500 grams"
3530,Fetal Malnutrition,"Fetal malnutrition without mention of ""light-for-dates"", 750-999 grams"
3531,Fetal Malnutrition,"Fetal malnutrition without mention of ""light-for-dates"", unspecified [weight]"
3532,Food Interactions,Food-Drug Interactions
3533,Fracture of foot,Fracture of one or more tarsal and metatarsal bones
3534,Fracture of foot,Other closed fracture of tarsal and metatarsal bones
3535,Fracture of foot,Closed fracture of unspecified bone(s) of foot [except toes]
3536,Fracture of foot,Other closed fracture of tarsal and metatarsal bones
3537,Fracture of foot,Other open fracture of tarsal and metatarsal bones
3538,Fracture of foot,Open fracture of unspecified bone(s) of foot [except toes]
3539,Fracture of foot,Other open fracture of tarsal and metatarsal bones
3540,Fracture of foot,Fracture of one or more phalanges of foot
3541,Fracture of foot,"Fracture of one or more phalanges of foot, closed"
3542,Fracture of foot,"Fracture of one or more phalanges of foot, open"
3543,Fracture of foot,Other open fracture of tarsal and metatarsal bones
3544,Fracture of hand,Closed fracture of multiple sites of metacarpus
3545,Fracture of hand,Open fracture of multiple sites of metacarpus
3546,Fracture of hand,Fracture of one or more phalanges of hand
3547,Fracture of hand,Closed fracture of one or more phalanges of hand
3548,Fracture of hand,Closed fracture of middle or proximal phalanx or phalanges of hand
3549,Fracture of hand,Closed fracture of distal phalanx or phalanges of hand
3550,Fracture of hand,Closed fracture of multiple sites of phalanx or phalanges of hand
3551,Fracture of hand,Open fracture of one or more phalanges of hand
3552,Fracture of hand,Open fracture of middle or proximal phalanx or phalanges of hand
3553,Fracture of hand,Open fracture of distal phalanx or phalanges of hand
3554,Fracture of hand,Open fracture of multiple sites of phalanx or phalanges of hand
3555,Fracture of hand,Multiple fractures of hand bones
3556,Fracture of hand,Closed multiple fractures of hand bones
3557,Fracture of hand,Multiple open fractures of hand bones
3558,Fracture of hand,Closed fracture of one or more phalanges of hand
3559,Fracture of hand,Open fracture of one or more phalanges of hand
3560,Humeral Fractures,Other closed fracture of upper end of humerus
3561,Humeral Fractures,Other open fracture of upper end of humerus
3562,Humeral Fractures,Closed fracture of shaft or unspecified part of humerus
3563,Humeral Fractures,"Fracture of shaft or unspecified part of humerus, open"
3564,Humeral Fractures,Other closed fracture of lower end of humerus
3565,Humeral Fractures,Other open fracture of lower end of humerus
3566,"Fractures, Open","Fractures, Open"
3567,"Fractures, Open",Open fracture of bones of trunk
3568,Radius Fractures,Closed fracture of unspecified part of radius (alone)
3569,Radius Fractures,Other and unspecified closed fractures of proximal end of radius (alone)
3570,Radius Fractures,Other and unspecified open fractures of proximal end of radius (alone)
3571,Radius Fractures,Closed fracture of shaft of radius
3572,Radius Fractures,Open fracture of shaft of radius
3573,Radius Fractures,Other closed fractures of distal end of radius (alone)
3574,Radius Fractures,Other open fractures of distal end of radius (alone)
3575,Radius Fractures,Open fracture of unspecified part of radius (alone)
3576,Fracture of sacrum,Closed fracture of sacrum and coccyx without mention of spinal cord injury
3577,Fracture of sacrum,Open fracture of sacrum and coccyx without mention of spinal cord injury
3578,Fracture of sacrum,closed fracture of sacrum or coccyx with spinal cord injury
3579,Fracture of sacrum,closed fracture of sacrum or coccyx with spinal cord injury
3580,Fracture of sacrum,Closed fracture of sacrum AND/OR coccyx with complete cauda equina lesion
3581,Fracture of sacrum,Closed fracture of sacrum and coccyx with other cauda equina injury
3582,Fracture of sacrum,Closed fracture of sacrum and coccyx with other spinal cord injury
3583,Fracture of sacrum,open fracture of sacrum or coccyx with spinal cord injury
3584,Fracture of sacrum,open fracture of sacrum or coccyx with spinal cord injury
3585,Fracture of sacrum,Open fracture of sacrum AND/OR coccyx with complete cauda equina lesion
3586,Fracture of sacrum,Open fracture of sacrum and coccyx with other cauda equina injury
3587,Fracture of sacrum,Open fracture of sacrum and coccyx with other spinal cord injury
3588,Fracture of sacrum,Closed fracture of sacrum and coccyx without mention of spinal cord injury
3589,Fracture of sacrum,closed fracture of sacrum or coccyx with spinal cord injury
3590,Fracture of sacrum,Open fracture of sacrum and coccyx without mention of spinal cord injury
3591,Fracture of sacrum,open fracture of sacrum or coccyx with spinal cord injury
3592,Fracture of scapula,Closed fracture of other part of scapula
3593,Fracture of scapula,open fracture of glenoid cavity or neck of scapula
3594,Fracture of scapula,Open fracture of other part of scapula
3595,Tibial Fractures,Open fracture of unspecified part of tibia alone
3596,Ulna Fractures,Closed fracture of unspecified part of ulna (alone)
3597,Ulna Fractures,Other and unspecified closed fractures of proximal end of ulna (alone)
3598,Ulna Fractures,Other and unspecified open fractures of proximal end of ulna (alone)
3599,Ulna Fractures,Closed fracture of shaft of ulna (alone)
3600,Ulna Fractures,Open fracture of shaft of ulna (alone)
3601,Ulna Fractures,Closed fracture of distal end of ulna
3602,Ulna Fractures,Open fracture of distal end of ulna (alone)
3603,Ulna Fractures,Open fracture of unspecified part of ulna (alone)
3604,Fracture of distal end of radius and ulna,Closed fracture of carpal bone
3605,Fracture of distal end of radius and ulna,"Open fracture of carpal bone, unspecified"
3606,Fragile skin,Fragile skin
3607,Vascular fragility,Vascular fragility
3608,Gas Poisoning,"Toxic effect of other gases, fumes, or vapors"
3609,Gas Poisoning,Toxic effect of other hydrocarbon gas
3610,Gas Poisoning,"Toxic effect of other specified gases, fumes, or vapors"
3611,Gas Poisoning,"Toxic effect of gas, fumes AND/OR vapors"
3612,Gas Poisoning,"Toxic effect of other gases, fumes or vapours, other"
3613,Gas Poisoning,"Toxic effect of other specified gases, fumes, or vapors"
3614,Injury of gallbladder,Bile duct/gallbladder injury with open wound into cavity
3615,Gamma-Glutamyltransferase Increased,Gamma-Glutamyltransferase Increased
