,CUI1,CUI2
1980,Perineal hematoma,Vulval and perineal hematoma during delivery
1981,Perineal hematoma,"Vulvar and perineal hematoma, unspecified as to episode of care or not applicable"
1982,Perineal hematoma,"Vulvar and perineal hematoma, delivered, with or without mention of antepartum condition"
1983,Perineal hematoma,"Vulvar and perineal hematoma, postpartum condition or complication"
1984,Perineal hematoma,Vulval and perineal hematoma during delivery
1985,Peripheral Nerve Injuries,Other cranial and peripheral nerve injuries due to birth trauma
1986,Peripheral Nerve Injuries,Late effect of nervous system injury
1987,Peripheral Nerve Injuries,Late effect of injury of peripheral nerve of shoulder girdle and upper limb
1988,Peripheral Nerve Injuries,late effects of injury of peripheral nerve of pelvic girdle and lower limb
1989,Peripheral Nerve Injuries,Late effect of injury to other and unspecified nerve
1990,Peripheral Nerve Injuries,"Injury to other nerve(s) of trunk, excluding shoulder and pelvic girdles"
1991,Peripheral Nerve Injuries,"Injury to other specified nerve(s) of trunk, excluding shoulder and pelvic girdles"
1992,Peripheral Nerve Injuries,"Injury to unspecified nerve of trunk, excluding shoulder and pelvic girdles"
1993,Peripheral Nerve Injuries,Injury of nerves at shoulder and upper arm level
1994,Peripheral Nerve Injuries,Injury to other specified nerve(s) of shoulder girdle and upper limb
1995,Peripheral Nerve Injuries,Shoulder girdle and upper limb multiple nerve injuries
1996,Peripheral Nerve Injuries,Injury of nerves at shoulder and upper arm level
1997,Peripheral Nerve Injuries,injury of peripheral nerve of pelvic girdle and lower limb
1998,Peripheral Nerve Injuries,Injury to other specified nerve(s) of pelvic girdle and lower limb
1999,Peripheral Nerve Injuries,Pelvic girdle and lower limb multiple nerve injuries
2000,Peripheral Nerve Injuries,Injury to unspecified nerve of pelvic girdle and lower limb
2001,Peripheral Nerve Injuries,Injury to other and unspecified nerves
2002,Peripheral Nerve Injuries,Injury of superficial nerves of head AND/OR neck
2003,Peripheral Nerve Injuries,Injury to other specified nerve(s)
2004,Peripheral Nerve Injuries,Injury to multiple nerves in several parts
2005,Peripheral Nerve Injuries,Injury of nerves at shoulder and upper arm level
2006,Cyst of pharynx,Cyst of pharynx or nasopharynx
2007,Edema of pharynx,Pharynx or nasopharynx edema
2008,Edema of pharynx,Edema of pharynx
2009,Platypnea,Platypnea
2010,Poor peripheral circulation,Poor peripheral circulation
2011,Postmastectomy lymphedema syndrome,Postmastectomy lymphedema syndrome
2012,Postmastectomy lymphedema syndrome,Postmastectomy lymphedema syndrome
2013,"Infant, Postmature",Disorder relating to long gestation AND/OR high birthweight
2014,"Infant, Postmature",Exceptionally large baby relating to long gestation
2015,Hemorrhage of prostate,Prostatic congestion or hemorrhage
2016,Hemorrhage of prostate,Prostatic congestion or hemorrhage
2017,Rectal hemorrhage,Hemorrhage of rectum and anus
2018,Rectal hemorrhage,Hemorrhage of rectum and anus
2019,Refusal of Treatment,Treatment refused due to patient's wishes
2020,Respiratory Depression,Respiratory depression postoper
2021,Retroperitoneal Hemorrhage,Retroperitoneal Hemorrhage
2022,Rheumatoid factor negative,Rheumatoid factor negative
2023,Screaming,Syndrome screaming
2024,Sexual abuse,Forcible intercourse
2025,Sleep Apnea Syndromes,Hypersomnia with sleep apnea
2026,Sleep Apnea Syndromes,Insomnia with sleep apnea
2027,Sleep Apnea Syndromes,Other and unspecified sleep apnea
2028,"Infant, Small for Gestational Age",Disorder relating to short gestation AND/OR low birthweight
2029,"Infant, Small for Gestational Age",Light-for-dates with signs of fetal malnutrition
2030,"Infant, Small for Gestational Age",Light-for-dates without fetal malnutrition
2031,"Infant, Small for Gestational Age","""Light-for-dates"" without mention of fetal malnutrition, 1,000- 1,249 grams"
2032,"Infant, Small for Gestational Age","""Light-for-dates"" with signs of fetal malnutrition, 1,000-1,249 grams"
2033,"Infant, Small for Gestational Age","""Light-for-dates"" without mention of fetal malnutrition, 2,000- 2,499 grams"
2034,"Infant, Small for Gestational Age","""Light-for-dates""with signs of fetal malnutrition, 2,000-2,499 grams"
2035,"Infant, Small for Gestational Age","""Light-for-dates""without mention of fetal malnutrition, 1,250- 1,499 grams"
2036,"Infant, Small for Gestational Age","""Light-for-dates"" with signs of fetal malnutrition, 1,250-1,499 grams"
2037,"Infant, Small for Gestational Age","""Light-for-dates"" with signs of fetal malnutrition, 1,500-1,749 grams"
2038,"Infant, Small for Gestational Age","""Light-for-dates"" without mention of fetal malnutrition, 1,500- 1,749 grams"
2039,"Infant, Small for Gestational Age","""Light-for-dates"" without mention of fetal malnutrition, 1,750- 1,999 grams"
2040,"Infant, Small for Gestational Age","""Light-for-dates"" with signs of fetal malnutrition, 1,750-1,999 grams"
2041,"Infant, Small for Gestational Age","""Light-for-dates"" without mention of fetal malnutrition, 2,500 grams and over"
2042,"Infant, Small for Gestational Age","""Light-for-dates""with signs of fetal malnutrition, 2,500 grams and over"
2043,"Infant, Small for Gestational Age","""Light-for-dates"" without mention of fetal malnutrition, 500-749 grams"
2044,"Infant, Small for Gestational Age","""Light-for-dates""with signs of fetal malnutrition, 500-749 grams"
2045,"Infant, Small for Gestational Age","""Light-for-dates"" without mention of fetal malnutrition, less than 500 grams"
2046,"Infant, Small for Gestational Age","""Light-for-dates"" with signs of fetal malnutrition, less than 500 grams"
2047,"Infant, Small for Gestational Age","""Light-for-dates"" without mention of fetal malnutrition, 750-999 grams"
2048,"Infant, Small for Gestational Age","""Light-for-dates"" with signs of fetal malnutrition, 750-999 grams"
2049,"Infant, Small for Gestational Age","""Light-for-dates"" without mention of fetal malnutrition, unspecified [weight]"
2050,"Infant, Small for Gestational Age","""Light-for-dates"" with signs of fetal malnutrition, unspecified [weight]"
2051,Spinal Anesthesia,Spinal Anesthesia
2052,Spondylitic myelopathy,Cervical spondylosis with myelopathy
2053,Spondylitic myelopathy,Thoracic or lumbar spondylosis with myelopathy
2054,Spondylitic myelopathy,Thoracic spondylosis with myelopathy
2055,Spondylitic myelopathy,Lumbar spondylosis with myelopathy
2056,Spondylitic myelopathy,Spondylitic myelopathy
2057,Sulfhemoglobinemia,Sulfhemoglobinemia
2058,Sulfhemoglobinemia,Sulfhemoglobinemia
2059,Atrial Premature Complexes,Atrial Premature Complexes
2060,Atrial Premature Complexes,Junctional premature complex (disorder)
2061,Atrial Premature Complexes,Atrial Premature Complexes
2062,Supraventricular tachycardia,Tachycardia supraventricular aggr
2063,Tendon Injuries,Open wound of shoulder and upper arm with tendon involvement
2064,Tendon Injuries,Open wound of shoulder region with tendon involvement
2065,Tendon Injuries,Open wound of scapular region with tendon involvement
2066,Tendon Injuries,Open wound of axillary region with tendon involvement
2067,Tendon Injuries,Open wound of upper arm with tendon involvement
2068,Tendon Injuries,Open wound of multiple sites of shoulder AND/OR upper arm with tendon involvement
2069,Tendon Injuries,"Open wound of elbow, forearm, and wrist, with tendon involvement"
2070,Tendon Injuries,Open wound of forearm with tendon involvement
2071,Tendon Injuries,Open wound of elbow with tendon involvement
2072,Tendon Injuries,Open wound of wrist with tendon involvement
2073,Tendon Injuries,Open wound of finger with tendon involvement
2074,Tendon Injuries,"Multiple and unspecified open wound of upper limb, with tendon involvement"
2075,Tendon Injuries,Open wound of hip AND thigh with tendon involvement
2076,Tendon Injuries,"Open wound of knee, leg [except thigh], and ankle, with tendon involvement"
2077,Tendon Injuries,"Open wound of foot except toe(s) alone, with tendon involvement"
2078,Tendon Injuries,Open wound of toe(s) with tendon involvement
2079,Tendon Injuries,"Multiple and unspecified open wound of lower limb, with tendon involvement"
2080,Tendon Injuries,sprain of Achilles tendon
2081,Bilateral adrenalectomy,Bilateral adrenalectomy
2082,Transplantation,Transplant NEC
2083,Ureteral obstruction,Other ureteric obstruction
2084,Stenosis of ureter,Stricture or kinking of ureter
2085,Urine electrolytes abnormal,Urine electrolytes abnormal
2086,Hypertonic uterine dysfunction,"Hypertonic, incoordinate, and prolonged uterine contractions"
2087,Hypertonic uterine dysfunction,"Hypertonic, incoordinate, or prolonged uterine contractions, unspecified as to episode of care or not applicable"
2088,Hypertonic uterine dysfunction,"Hypertonic, incoordinate, or prolonged uterine contractions, delivered, with or without mention of antepartum condition"
2089,Hypertonic uterine dysfunction,"Hypertonic, incoordinate, or prolonged uterine contractions, antepartum condition or complication"
2090,Hypotonic uterine inertia,Other uterine inertia
2091,Hypotonic uterine inertia,"Primary uterine inertia, unspecified as to episode of care or not applicable"
2092,Hypotonic uterine inertia,"Secondary uterine inertia, unspecified as to episode of care or not applicable"
2093,Hypotonic uterine inertia,Other uterine inertia
2094,Hypotonic uterine inertia,"Other and unspecified uterine inertia, delivered, with or without mention of antepartum condition"
2095,Hypotonic uterine inertia,"Other and unspecified uterine inertia, antepartum condition or complication"
2096,Uterine Rupture,"Rupture of uterus before onset of labor, unspecified as to episode of care or not applicable"
2097,Uterine Rupture,"Rupture of uterus before onset of labour, with delivery"
2098,Uterine Rupture,"Rupture of uterus before onset of labor, antepartum condition or complication"
2099,Uterine Rupture,Rupture of uterus during AND/OR after labor
2100,Uterine Rupture,"Rupture of uterus during labor, delivered, with or without mention of antepartum condition"
2101,Uterine Rupture,"Rupture of uterus during labor, unspecified as to episode of care or not applicable"
2102,Uterine Rupture,"Rupture of uterus during labor, postpartum condition or complication"
2103,Uterine Rupture,"Rupture of uterus during labor, delivered, with mention of postpartum complication"
2104,"Vacuum Extraction, Obstetrical",Fetus and newborn affected by delivery by vacuum extractor [ventouse]
2105,Vaginal Hemorrhage,Vaginal Hemorrhage
2106,Vasa Previa,"Vasa previa complicating labor and delivery, delivered, with or without mention of antepartum condition"
2107,Vasa Previa,Vasa praevia complicating labour and delivery
2108,"Dementia, Vascular","Vascular Dementia, With Delirium"
2109,"Dementia, Vascular",Vascular dementia NEC
2110,Vitreous opacities,Other vitreous opacities
2111,Vitreous opacities,Crystalline deposits in vitreous
2112,Vocal Cord Paralysis,Paralysis of vocal cords and larynx
2113,Electroencephalogram abnormal,Alpha or bete wave disappeared
2114,Electroencephalogram abnormal,Alpha or bete wave disappeared
2115,Electroencephalogram abnormal,Rhythmic small waves decreased
2116,Heart sounds abnormal,Other abnormal heart sounds
2117,Heart sounds abnormal,Other abnormal heart sounds
2118,Dental abscess,Periodontal Abscess
2119,Traffic accident on public road,Renal tubular acidosis
2120,Alcohol poisoning,Toxic effect of other specified alcohols
2121,Repair of patent ductus arteriosus,Repair of patent ductus arteriosus
2122,Posterior capsule opacification,Soemmerring's ring
2123,Posterior capsule opacification,"Other after-cataract, not obscuring vision"
2124,Posterior capsule opacification,After-cataract
2125,Genitourinary chlamydia infection,Chlamydia trachomatis infection of other genitourinary sites
2126,Compression of umbilical cord,Fetus and newborn affected by other compression of umbilical cord
2127,Conductive hearing loss,Inner ear conductive hearing loss
2128,Conductive hearing loss,Conductive hearing loss of combined types
2129,Conductive hearing loss,Conductive deafness (excl otosclerosis)
2130,Confusion,"Confusional state (organic, acute or subacute)"
2131,Pulmonary congestion,Pulmonary congestion and hypostasis
2132,Pulmonary congestion,Pulmonary configuration increased
2133,Sudden death,Death in less than 24 hours from onset of symptoms
2134,Sudden death,Sudden death
2135,ENT examination,ENT examination
2136,Swelling of structure of eye,Swelling or mass of eye
2137,Factor V Leiden mutation,factor v leiden deficiency
2138,"Skin Diseases, Infectious",Other specified local infections of skin and subcutaneous tissue
2139,"Skin Diseases, Infectious",Other local infections of skin and subcutaneous tissue
2140,"Skin Diseases, Infectious",Other local infections of skin and subcutaneous tissue
2141,Sympathetic nerve injury,"Injury to other sympathetic nerve, excluding shoulder and pelvic girdles"
2142,Sputum retention,Sputum excretion difficulty
2143,Disturbance in thinking,Thinking abnormal NEC
2144,Nuchal Cord,"Cord around neck with compression, complicating labor and delivery, unspecified as to episode of care or not applicable"
2145,Nuchal Cord,"Cord around neck, with compression, complicating labor and delivery, antepartum condition or complication"
2146,Hepatitis B surface antigen positive,Hepatitis B surface antigen positive
2147,Generalized Nonconvulsive Seizure Disorder,Generalized Nonconvulsive Seizure Disorder
2148,Generalized Nonconvulsive Seizure Disorder,"Generalized nonconvulsive epilepsy, without mention of intractable epilepsy"
2149,Generalized Nonconvulsive Seizure Disorder,"Generalized non-convulsive epilepsy, with intractable epilepsy"
2150,International Normalized Ratio,International Normalized Ratio
2151,Localized Edema,Oedema labial genital
2152,"Bladder cancer stage 0, with cancer in situ","Malignant neoplasm of anterior wall of urinary bladder stage 0, with cancer in situ"
2153,"Bladder cancer stage 0, with cancer in situ","Bladder cancer stage 0, with cancer in situ"
2154,"Bladder cancer stage 0, with cancer in situ","Malignant neoplasm of lateral wall of urinary bladder stage 0, with cancer in situ"
2155,"Bladder cancer stage 0, with cancer in situ","Malignant neoplasm of other specified sites of bladder stage 0, with cancer in situ"
2156,"Bladder cancer stage 0, with cancer in situ","Malignant neoplasm of posterior wall of urinary bladder stage 0, with cancer in situ"
2157,"Bladder cancer stage 0, without cancer in situ","Malignant neoplasm of anterior wall of urinary bladder stage 0, without cancer in situ"
2158,"Bladder cancer stage 0, without cancer in situ","Bladder cancer stage 0, without cancer in situ"
2159,"Bladder cancer stage 0, without cancer in situ","Malignant neoplasm of lateral wall of urinary bladder stage 0, without cancer in situ"
2160,"Bladder cancer stage 0, without cancer in situ","Malignant neoplasm of other specified sites of bladder stage 0, without cancer in situ"
2161,"Bladder cancer stage 0, without cancer in situ","Malignant neoplasm of posterior wall of urinary bladder stage 0, without cancer in situ"
2162,"Bladder cancer stage 0, without cancer in situ","Malignant neoplasm of trigone of urinary bladder stage 0, without cancer in situ"
2163,Lip and/or oral cavity cancer stage 0,"Carcinoma in situ of lip, oral cavity and pharynx"
2164,Carcinoma in situ of endometrium,Carcinoma in situ of endometrium
2165,Carcinoma in situ of vagina,Carcinoma in situ of vagina
2166,Stage 0 Vulvar Carcinoma,Vulval intraepithelial neoplasia grade 3
2167,Carcinoma in situ of lung,Carcinoma in situ of bronchus and lung
2168,Alpha one fetoprotein measurement,Alpha one fetoprotein measurement
2169,Alpha one fetoprotein measurement,Alpha one fetoprotein measurement
2170,Congenital anomaly of abdominal wall,Congenital anomaly of abdominal wall
2171,Metastases to abdominal cavity,Secondary malignant neoplasm of retroperitoneum and peritoneum
2172,Metastases to abdominal cavity,Secondary malignant neoplasm of other digestive organs and spleen
2173,Metastases to abdominal cavity,Secondary malignant neoplasm of other digestive organ
2174,Upper abdominal pain,Epigastric pain
2175,Upper abdominal pain,Right upper quadrant pain
2176,Abnormal acid-base balance,Abnormal acid-base balance
2177,Adrenal glomerular zone abnormal,Adrenal glomerular protoplasm enclosure
2178,Abnormal labor affecting fetus,Foetus or newborn affected by other complications of labour or delivery
2179,Abnormal labor affecting fetus,Foetus or newborn affected by other complications of labour or delivery
2180,Abnormal labor affecting fetus,Foetus or newborn affected by other complications of labour or delivery
2181,Biopsy chorionic villous abnormal,Biopsy chorionic villous abnormal
2182,Biopsy liver abnormal,Kupffer cell decrease
2183,Biopsy prostate abnormal,Biopsy prostate abnormal
2184,Abnormal bone formation,Arrest of bone development AND/OR growth
2185,Bromosulphthalein test abnormal,Bromosulphthalein test abnormal
2186,Abnormal results of cardiovascular function studies,Abnormal results of cardiovascular function studies
2187,Cephalin flocculation abnormal,CCF test increased
2188,Abnormal cervical smear,Papanicolaou smear positive result
2189,Abnormal cervical smear,Papanicolaou smear suspicious result
2190,Cholangiogram abnormal,Nonspecific (abnormal) findings on radiological and other examination of biliary tract
2191,Abnormal rapid eye movement sleep,Abnormal rapid eye movement sleep
2192,Feeling abnormal,Soft feeling
2193,Feeling abnormal,Muzzy headed
2194,Feeling abnormal,Thick skull
2195,Specific gravity urine abnormal,Urine specific gravity fixed
2196,Ophthalmodynamometry abnormal,Ophthalmodynamometry abnormal
2197,"Reflex, Abnormal",Reflexes abnormal NEC
2198,Smear site unspecified abnormal,Nonspecific abnormal Papanicolaou smear of other origin
2199,Smear site unspecified abnormal,Nonspecific abnormal Papanicolaou smear of other origin
2200,Congenital anomaly of lens,Congenital anomaly of lens shape
2201,Multiple congenital anomalies,"Multiple congenital anomalies, so described"
2202,Hemolytic disease of fetus OR newborn due to ABO immunization,Hemolytic disease of fetus OR newborn due to ABO immunization
2203,Hemolytic disease of fetus OR newborn due to ABO immunization,Hemolytic disease of fetus OR newborn due to ABO immunization
2204,Pregnancy in habitual aborter,"Recurrent pregnancy loss, delivered, with or without mention of antepartum condition"
2205,Pregnancy in habitual aborter,"Recurrent pregnancy loss, antepartum condition or complication"
2206,Abortion complete complicated,"Unspecified abortion, complicated by genital tract and pelvic infection, complete"
2207,Abortion complete complicated,"Unspecified abortion, complicated by delayed or excessive hemorrhage, complete"
2208,Abortion complete complicated,"Unspecified abortion, complicated by damage to pelvic organs or tissues, complete"
2209,Abortion complete complicated,"Unspecified abortion, complicated by renal failure, complete"
2210,Abortion complete complicated,"Unspecified abortion, complicated by metabolic disorder, complete"
2211,Abortion complete complicated,"Unspecified abortion, complicated by shock, complete"
2212,Abortion complete complicated,"Unspecified abortion, complicated by embolism, complete"
2213,Abortion complete complicated,"Unspecified abortion, with other specified complications, complete"
2214,Abortion complete complicated,Abortion complete complicated
2215,Abortion induced complete complicated,Complete legal termination of pregnancy with genital tract or pelvic infection
2216,Abortion induced complete complicated,Complete legal termination of pregnancy with delayed or excessive hemorrhage
2217,Abortion induced complete complicated,Complete legal termination of pregnancy with damage to pelvic organs or tissues
2218,Abortion induced complete complicated,Complete legal termination of pregnancy with metabolic disorder
2219,Abortion induced complete complicated,Complete legal termination of pregnancy with shock
2220,Abortion induced complete complicated,Complete legal termination of pregnancy with embolism
2221,Abortion induced complete complicated,"Legally induced abortion, with other specified complications, complete"
2222,Abortion induced complete complicated,"Legally induced abortion, with unspecified complication, complete"
2223,Abortion induced complete complicated,"Illegally induced abortion, complicated by genital tract and pelvic infection, complete"
2224,Abortion induced complete complicated,"Illegally induced abortion, complicated by delayed or excessive hemorrhage, complete"
2225,Abortion induced complete complicated,"Illegally induced abortion, complicated by damage to pelvic organs or tissues, complete"
2226,Abortion induced complete complicated,"Illegally induced abortion, complicated by renal failure, complete"
2227,Abortion induced complete complicated,"Illegally induced abortion, complicated by shock, complete"
2228,Abortion induced complete complicated,"Illegally induced abortion, complicated by embolism, complete"
2229,Abortion induced complete complicated,"Illegally induced abortion, with other specified complications, complete"
2230,Abortion induced complete complicated,"Illegally induced abortion, with unspecified complication, complete"
2231,Abortion spontaneous complete complicated,"Spontaneous abortion, complicated by genital tract and pelvic infection, complete"
2232,Abortion spontaneous complete complicated,"Spontaneous abortion, complicated by delayed or excessive hemorrhage, complete"
2233,Abortion spontaneous complete complicated,"Spontaneous abortion, complicated by damage to pelvic organs or tissues, complete"
2234,Abortion spontaneous complete complicated,Complete miscarriage with renal failure
2235,Abortion spontaneous complete complicated,Complete miscarriage with shock
2236,Abortion spontaneous complete complicated,Complete miscarriage with embolism
2237,Abortion spontaneous complete complicated,"Spontaneous abortion, with other specified complications, complete"
2238,Abortion spontaneous complete complicated,complete spontaneous abortion with complication
2239,Abortion incomplete complicated,"Unspecified abortion, incomplete, complicated by genital tract and pelvic infection"
2240,Abortion incomplete complicated,"Unspecified abortion, incomplete, complicated by delayed or excessive hemorrhage"
2241,Abortion incomplete complicated,"Unspecified abortion, complicated by damage to pelvic organs or tissues, incomplete"
2242,Abortion incomplete complicated,"Unspecified abortion, complicated by renal failure, incomplete"
2243,Abortion incomplete complicated,"Unspecified abortion, complicated by metabolic disorder, incomplete"
2244,Abortion incomplete complicated,"Unspecified abortion, complicated by shock, incomplete"
2245,Abortion incomplete complicated,"Unspecified abortion, incomplete, complicated by embolism"
2246,Abortion incomplete complicated,"Unspecified abortion, with other specified complications, incomplete"
2247,Abortion incomplete complicated,Abortion incomplete complicated
2248,Abortion induced incomplete complicated,Incomplete legal termination of pregnancy with genital tract or pelvic infection
2249,Abortion induced incomplete complicated,Incomplete legal termination of pregnancy with delayed or excessive hemorrhage
2250,Abortion induced incomplete complicated,Incomplete legal termination of pregnancy with damage to pelvic organs or tissues
2251,Abortion induced incomplete complicated,Incomplete legal termination of pregnancy with metabolic disorder
2252,Abortion induced incomplete complicated,Incomplete legal termination of pregnancy with shock
2253,Abortion induced incomplete complicated,"Legally induced abortion, complicated by embolism, incomplete"
2254,Abortion induced incomplete complicated,"Legally induced abortion, with other specified complications, incomplete"
2255,Abortion induced incomplete complicated,"Legally induced abortion, with unspecified complication, incomplete"
2256,Abortion induced incomplete complicated,"Illegally induced abortion, complicated by genital tract and pelvic infection, incomplete"
2257,Abortion induced incomplete complicated,"Illegally induced abortion, complicated by delayed or excessive hemorrhage, incomplete"
2258,Abortion induced incomplete complicated,"Illegally induced abortion, complicated by damage to pelvic organs or tissues, incomplete"
2259,Abortion induced incomplete complicated,"Illegally induced abortion, complicated by renal failure, incomplete"
2260,Abortion induced incomplete complicated,"Illegally induced abortion, complicated by metabolic disorder, incomplete"
2261,Abortion induced incomplete complicated,"Illegally induced abortion, complicated by shock, incomplete"
2262,Abortion induced incomplete complicated,"Illegally induced abortion, complicated by embolism, incomplete"
2263,Abortion induced incomplete complicated,"Illegally induced abortion, with other specified complications, incomplete"
2264,Abortion induced incomplete complicated,"Illegally induced abortion, with unspecified complication, incomplete"
2265,Abortion spontaneous incomplete complicated,"Spontaneous abortion, incomplete, complicated by genital tract and pelvic infection"
2266,Abortion spontaneous incomplete complicated,"Spontaneous abortion, incomplete, complicated by delayed or excessive hemorrhage"
2267,Abortion spontaneous incomplete complicated,"Spontaneous abortion, complicated by damage to pelvic organs or tissues, incomplete"
