,CUI1,CUI2
4946,Hemorrhoids,Residual hemorrhoidal skin tags
4947,Hepatitis,Viral hepatitis A without hepatic coma
4948,Hepatitis,Chronic Persistent Hepatitis
4949,Hepatitis,Other chronic hepatitis
4950,Hepatitis,Hepatic coma due to viral hepatitis A
4951,Hepatitis,Hepatic coma due to viral hepatitis B
4952,Hepatitis,Viral hepatitis B without mention of hepatic coma
4953,Hepatitis,Other specified viral hepatitis with hepatic coma
4954,Hepatitis,Other specified viral hepatitis with hepatic coma
4955,Hepatitis,Hepatitis delta without mention of active hepatitis B disease with hepatic coma
4956,Hepatitis,Hepatitis E with hepatic coma
4957,Hepatitis,Other specified viral hepatitis without mention of hepatic coma
4958,Hepatitis,Other specified viral hepatitis without mention of hepatic coma
4959,Hepatitis,Hepatitis E without mention of hepatic coma
4960,Hepatitis,Hepatic coma due to viral hepatitis
4961,Hepatitis,Unspecified viral hepatitis without hepatic coma
4962,Hepatitis,Hepatitis in viral diseases classified elsewhere
4963,Hepatitis,Hepatitis in other infectious diseases classified elsewhere
4964,Hepatitis,Chronic viral hepatitis C with hepatic coma
4965,Hepatitis,Chronic hepatitis C without mention of hepatic coma
4966,Hepatitis,"Hepatitis, Chronic"
4967,Hepatitis,Hepatitis delta without mention of active hepatitis B disease or hepatic coma
4968,Hepatitis,Hepatitis
4969,Hepatitis,"Viral hepatitis B with hepatic coma, acute or unspecified, with hepatitis delta"
4970,Hepatitis,"Viral hepatitis B with hepatic coma, acute or unspecified, without mention of hepatitis delta"
4971,Hepatitis,"Viral hepatitis B without mention of hepatic coma, acute or unspecified, with hepatitis delta"
4972,Hepatitis,"Viral hepatitis B without mention of hepatic coma, acute or unspecified, without mention of hepatitis delta"
4973,Hepatitis,Acute hepatitis C with hepatic coma
4974,Hepatitis,Acute hepatitis C without mention of hepatic coma
4975,Hepatitis,Unspecified viral hepatitis C with hepatic coma
4976,Hepatitis,Unspecified viral hepatitis C without hepatic coma
4977,HIV Infections,Other deficiency of cell-mediated immunity
4978,HIV Infections,Asymptomatic human immunodeficiency virus [HIV] infection status
4979,HIV Infections,HIV Infections
4980,HIV Infections,"Immunodeficiency with predominant T-cell defect, unspecified"
4981,HIV Infections,Nonspecific serologic evidence of human immunodeficiency virus (HIV)
4982,Hydronephrosis,Hydronephrosis
4983,Hyperkalemia,Hyperkalemia
4984,Hypokalemia,Hypokalemia
4985,Hypotension,Chronic hypotension
4986,Hypotension,"Hypotension, Orthostatic"
4987,Hypotension,Hypotension
4988,Hypotension,Other specified hypotension
4989,Influenza,Influenza with other respiratory manifestations
4990,Influenza,Pneumonia and influenza
4991,Influenza,Influenza with non-respiratory manifestation
4992,Laminectomy,Other exploration and decompression of spinal canal
4993,Laminectomy,Laminectomy site reopening
4994,Laminectomy,Insertion of other spinal devices
4995,Laminectomy,"Insertion of partial spinal disc prosthesis, cervical"
4996,Laminectomy,"Insertion of partial spinal disc prosthesis, lumbosacral"
4997,Laminectomy,"Insertion of spinal disc prosthesis, not otherwise specified"
4998,Laminectomy,"Insertion of spinal disc prosthesis, thoracic"
4999,Laminectomy,"Insertion of total spinal disc prosthesis, cervical"
5000,Laminectomy,"Insertion of total spinal disc prosthesis, lumbosacral"
5001,Laminectomy,"Revision or replacement of artificial spinal disc prosthesis, cervical"
5002,Laminectomy,"Revision or replacement of artificial spinal disc prosthesis, lumbosacral"
5003,Laminectomy,"Revision or replacement of artificial spinal disc prosthesis, not otherwise specified"
5004,Laminectomy,"Revision or replacement of artificial spinal disc prosthesis, thoracic"
5005,Low Back Pain,Low Back Pain
5006,Lymphadenitis,Mesenteric Lymphadenitis
5007,Lymphadenitis,"Lymphadenitis, unspecified, except mesenteric"
5008,Lymphadenitis,Swollen Lymph Node
5009,Lymphadenitis,Chronic lymphadenitis
5010,Lymphadenitis,Acute lymphadenitis
5011,Mammography,Xeromammography
5012,Mammography,Other mammography
5013,Mastectomy,"Radical mastectomy, unilateral"
5014,Mastectomy,Bilateral simple mastectomy
5015,Mastectomy,Bilateral radical mastectomy
5016,Mastectomy,Bilateral extended radical mastectomy
5017,Mastectomy,Bilateral mastectomy extended simple
5018,Mastectomy,Unilateral extended radical mastectomy
5019,Mastectomy,"Extended simple mastectomy, unilateral"
5020,Mastectomy,Simple mastectomy
5021,Melena,Blood in stool
5022,Migraine Disorders,"Variants of migraine, not elsewhere classified, without mention of intractable migraine without mention of status migrainosus"
5023,Migraine Disorders,"Variants of migraine, not elsewhere classified, with intractable migraine, so stated, without mention of status migrainosus"
5024,Migraine Disorders,"Migraine with aura, without mention of intractable migraine without mention of status migrainosus"
5025,Migraine Disorders,Migraine with Aura
5026,Migraine Disorders,"Migraine with aura, with intractable migraine, so stated, without mention of status migrainosus"
5027,Migraine Disorders,"Other forms of migraine, without mention of intractable migraine without mention of status migrainosus"
5028,Migraine Disorders,"Migraine without aura, with intractable migraine, so stated, without mention of status migrainosus"
5029,Migraine Disorders,"Migraine without aura, without mention of intractable migraine without mention of status migrainosus"
5030,Migraine Disorders,Common Migraine
5031,Migraine Disorders,"Variants of migraine, not elsewhere classified"
5032,Migraine Disorders,"Migraine, unspecified, with intractable migraine, so stated, without mention of status migrainosus"
5033,Migraine Disorders,"Other forms of migraine, with intractable migraine, so stated, without mention of status migrainosus"
5034,Migraine Disorders,"Migraine, unspecified, without mention of intractable migraine without mention of status migrainosus"
5035,Migraine Disorders,Other forms of migraine
5036,Migraine Disorders,Migraine Disorders
5037,Mycoses,Aspergillosis
5038,Mycoses,Blastomycosis
5039,Mycoses,Chromoblastomycosis
5040,Mycoses,Infection by Cryptococcus neoformans
5041,Mycoses,Paracoccidioidomycosis
5042,Mycoses,Rhinosporidiosis
5043,Mycoses,Sporotrichosis
5044,Mycoses,Dermatophytosis of scalp and beard
5045,Mycoses,Onychomycosis due to dermatophyte
5046,Mycoses,Dermatophytosis of groin and perianal area
5047,Mycoses,Tinea Pedis
5048,Mycoses,Dermatophytosis of the body
5049,Mycoses,Dermatophytosis
5050,Mycoses,White Piedra
5051,Mycoses,Other specified dermatomycoses
5052,Mycoses,Oral candidiasis
5053,Mycoses,"Candidiasis, Vulvovaginal"
5054,Mycoses,Candidiasis of skin and nails
5055,Mycoses,Other candidiasis of other specified sites
5056,Mycoses,Candidiasis
5057,Mycoses,Other and unspecified mycoses
5058,Mycoses,Opportunistic mycosis
5059,Mycoses,Microsporosis nigra
5060,Mycoses,Lobomycosis
5061,Mycoses,Tinea manus
5062,Mycoses,Deep seated dermatophytosis
5063,Mycoses,Dermatophytosis of other specified sites
5064,Mycoses,Black piedra
5065,Mycoses,Candidiasis of other urogenital sites
5066,Mycoses,Systemic candidiasis
5067,Mycoses,Candidal otitis externa
5068,Mycoses,Primary extrapulmonary coccidioidomycosis
5069,Mycoses,Other forms of progressive coccidioidomycosis
5070,Mycoses,"Infection by Histoplasma capsulatum, without mention of manifestation"
5071,Mycoses,"Infection by Histoplasma duboisii, without mention of manifestation"
5072,Mycoses,Eumycetoma
5073,Mycoses,Tinea Versicolor
5074,Mycoses,Candida enteritis
5075,Mycoses,Candidiasis of the esophagus
5076,Mycoses,Coccidioidomycosis
5077,Mycoses,Dermatomycoses
5078,Mycoses,Allescheriosis
5079,Mycoses,Phaeohyphomycosis
5080,Mycoses,Zygomycosis
5081,Obesity,Morbid obesity
5082,Obesity,Obesity
5083,Obesity,Overweight and obesity
5084,Degenerative polyarthritis,Personal history of arthritis
5085,Osteoporosis,Other osteoporosis
5086,Osteoporosis,Idiopathic osteoporosis
5087,Osteoporosis,Disuse osteoporosis
5088,Osteoporosis,"Osteoporosis, Senile"
5089,Osteoporosis,Osteoporosis
5090,Paralysed,Paraplegia
5091,Paralysed,Other specified infantile cerebral palsy
5092,Paralysed,"Hemiplegia, Flaccid"
5093,Paralysed,"Hemiplegia, Spastic"
5094,Paralysed,"Hemiplegia, Infantile"
5095,Paralysed,Diplegia of upper limbs
5096,Paralysed,Monoplegia of lower limb
5097,Paralysed,Monoplegia of upper limb
5098,Paralysed,Monoplegia
5099,Paralysed,Cauda equina syndrome without neurogenic bladder
5100,Paralysed,Other specified paralytic syndromes
5101,Paralysed,Transient limb paralysis
5102,Paralysed,Hemiplegia
5103,Paralysed,"Hemiplegia, unspecified, affecting dominant side"
5104,Paralysed,"Hemiplegia, unspecified, affecting nondominant side"
5105,Paralysed,"Hemiplegia, unspecified affecting unspecified side"
5106,Paralysed,Infantile cerebral palsy
5107,Paralysed,Locked-In Syndrome
5108,Paralysed,Monoplegia of lower limb affecting dominant side
5109,Paralysed,Monoplegia of lower limb affecting unspecified side
5110,Paralysed,Monoplegia of upper limb of dominant side
5111,Paralysed,Monoplegia of upper limb
5112,Paralysed,Other specified paralytic syndromes
5113,Paralysed,Paralysed
5114,Paralysed,Quadriplegia with quadriparesis
5115,Paralysed,Quadriplegia
5116,Therapeutic radiology procedure,Encounter due to convalescence after radiotherapy
5117,Shock,"Shock, Cardiogenic"
5118,Shock,Other shock without mention of trauma
5119,Shock,Septic Shock
5120,Shock,Shock
5121,Sexual sterilization,Encounter due to tubal ligation status
5122,Sexual sterilization,Encounter due to vasectomy status
5123,Syncope,Syncope
5124,Thrombocytopenia,Thrombocytopenia
5125,Tuberculosis,"Tuberculous pleurisy in primary progressive tuberculosis, bacteriological or histological examination not done"
5126,Tuberculosis,"Tuberculous pleurisy in primary progressive tuberculosis, tubercle bacilli found (in sputum) by microscopy"
5127,Tuberculosis,"Tuberculous pleurisy in primary progressive tuberculosis, tubercle bacilli not found (in sputum) by microscopy, but found by bacterial culture"
5128,Tuberculosis,"Tuberculous pleurisy in primary progressive tuberculosis, tubercle bacilli not found by bacteriological examination, but tuberculosis confirmed histologically"
5129,Tuberculosis,"Other primary progressive tuberculosis, bacteriological or histological examination not done"
5130,Tuberculosis,"Other primary progressive tuberculosis, bacteriological or histological examination unknown (at present)"
5131,Tuberculosis,"Other primary progressive tuberculosis, tubercle bacilli found (in sputum) by microscopy"
5132,Tuberculosis,"Other primary progressive tuberculosis, tubercle bacilli not found (in sputum) by microscopy, but found by bacterial culture"
5133,Tuberculosis,"Other primary progressive tuberculosis, tubercle bacilli not found by bacteriological examination, but tuberculosis confirmed histologically"
5134,Tuberculosis,"Tuberculosis of lung, infiltrative, bacteriological or histological examination not done"
5135,Tuberculosis,"Tuberculosis of lung, infiltrative, bacteriological or histological examination unknown (at present)"
5136,Tuberculosis,"Tuberculosis of lung, infiltrative, tubercle bacilli found (in sputum) by microscopy"
5137,Tuberculosis,"Tuberculosis of lung, infiltrative, tubercle bacilli not found (in sputum) by microscopy, but found by bacterial culture"
5138,Tuberculosis,"Tuberculosis of lung, infiltrative, tubercle bacilli not found by bacteriological examination, but tuberculosis confirmed histologically"
5139,Tuberculosis,"Tuberculosis of lung, nodular, bacteriological or histological examination not done"
5140,Tuberculosis,"Tuberculosis of lung, nodular, bacteriological or histological examination unknown (at present)"
5141,Tuberculosis,"Tuberculosis of lung, nodular, tubercle bacilli found (in sputum) by microscopy"
5142,Tuberculosis,"Tuberculosis of lung, nodular, tubercle bacilli not found (in sputum) by microscopy, but found by bacterial culture"
5143,Tuberculosis,"Tuberculosis of lung, nodular, tubercle bacilli not found by bacteriological examination, but tuberculosis confirmed histologically"
5144,Tuberculosis,"Tuberculosis of lung with cavitation, bacteriological or histological examination not done"
5145,Tuberculosis,"Tuberculosis of lung with cavitation, bacteriological or histological examination unknown (at present)"
5146,Tuberculosis,"Tuberculosis of lung with cavitation, tubercle bacilli found (in sputum) by microscopy"
5147,Tuberculosis,"Tuberculosis of lung with cavitation, tubercle bacilli not found (in sputum) by microscopy, but found by bacterial culture"
5148,Tuberculosis,"Tuberculosis of lung with cavitation, tubercle bacilli not found by bacteriological examination, but tuberculosis confirmed histologically"
5149,Tuberculosis,"Tuberculosis of bronchus, bacteriological or histological examination not done"
5150,Tuberculosis,"Tuberculosis of bronchus, bacteriological or histological examination unknown (at present)"
5151,Tuberculosis,"Tuberculosis of bronchus, tubercle bacilli found (in sputum) by microscopy"
5152,Tuberculosis,"Tuberculosis of bronchus, tubercle bacilli not found (in sputum) by microscopy, but found in bacterial culture"
5153,Tuberculosis,"Tuberculosis of bronchus, tubercle bacilli not found by bacteriological examination, but tuberculosis confirmed histologically"
5154,Tuberculosis,"Tuberculous fibrosis of lung, bacteriological or histological examination not done"
5155,Tuberculosis,"Tuberculous fibrosis of lung, bacteriological or histological examination unknown (at present)"
5156,Tuberculosis,"Tuberculous fibrosis of lung, tubercle bacilli found (in sputum) by microscopy"
5157,Tuberculosis,"Tuberculous fibrosis of lung, tubercle bacilli not found (in sputum) by microscopy, but found by bacterial culture"
5158,Tuberculosis,"Tuberculous fibrosis of lung, tubercle bacilli not found by bacteriological examination, but tuberculosis confirmed histologically"
5159,Tuberculosis,"Tuberculous bronchiectasis, bacteriological or histological examination not done"
5160,Tuberculosis,"Tuberculous bronchiectasis, bacteriological or histological examination unknown (at present)"
5161,Tuberculosis,"Tuberculous bronchiectasis, tubercle bacilli found (in sputum) by microscopy"
5162,Tuberculosis,"Tuberculous bronchiectasis, tubercle bacilli not found (in sputum) by microscopy, but found by bacterial culture"
5163,Tuberculosis,"Tuberculous bronchiectasis, tubercle bacilli not found by bacteriological examination, but tuberculosis confirmed histologically"
5164,Tuberculosis,"Tuberculous pneumothorax, bacteriological or histological examination not done"
5165,Tuberculosis,"Tuberculous pneumothorax, bacteriological or histological examination unknown (at present)"
5166,Tuberculosis,"Tuberculous pneumothorax, tubercle bacilli found (in sputum) by microscopy"
5167,Tuberculosis,"Tuberculous pneumothorax, tubercle bacilli not found (in sputum) by microscopy, but found by bacterial culture"
5168,Tuberculosis,"Tuberculous pneumothorax, tubercle bacilli not found by bacteriological examination, but tuberculosis confirmed histologically"
5169,Tuberculosis,"Other specified pulmonary tuberculosis, bacteriological or histological examination not done"
5170,Tuberculosis,"Other specified pulmonary tuberculosis, bacteriological or histological examination unknown (at present)"
5171,Tuberculosis,"Other specified pulmonary tuberculosis, tubercle bacilli found (in sputum) by microscopy"
5172,Tuberculosis,"Other specified pulmonary tuberculosis, tubercle bacilli not found (in sputum) by microscopy, but found by bacterial culture"
5173,Tuberculosis,"Other specified pulmonary tuberculosis, tubercle bacilli not found by bacteriological examination, but tuberculosis confirmed histologically"
5174,Tuberculosis,"Tuberculous pleurisy, bacteriological or histological examination not done"
5175,Tuberculosis,"Tuberculous pleurisy, bacteriological or histological examination unknown (at present)"
5176,Tuberculosis,"Tuberculous pleurisy, tubercle bacilli found (in sputum) by microscopy"
5177,Tuberculosis,"Tuberculous pleurisy, tubercle bacilli not found (in sputum) by microscopy, but found by bacterial culture"
5178,Tuberculosis,"Tuberculous pleurisy, tubercle bacilli not found by bacteriological examination, but tuberculosis confirmed histologically"
5179,Tuberculosis,"Tuberculosis of intrathoracic lymph nodes, bacteriological or histological examination not done"
5180,Tuberculosis,"Tuberculosis of intrathoracic lymph nodes, bacteriological or histological examination unknown (at present)"
5181,Tuberculosis,"Tuberculosis of intrathoracic lymph nodes, tubercle bacilli found (in sputum) by microscopy"
5182,Tuberculosis,"Tuberculosis of intrathoracic lymph nodes, tubercle bacilli not found (in sputum) by microscopy, but found by bacterial culture"
5183,Tuberculosis,"Tuberculosis of intrathoracic lymph nodes, tubercle bacilli not found by bacteriological examination, but tuberculosis confirmed histologically"
5184,Tuberculosis,"Isolated tracheal or bronchial tuberculosis, bacteriological or histological examination not done"
5185,Tuberculosis,"Isolated tracheal or bronchial tuberculosis, bacteriological or histological examination unknown (at present)"
5186,Tuberculosis,"Isolated tracheal or bronchial tuberculosis, tubercle bacilli found (in sputum) by microscopy"
5187,Tuberculosis,"Isolated tracheal or bronchial tuberculosis, tubercle bacilli not found (in sputum) by microscopy, but found by bacterial culture"
5188,Tuberculosis,"Isolated tracheal or bronchial tuberculosis, tubercle bacilli not found by bacteriological examination, but tuberculosis confirmed histologically"
5189,Tuberculosis,"Tuberculous laryngitis, bacteriological or histological examination not done"
5190,Tuberculosis,"Tuberculous laryngitis, bacteriological or histological examination unknown (at present)"
5191,Tuberculosis,"Tuberculous laryngitis, tubercle bacilli found (in sputum) by microscopy"
5192,Tuberculosis,"Tuberculous laryngitis, tubercle bacilli not found (in sputum) by microscopy, but found by bacterial culture"
5193,Tuberculosis,"Tuberculous laryngitis, tubercle bacilli not found by bacteriological examination, but tuberculosis confirmed histologically"
5194,Tuberculosis,"Other specified respiratory tuberculosis, bacteriological or histological examination not done"
5195,Tuberculosis,"Other specified respiratory tuberculosis, bacteriological or histological examination unknown (at present)"
5196,Tuberculosis,"Other specified respiratory tuberculosis, tubercle bacilli found (in sputum) by microscopy"
5197,Tuberculosis,"Other specified respiratory tuberculosis, tubercle bacilli not found (in sputum) by microscopy, but found by bacterial culture"
5198,Tuberculosis,"Other specified respiratory tuberculosis, tubercle bacilli not found by bacteriological examination, but tuberculosis confirmed histologically"
5199,Tuberculosis,"Tuberculous meningitis, bacteriological or histological examination not done"
5200,Tuberculosis,"Tuberculous meningitis, bacteriological or histological examination unknown (at present)"
5201,Tuberculosis,"Tuberculous meningitis, tubercle bacilli found (in sputum) by microscopy"
5202,Tuberculosis,"Tuberculous meningitis, tubercle bacilli not found (in sputum) by microscopy, but found by bacterial culture"
5203,Tuberculosis,"Tuberculous meningitis, tubercle bacilli not found by bacteriological examination, but tuberculosis confirmed histologically"
5204,Tuberculosis,"Tuberculoma of meninges, bacteriological or histological examination not done"
5205,Tuberculosis,"Tuberculoma of meninges, bacteriological or histological examination unknown (at present)"
5206,Tuberculosis,"Tuberculoma of meninges, tubercle bacilli found (in sputum) by microscopy"
5207,Tuberculosis,"Tuberculoma of meninges, tubercle bacilli not found (in sputum) by microscopy, but found by bacterial culture"
5208,Tuberculosis,"Tuberculoma of meninges, tubercle bacilli not found by bacteriological examination, but tuberculosis confirmed histologically"
5209,Tuberculosis,"Tuberculoma of brain, bacteriological or histological examination not done"
5210,Tuberculosis,"Tuberculoma of brain, bacteriological or histological examination unknown (at present)"
5211,Tuberculosis,"Tuberculoma of brain, tubercle bacilli found (in sputum) by microscopy"
5212,Tuberculosis,"Tuberculoma of brain, tubercle bacilli not found (in sputum) by microscopy, but found by bacterial culture"
5213,Tuberculosis,"Tuberculoma of brain, tubercle bacilli not found by bacteriological examination, but tuberculosis confirmed histologically"
5214,Tuberculosis,"Tuberculous abscess of brain, bacteriological or histological examination not done"
5215,Tuberculosis,"Tuberculous abscess of brain, bacteriological or histological examination unknown (at present)"
5216,Tuberculosis,"Tuberculous abscess of brain, tubercle bacilli found (in sputum) by microscopy"
5217,Tuberculosis,"Tuberculous abscess of brain, tubercle bacilli not found (in sputum) by microscopy, but found by bacterial culture"
5218,Tuberculosis,"Tuberculous abscess of brain, tubercle bacilli not found by bacteriological examination, but tuberculosis confirmed histologically"
5219,Tuberculosis,"Tuberculoma of spinal cord, bacteriological or histological examination not done"
5220,Tuberculosis,"Tuberculoma of spinal cord, bacteriological or histological examination unknown (at present)"
5221,Tuberculosis,"Tuberculoma of spinal cord, tubercle bacilli found (in sputum) by microscopy"
5222,Tuberculosis,"Tuberculoma of spinal cord, tubercle bacilli not found (in sputum) by microscopy, but found by bacterial culture"
5223,Tuberculosis,"Tuberculoma of spinal cord, tubercle bacilli not found by bacteriological examination, but tuberculosis confirmed histologically"
5224,Tuberculosis,"Tuberculous abscess of spinal cord, bacteriological or histological examination not done"
5225,Tuberculosis,"Tuberculous abscess of spinal cord, bacteriological or histological examination unknown (at present)"
5226,Tuberculosis,"Tuberculous abscess of spinal cord, tubercle bacilli found (in sputum) by microscopy"
5227,Tuberculosis,"Tuberculous abscess of spinal cord, tubercle bacilli not found (in sputum) by microscopy, but found by bacterial culture"
5228,Tuberculosis,"Tuberculous abscess of spinal cord, tubercle bacilli not found by bacteriological examination, but tuberculosis confirmed histologically"
5229,Tuberculosis,"Tuberculous encephalitis or myelitis, bacteriological or histological examination not done"
5230,Tuberculosis,"Tuberculous encephalitis or myelitis, bacteriological or histological examination unknown (at present)"
5231,Tuberculosis,"Tuberculous encephalitis or myelitis, tubercle bacilli found (in sputum) by microscopy"
5232,Tuberculosis,"Tuberculous encephalitis or myelitis, tubercle bacilli not found (in sputum) by microscopy, but found by bacterial culture"
5233,Tuberculosis,"Tuberculous encephalitis or myelitis, tubercle bacilli not found by bacteriological examination, but tuberculosis confirmed histologically"
5234,Tuberculosis,"Other specified tuberculosis of central nervous system, bacteriological or histological examination not done"
5235,Tuberculosis,"Other specified tuberculosis of central nervous system, bacteriological or histological examination unknown (at present)"
5236,Tuberculosis,"Other specified tuberculosis of central nervous system, tubercle bacilli found (in sputum) by microscopy"
5237,Tuberculosis,"Other specified tuberculosis of central nervous system, tubercle bacilli not found (in sputum) by microscopy, but found by bacterial culture"
5238,Tuberculosis,"Other specified tuberculosis of central nervous system, tubercle bacilli not found by bacteriological examination, but tuberculosis confirmed histologically"
5239,Tuberculosis,"Unspecified tuberculosis of central nervous system, bacteriological or histological examination not done"
5240,Tuberculosis,"Unspecified tuberculosis of central nervous system, bacteriological or histological examination unknown (at present)"
5241,Tuberculosis,"Unspecified tuberculosis of central nervous system, tubercle bacilli found (in sputum) by microscopy"
5242,Tuberculosis,"Unspecified tuberculosis of central nervous system, tubercle bacilli not found (in sputum) by microscopy, but found by bacterial culture"
5243,Tuberculosis,"Unspecified tuberculosis of central nervous system, tubercle bacilli not found by bacteriological examination, but tuberculosis confirmed histologically"
5244,Tuberculosis,"Tuberculous peritonitis, bacteriological or histological examination not done"
5245,Tuberculosis,"Tuberculous peritonitis, bacteriological or histological examination unknown (at present)"
5246,Tuberculosis,"Tuberculous peritonitis, tubercle bacilli found (in sputum) by microscopy"
5247,Tuberculosis,"Tuberculous peritonitis, tubercle bacilli not found (in sputum) by microscopy, but found by bacterial culture"
5248,Tuberculosis,"Tuberculous peritonitis, tubercle bacilli not found by bacteriological examination, but tuberculosis confirmed histologically"
5249,Tuberculosis,"Tuberculosis of vertebral column, bacteriological or histological examination not done"
5250,Tuberculosis,"Tuberculosis of vertebral column, bacteriological or histological examination unknown (at present)"
5251,Tuberculosis,"Tuberculosis of vertebral column, tubercle bacilli found (in sputum) by microscopy"
