,CUI1,CUI2
0,Post-Traumatic Stress Disorder,Prolonged post-traumatic stress disorder
1,Body Dysmorphic Disorders,Body Dysmorphic Disorders
2,Typhoid Fever,Typhoid and paratyphoid fevers
3,Cat-Scratch Disease,Cat-Scratch Disease
4,Enterovirus Infections,Enteritis due to enterovirus not elsewhere classified
5,Echinococcosis,"Echinococcus granulosus infection, other"
6,Echinococcosis,"Echinococcus multilocularis infection, other sites"
7,Echinococcosis,"Echinococcosis, other and unspecified"
8,Trichomonas Infections,Trichomoniasis of other specified sites
9,Rheumatoid Arthritis,Rheumatoid arthritis and other inflammatory polyarthropathies
10,Rheumatoid Arthritis,Other rheumatoid arthritis with visceral or systemic involvement
11,Rheumatoid Arthritis,Jaccoud's syndrome
12,Rheumatoid Arthritis,Rheumatoid Arthritis
13,Rheumatoid Arthritis,Rheumatoid Arthritis
14,Ankylosing spondylitis,Ankylosing spondylitis and other inflammatory spondylopathies
15,Ankylosing spondylitis,Ankylosing spondylitis
16,Renal tubular acidosis,Distal Renal Tubular Acidosis
17,Renal tubular acidosis,Primary RTA
18,Renal tubular acidosis,"Renal Tubular Acidosis, Type II"
19,Essential Hypertension,"Benign essential hypertension complicating pregnancy, childbirth and the puerperium"
20,Essential Hypertension,"Benign essential hypertension complicating pregnancy, childbirth, and the puerperium, delivered, with or without mention of antepartum condition"
21,Essential Hypertension,"Benign essential hypertension, complicating pregnancy, childbirth, and the puerperium, delivered, with mention of postpartum complication"
22,Essential Hypertension,"Benign essential hypertension complicating pregnancy, childbirth, and the puerperium, unspecified as"
23,Essential Hypertension,"Benign essential hypertension complicating pregnancy, childbirth, and the puerperium, unspecified as"
24,Paraneoplastic Syndromes,Paraneoplastic Syndromes
25,Uterine Cervical Incompetence,"Cervical incompetence complicating pregnancy, childbirth, or the puerperium"
26,Uterine Cervical Incompetence,"Cervical incompetence, unspecified as to episode of care or not applicable"
27,Uterine Cervical Incompetence,Cervical incompetence - delivered
28,Uterine Cervical Incompetence,"Cervical incompetence, delivered, with mention of postpartum complication"
29,Uterine Cervical Incompetence,"Cervical incompetence, antepartum condition or complication"
30,Uterine Cervical Incompetence,"Cervical incompetence, postpartum condition or complication"
31,Uterine Cervical Incompetence,Fetal or neonatal effect of incompetent cervix
32,Dysuria,Urinary spray
33,"Tachycardia, Ventricular",Tidal Volume
34,"Tachycardia, Ventricular","Tachycardia, Ventricular"
35,Sense of smell altered,smell and taste disorder
36,Sense of smell altered,smell and taste disorder
37,Sense of smell altered,Dysosmia
38,Brain Concussion,Concussion with less than 1 hour loss of consciousness
39,Brain Concussion,Concussion with 1-24 hours loss of consciousness
40,Brain Concussion,Concussion with prolonged loss of consciousness and return to pre-existing conscious level
41,Brain Concussion,"Concussion with prolonged loss of consciousness, without return to pre-existing conscious level"
42,Brain Concussion,Concussion with loss of consciousness
43,Brain Concussion,concussion with open intracranial wound
44,Agitation,Discomposure marked
45,Agitation,Discomposure marked
46,Phobic anxiety disorder,Other isolated or simple phobias
47,Phobic anxiety disorder,Phobic anxiety disorder
48,Phobic anxiety disorder,Phobic anxiety disorder
49,Dyslexia,Other specific developmental reading disorder
50,Precocious Puberty,"Precocious sexual development and puberty, NEC in MDR22_0"
51,Oral contraception,Oral contraception
52,Photopsia,Shifting vision
53,Suicide attempt,Suicide attempt by drug overdose
54,Blast Injuries,Blast Injuries
55,Blast Injuries,Blast Injuries
56,Blast Injuries,Blast Injuries
57,furuncle,Furunculosis
58,furuncle,Furuncle (excl genital)
59,Cicatrix,Scar conditions and fibrosis of skin
60,Pterygium of eye,"Peripheral pterygium, progressive"
61,Hyperkeratosis,Skin callus
62,Hyperkeratosis,Corns and callosities
63,Lichenification,Lichenification and lichen simplex chronicus
64,West Syndrome,"Infantile spasms, without mention of intractable epilepsy"
65,West Syndrome,Hypsarrhythmia
66,Raynaud Phenomenon,Raynaud Phenomenon
67,Bence-Jones proteinuria,Bence Jones protein urine absent
68,Bence-Jones proteinuria,Bence Jones protein urine present
69,Arthralgia,"Pain in a joint, pelvic region and thigh"
70,Arthralgia,"Pain in a joint, ankle and foot"
71,Arthralgia,"Pain in joint, other specified sites"
72,Arthralgia,Polyarthralgia
73,Arthralgia,Shoulder joint pain associated with
74,Arthralgia,Pain in (l) elbow
75,Arthralgia,Pain in (r) elbow
76,Arthralgia,Pain in (l) hip
77,Arthralgia,Pain in (r) hip
78,Arthralgia,Aching (l) knee
79,Arthralgia,Aching (r) knee
80,Cataract associated with radiation,Cataract associated with radiation and other physical influences
81,Syndactyly,Polysyndactyly
82,Syndactyly,Web bad fingers
83,Patent ductus arteriosus - persisting type,Patent ductus arteriosus - persisting type
84,Patent ductus arteriosus - persisting type,Patent ductus arteriosus - persisting type
85,Nephrolithiasis,Calculus of kidney and ureter
86,Gastric ulcer,"Gastric ulcer, unspecified as acute or chronic, without mention of hemorrhage or perforation, without mention of obstruction"
87,Gastric ulcer,"Acute gastric ulcer without hemorrhage, without perforation AND without obstruction"
88,Gastric ulcer,"Chronic gastric ulcer without mention of hemorrhage or perforation, without mention of obstruction"
89,Gastric ulcer,"Gastric ulcer, unspecified as acute or chronic, without mention of hemorrhage or perforation, without mention of obstruction"
90,Gastric ulcer,"Gastric ulcer, unspecified as acute or chronic, without mention of hemorrhage or perforation, with obstruction"
91,Gastric ulcer,"Gastric ulcer, unspecified as acute or chronic, without mention of hemorrhage or perforation, with obstruction"
92,Gastric ulcer,"Gastric ulcer, unspecified as acute or chronic, without mention of hemorrhage and perforation"
93,Gastric ulcer,"Chronic gastric ulcer without mention of hemorrhage or perforation, without mention of obstruction"
94,Gastric ulcer,"Gastric ulcer, unspecified as acute or chronic, without mention of hemorrhage or perforation, with obstruction"
95,Gastric ulcer,"Gastric ulcer, unspecified as acute or chronic, without mention of hemorrhage and perforation"
96,Tympanosclerosis,Tympanosclerosis
97,Tympanosclerosis,Tympanosclerosis involving tympanic membrane AND ear ossicles
98,Tympanosclerosis,"Tympanosclerosis involving tympanic membrane, ear ossicles AND middle ear"
99,Tympanosclerosis,Tympanosclerosis involving other combination of structures
100,Pulmonary Infarction,Pulmonary embolism with pulmonary infarction
101,Pulmonary Infarction,Infarction of lung due to iatrogenic pulmonary embolism
102,Pulmonary Infarction,Other pulmonary embolism and infarction
103,Xerostomia,Mouth drawn
104,Xerostomia,Mouth shriveled
105,Lymphadenopathy,Lymphadenopathy
106,Lymphadenopathy,Mucocutaneous lymph node
107,Bacterial sepsis,Septicemia due to other Gram-negative organisms
108,Bacterial sepsis,Septicemia due to other Gram-negative organisms
109,Bacterial sepsis,Septicemia due to other Gram-negative organisms
110,Non-venereal endemic syphilis,Non-venereal endemic syphilis
111,Staphylococcal Infections,Bacterial infection due to other staphylococcus
112,Staphylococcal Infections,Unspecified Staphylococcus infection in conditions classified elsewhere and of unspecified site
113,Staphylococcal Infections,MRSA - Methicillin resistant Staphylococcus aureus infection
114,Reiter Syndrome,"Arthropathy associated with Reiter's disease and nonspecific urethritis, site unspecified"
115,Reiter Syndrome,"Arthropathy associated with Reiter's disease and nonspecific urethritis, site unspecified"
116,Reiter Syndrome,"Arthropathy associated with Reiter's disease and nonspecific urethritis, shoulder region"
117,Reiter Syndrome,"Arthropathy associated with Reiter's disease and nonspecific urethritis, upper arm"
118,Reiter Syndrome,"Arthropathy associated with Reiter's disease and nonspecific urethritis, forearm"
119,Reiter Syndrome,"Arthropathy associated with Reiter's disease and nonspecific urethritis, hand"
120,Reiter Syndrome,"Arthropathy associated with Reiter's disease and nonspecific urethritis, lower leg"
121,Reiter Syndrome,"Arthropathy associated with Reiter's disease and nonspecific urethritis, ankle and foot"
122,Reiter Syndrome,"Arthropathy associated with Reiter's disease and nonspecific urethritis, multiple sites"
123,Reiter Syndrome,Arthropathy associated with Reiter's disease and allied conditions
124,Reiter Syndrome,"Arthropathy associated with Reiter's disease and nonspecific urethritis, pelvic region and thigh"
125,Reiter Syndrome,"Arthropathy associated with Reiter's disease and nonspecific urethritis, other specified sites"
126,Reiter Syndrome,"Arthropathy associated with Reiter's disease and nonspecific urethritis, pelvic region and thigh"
127,Reiter Syndrome,"Arthropathy associated with Reiter's disease and nonspecific urethritis, other specified sites"
128,Bullous pemphigoid,Benign mucous membrane pemphigoid without mention of ocular involvement
129,Bullous pemphigoid,Benign mucous membrane pemphigoid with ocular involvement
130,Bullous pemphigoid,Cicatricial mucous mem. pemphig.
131,Myopathy,Other myopathies
132,Myopathy,Symptomatic inflammatory myopathy associated with another disorder
133,Malaise,Malaise and fatigue
134,Malaise,Malaise
135,Malaise,Malaise
136,Malaise,Stamina decreased
137,Heat Stroke,Heat stroke and sunstroke
138,Electrolyte imbalance,Hypocalcemia and hypomagnesemia of newborn
139,Electrolyte imbalance,Other transitory neonatal electrolyte disturbance
140,Electrolyte imbalance,Electrolyte and fluid disorders NEC in MDR22_0
141,Electrolyte imbalance,Hypocalcemia and hypomagnesemia of newborn
142,Malabsorption Syndrome,Other specified intestinal malabsorption
143,Neurogenic Urinary Bladder,Neurogenic Urinary Bladder
144,Increased frequency of micturition,Urgency of micturition
145,Increased frequency of micturition,Increased frequency of micturition
146,Unconscious State,Loss of consciousness NEC
147,Unconscious State,Unconscious State
148,Unconscious State,Syncope
149,Unconscious State,Unconscious State
150,Traumatic injury,Other early complications of trauma
151,Traumatic injury,Other and unspecified injury to face and neck
152,Traumatic injury,Other and unspecified injury to trunk
153,Traumatic injury,"Other specified sites, including multiple injury"
154,Traumatic injury,Unspecified site injury
155,Traumatic injury,Other and unspecified external effect causes
156,Traumatic injury,Other and unspecified external effect causes
157,Traumatic injury,late effects of musculoskeletal and connective tissue injury
158,Traumatic injury,Late effects of other and unspecified injuries
159,Traumatic injury,late effects of certain complications of trauma
160,Traumatic injury,Late effect of external cause
161,Traumatic injury,Late effect of certain other external causes
162,Traumatic injury,Late effect of external cause
163,Traumatic injury,"Other and unspecified superficial injury of foot and toes, without mention of infection"
164,Traumatic injury,"Superficial injuries of other, multiple, and unspecified sites"
165,Traumatic injury,Certain early complications of trauma
166,Traumatic injury,"Injury, other and unspecified"
167,Traumatic injury,"Oth and unspec superficial inj of hip, thigh, leg, and ankle, w/o ment of infec"
168,Traumatic injury,"Other and unspec superficial injury of other, multiple, and unspec sites w/o mention of infection"
169,Traumatic injury,Non-accidental injury
170,Birth Injuries,Other specified birth injuries
171,Birth Injuries,Birth Injuries
172,Birth Injuries,Birth Injuries
173,Thermal burn,"late effects of burn of eye, head, face and neck"
174,Thermal burn,Disorder due to and following burn of wrist and hand
175,Thermal burn,"late effect of burns of extremities, excluding wrist and hand"
176,Thermal burn,Late effect of burns of other specified sites
177,Thermal burn,"Burn of face, head AND/OR neck"
178,Thermal burn,"Burn of unspecified degree of face and head, unspecified site"
179,Thermal burn,Burn of unspecified degree of forehead and cheek
180,Thermal burn,"Burn of unspecified degree of multiple sites [except with eye] of face, head, and neck"
181,Thermal burn,Burn of unspecified degree of other and multiple sites of trunk
182,Thermal burn,Burn of wrist(s) and hand(s)
183,Thermal burn,Burn of unspecified degree of single digit (finger (nail) other than thumb
184,Thermal burn,Burn of unspecified degree of thumb (nail)
185,Thermal burn,Burn of unspecified degree of multiple sites of wrist(s) and hand(s)
186,Thermal burn,Burn of unspecified degree of toe(s) (nail)
187,Thermal burn,Burns classified according to percentage of body surface involved
188,Thermal burn,Burn any degree involving less than 10 percent of body surface
189,Thermal burn,Burn any degree involving 10-19 percent of body surface
190,Thermal burn,Burn any degree involving 20-29 percent of body surface
191,Thermal burn,Burn any degree involving 30-39 percent of body surface
192,Thermal burn,Burn any degree involving 40-49 percent of body surface
193,Thermal burn,Burn any degree involving 50-59 percent of body surface
194,Thermal burn,Burn any degree involving 60-69 percent of body surface
195,Thermal burn,Burn any degree involving 70-79 percent of body surface
196,Thermal burn,Burn any degree involving 80-89 percent of body surface
197,Thermal burn,Burn any degree involving 90 percent OR more of body surface
198,Thermal burn,Burn of unspecified degree of head and neck
199,Thermal burn,Unspecified thickness burn of the wrist or hand
200,Thermal burn,Burn any degree involving 90 percent OR more of body surface
201,Contusions,Late effect of contusion
202,Contusions,"Contusion of face, scalp and neck, excluding eye(s)"
203,Contusions,"Contusion, shoulder or upper arm"
204,Contusions,"Contusion, shoulder and upper arm, multiple sites"
205,Contusions,Contusion of elbow and forearm
206,Contusions,"Contusion of wrist and hand(s), except finger(s) alone"
207,Contusions,Contusion of lower limb and of other and unspecified sites
208,Contusions,"Contusion, hip and thigh"
209,Contusions,"Contusion, knee and lower leg"
210,Contusions,"Contusion, ankle and foot, excluding toe(s)"
211,Contusions,"Contusion of multiple sites, NEC in MDR22_0"
212,Anastomotic ulcer,"Gastrojejunal ulcer, unspecified as acute or chronic, without hemorrhage or perforation"
213,Anastomotic ulcer,"Gastrojejunal ulcer, unspecified as acute or chronic, without hemorrhage or perforation"
214,Anastomotic ulcer,"Gastrojejunal ulcer, unspecified as acute or chronic, without mention of hemorrhage or perforation, without mention of obstruction"
215,Anastomotic ulcer,"Acute gastrojejunal ulcer without hemorrhage, without perforation AND without obstruction"
216,Anastomotic ulcer,"Chronic gastrojejunal ulcer without hemorrhage, without perforation AND without obstruction"
217,Anastomotic ulcer,Gastrojejunal ulcer
218,Lichen Sclerosus et Atrophicus,Lichen Sclerosus et Atrophicus
219,Acromegaly,Gigantism and acromegaly
220,Actinomycosis,Actinomycosis
221,Actinomycosis,Actinomycotic infection of other specified sites
222,Aggressive behavior,"Undersocialized conduct disorder, aggressive type, mild"
223,Aggressive behavior,"Undersocialized conduct disorder, aggressive type, moderate"
224,Aggressive behavior,"Undersocialized conduct disorder, aggressive type, severe"
225,Aggressive behavior,"Undersocialized conduct disorder, aggressive type, unspecified"
226,Aggressive behavior,Challenging attitude
227,"Alcoholic Intoxication, Chronic","Other and unspecified alcohol dependence, unspecified"
228,"Alcoholic Intoxication, Chronic","Other and unspecified alcohol dependence, unspecified"
229,"Alcoholic Intoxication, Chronic","Other and unspecified alcohol dependence, continuous"
230,"Alcoholic Intoxication, Chronic","Other and unspecified alcohol dependence, episodic"
231,"Alcoholic Intoxication, Chronic","Other and unspecified alcohol dependence, in remission"
232,Alopecia,Other alopecia
233,Amnesia,Amnesia NEC
234,Anencephaly,Anencephalus and similar anomalies
235,Aneurysm,Aneurysm of other specified arteries
236,Aneurysm,Other aneurysm
237,Aneurysm,Aneurysm of other visceral artery
238,Aneurysm,vascular aneurysm
239,Aneurysm,vascular aneurysm
240,Anger,driven mad
241,Aniridia,Aniridia
242,Anisometropia,Anisometropia and aniseikonia
243,Anthrax disease,Other specified manifestations of anthrax
244,Anuria,Oliguria and anuria
245,Anxiety,Anxiety state
246,Anxiety,Other anxiety states
247,Anxiety,Alarm (not alarm reaction)
248,Anxiety,Face anguish
249,Anxiety,Anxiety NEC
250,Aphakia,Aphakia and other disorders of lens
251,Appendicitis,Acute appendicitis without mention of peritonitis
252,Appendicitis,Other appendicitis
253,Arthroscopy,Post-arthroscopy
254,Asthenia,Neurasthenia
255,Ataxia,Ataxia NEC
256,Automatism,Automatism NEC
257,Azoospermia,Azoospermia
258,Bacteriuria,Bacteriuria NOS absent
259,Bacteriuria,Bacteriuria NOS present
260,Blepharitis,Other inflammations of eyelids
261,Blindness,Blindness both eyes NOS (disorder)
262,Blindness,blindness or low vision (non-specific)
263,Blindness,Better eye: total vision impairment; lesser eye: total vision impairment
264,Blindness,Impairment level: better eye: near-total impairment: lesser-eye: not further specified
265,Blindness,"Better eye: near total visual impairment, Lesser eye: total visual impairment"
266,Blindness,"Better eye: near total visual impairment, Lesser eye: near total visual impairment"
267,Blindness,Impairment level: better eye: profound impairment: lesser eye: not further specified
268,Blindness,Impairment level: better eye: profound impairment: lesser eye: total impairment
269,Blindness,"Better eye: profound visual impairment, Lesser eye: near total visual impairment"
270,Blindness,"Better eye: profound visual impairment, Lesser eye: profound visual impairment"
271,Blindness,"Better eye: low vision, Lesser eye: profound visual impairment"
272,Blindness,"Impairment level: blindness, one eye - low vision other eye"
273,Blindness,"Impairment level: better eye: severe impairment: lesser eye: blind, not further specified"
274,Blindness,"Better eye: severe visual impairment, Lesser eye: total visual impairment"
275,Blindness,Impairment level: better eye: severe impairment: lesser eye: near-total impairment
276,Blindness,"Better eye: severe visual impairment, Lesser eye: profound visual impairment"
277,Blindness,"Impairment level: better eye: moderate impairment: lesser eye: blind, not further specified"
278,Blindness,"Better eye: moderate visual impairment, Lesser eye: total visual impairment"
279,Blindness,"Better eye: moderate visual impairment, Lesser eye: near total visual impairment"
280,Blindness,"Better eye: moderate visual impairment, Lesser eye: profound visual impairment"
281,Blindness,"Moderate or severe vision impairment, both eyes"
282,Blindness,Impairment level not further specified
283,Blindness,Impairment level: better eye: severe impairment: lesser eye: not further specified
284,Blindness,"Better eye: severe visual impairment, Lesser eye: severe visual impairment"
285,Blindness,Impairment level: better eye: moderate impairment: lesser eye: not further specified
286,Blindness,"Better eye: moderate visual impairment, Lesser eye: severe visual impairment"
287,Blindness,Impairment level: one eye: total impairment: other eye: not specified
288,Blindness,One eye: total vision impairment; other eye: near-normal vision
289,Blindness,Impairment level: one eye: total impairment: other eye: normal vision
290,Blindness,Impairment level: one eye: near-total impairment: other eye: not specified
291,Blindness,Impairment level: one eye: near-total impairment: other eye: near-normal vision
292,Blindness,One eye: near-total vision impairment; other eye: normal vision
293,Blindness,Impairment level: one eye: profound impairment: other eye: not specified (disorder)
294,Blindness,Impairment level: one eye: profound impairment: other eye: near-normal vision
295,Blindness,Impairment level: one eye: profound impairment: other eye: normal vision
296,Blindness,Impairment level: one eye: severe impairment: other eye: not specified
297,Blindness,Impairment level: one eye: severe impairment: other eye: near-normal vision
298,Blindness,Impairment level: one eye: severe impairment: other eye: normal vision
299,Blindness,"Low vision, both eyes"
300,Blindness,"Better eye: moderate vision impairment; unqualified visual loss, both eyes"
301,Blindness,Vision impairment of lesser eye
302,Bulla,"Blister of other, multiple, and unspecified sites, without mention of infection"
303,Bulla,"Blister of face, neck, and scalp except eye, without mention of infection"
304,Bulla,"Blister of trunk, without mention of infection"
305,Bulla,"Blister of shoulder and upper arm, without mention of infection"
306,Bulla,"Blister of elbow, forearm, and wrist, without mention of infection"
307,Bulla,"Blister of hand(s) except finger(s) alone, without mention of infection"
308,Bulla,"Blister of hip, thigh, leg, and ankle, without mention of infection"
309,Bulla,"Blister of foot and toe(s), without mention of infection"
310,Brucellosis,Other brucellosis
311,Brucellosis,Brucellosis
312,Bursitis,Other bursitis
313,Bursitis,Specific bursitis often of occupational origin
314,Calcinosis,"Calcification and ossification, unspecified"
315,carbuncle,Carbuncle and furuncle of unspecified site
316,carbuncle,Carbuncle/furuncle
317,carbuncle,Carbuncle and furuncle of face
318,carbuncle,Carbuncle and furuncle of neck
319,carbuncle,Carbuncle and furuncle of trunk
320,carbuncle,Carbuncle and furuncle of upper arm and forearm
321,carbuncle,Carbuncle and furuncle of hand
322,carbuncle,Carbuncle and furuncle of buttock
323,carbuncle,"Carbuncle and furuncle of leg, except foot"
324,carbuncle,Carbuncle and furuncle of foot
325,carbuncle,Carbuncle and furuncle of other specified sites
326,carbuncle,Carbuncle & furuncle (exc genital)
327,carbuncle,Carbuncle (excl genital) NOS
328,Esophageal Achalasia,Esophageal Achalasia
329,Cataract,Other cataract
330,Cataract,"Infantile, juvenile and presenile cataract"
331,Cataract,"Cortical, lamellar, or zonular nonsenile cataract"
332,Cataract,Other and combined forms of nonsenile cataract
333,Cataract,Mature cataract
334,Cataract,Other and combined forms of senile cataract
335,Cataract,Cataract secondary to ocular disorder
336,Cataract,Cataract secondary to glaucomatous flecks (subcapsular)
337,Cataract,Cataract due to inflammatory disorder
338,Cataract,Cataract in degenerative ocular disorders
339,Cataract,Cataract associated with other syndromes
340,Cataract,Cataract associated with other syndromes
341,Cataract,Nonsenile cataract
342,Cataract,Cataract NEC in MDR
343,Cellulitis,Cellulitis and abscess of oral soft tissues
344,Cellulitis,Cellulitis and abscess of unspecified digit
345,Cellulitis,Cellulitis and abscess NOS (disorder)
346,Cellulitis,Cellulitis and abscess of finger and toe
347,Cellulitis,Cellulitis and abscess of finger
348,Cellulitis,Cellulitis and abscess of toe
349,Cellulitis,Other cellulitis and abscess
350,Cellulitis,Cellulitis and abscess of face
351,Cellulitis,Cellulitis and abscess of neck
352,Cellulitis,Cellulitis and abscess of trunk
353,Cellulitis,Cellulitis and abscess of upper arm and forearm
354,Cellulitis,Cellulitis and abscess of hand excluding digits
355,Cellulitis,Cellulitis and abscess of buttock
356,Cellulitis,"Cellulitis and abscess of leg, except foot"
357,Cellulitis,Cellulitis and abscess of foot excluding toe
358,Cellulitis,Cellulitis and abscess of other specified sites
359,Cellulitis,Cellulitis and abscess of finger
360,Cellulitis,"Celulitis and abcess of toe, unspecified"
361,Cellulitis,"Cellulitis and abscess of hand, except fingers"
362,Cellulitis,Other cellulitis and abscess
363,Cholelithiasis,Gallbladder calculus without mention of cholecystitis and no obstruction
364,Cholesteatoma,Cholesteatoma of middle ear and mastoid structure
365,Cholesteatoma,Diffuse cholesteatosis of middle ear and mastoid
366,Cholesteatoma,Cholesteatoma of middle ear and mastoid not elsewhere classified
367,Chorioretinitis,Focal chorioretinitis
368,Chorioretinitis,Juxtapapillary focal choroiditis AND chorioretinitis
369,Chorioretinitis,Focal choroiditis AND chorioretinitis of other posterior pole
370,Chorioretinitis,Peripheral focal choroiditis AND chorioretinitis
371,Chorioretinitis,Juxtapapillary focal retinitis AND retinochoroiditis
372,Chorioretinitis,"Focal retinitis and retinochoroiditis, macular or paramacular"
373,Chorioretinitis,Focal retinitis AND retinochoroiditis of other posterior pole
374,Chorioretinitis,Peripheral focal retinitis AND retinochoroiditis
375,Chorioretinitis,"Disseminated choroiditis AND chorioretinitis, posterior pole"
376,Chorioretinitis,Peripheral disseminated choroiditis AND chorioretinitis
377,Chorioretinitis,Generalized disseminated choroiditis AND chorioretinitis
378,Chorioretinitis,Metastatic disseminated retinitis AND retinochoroiditis
379,Chorioretinitis,Acute Posterior Multifocal Placoid Pigment Epitheliopathy
380,Chorioretinitis,Other chorioretinitis and retinochoroiditis
381,Chorioretinitis,Chorioretinitis
