,CUI1,CUI2
7264,No abnormality detected by assessment of physical health,Abnormal finding on evaluation procedure
7265,No hemosiderin pigmentation,Skin pigmentation due to hemosiderosis
7266,Caregiver unaware of prognosis,Aware of prognosis
7267,Suspected angle-closure glaucoma,Angle Closure Glaucoma
7268,Maternal history of non-insulin dependent diabetes mellitus,Diabetes Mellitus
7269,History of pathological fracture,Pathological fracture
7270,No blanching of skin of foot on elevation of foot,Blanching of skin of foot on elevation
7271,History of pathological vertebral fracture,Spinal Fractures
7272,Hydrops fetalis not present,Hydrops Fetalis
7273,No abnormality of fetal heart detected,Abnormality of fetal heart
7274,H/O: injury,Traumatic injury
7275,No abnormality detected by mental health assessment,Disease
7276,History of pathological hip fracture,Fracture of proximal end of femur
7277,No cutaneous papillomatosis,Cutaneous papillomatosis
7278,No lymphorrhea,Extravasation of lymph onto skin
7279,No abnormality detected by assessment of physical health,Disease
7280,No varicose veins,Varicosity
7281,No abnormality detected by mental health assessment,Abnormal finding on evaluation procedure
7282,History of pathological hip fracture,Pathological fracture
7283,No family history of asthma,Asthma
7284,Maternal history of diabetes mellitus,Diabetes Mellitus
7285,Maternal history of connective tissue disease,Connective Tissue Diseases
7286,Partner pregnant,Finding related to pregnancy
7287,No skin inflammation,Inflammatory dermatosis
7288,No known exposure to Ebola virus,Exposure to Ebola virus (event)
7289,Finger clubbing absent,Clubbed Fingers
7290,History of pheochromocytoma,Adrenal Gland Pheochromocytoma
7291,Maternal history of insulin dependent diabetes mellitus,Diabetes Mellitus
7292,Suspected Ebola virus disease,"Hemorrhagic Fever, Ebola"
7293,Suspected glaucoma due to type 2 diabetes mellitus,Glaucoma due to type 2 diabetes mellitus
7294,Maternal exposure to radiation,Exposure to radiation
7295,History of penis injury,Injury of penis
7296,No ankle flare,Ankle flare
7297,No history of cutaneous cellulitis,Cellulitis of skin
7298,Family history of congenital diaphragmatic hernia,Congenital diaphragmatic hernia
7299,Family history of carcinoid tumor,Carcinoid Tumor
7300,History of Duchenne muscular dystrophy,"Muscular Dystrophy, Duchenne"
7301,Family history of myasthenia gravis,Myasthenia Gravis
7302,Family history of viral hepatitis type C,Hepatitis C
7303,Family history of osteogenesis imperfecta,Osteogenesis Imperfecta
7304,Family history of hereditary nonpolyposis colon cancer,Hereditary Nonpolyposis Colorectal Cancer
7305,Family history of fragile X syndrome,Fragile X Syndrome
7306,History of malignant tumor of ethmoid sinus,Malignant tumor of ethmoid sinus
7307,Family history of neuroblastoma,Neuroblastoma
7308,Family history of factor V deficiency,Factor V deficiency
7309,Family history of holoprosencephaly,Holoprosencephaly
7310,Family history of hyperparathyroidism,Hyperparathyroidism
7311,"Family history of 5,10 methylenetetrahydrofolate reductase deficiency","5,10-Methylenetetrahydrofolate reductase deficiency"
7312,History of pancreatitis,Pancreatitis
7313,Family history of carcinoma of esophagus,Esophageal carcinoma
7314,History of swelling of feet,Edema of foot (finding)
7315,Family history of left ventricular noncompaction cardiomyopathy,Left ventricular myocardial noncompaction cardiomyopathy
7316,Family history of eye movement disorder,Ocular Motility Disorders
7317,Family history of transitional cell carcinoma of bladder,Transitional cell carcinoma of bladder
7318,Family history of Von Willebrand disease,von Willebrand Disease
7319,Family history of cirrhosis of liver,Liver Cirrhosis
7320,Family history of Behcet syndrome,Behcet Syndrome
7321,History of cerebellar meningioma,Meningioma of cerebellum
7322,History of insufficient prenatal care,Insufficient prenatal care
7323,Family history of angioedema,Angioedema
7324,History of Pneumocystis jirovecii pneumonia,Pneumocystis jiroveci pneumonia
7325,History of supraventricular tachycardia,Supraventricular tachycardia
7326,Family history of antiphospholipid syndrome,Antiphospholipid Syndrome
7327,Family history of malignant tumor of hypopharynx,Hypopharyngeal Cancer
7328,Family history of vitamin B12 deficiency,Vitamin B 12 Deficiency
7329,Family history of inclusion body myositis,Inclusion Body Myositis (disorder)
7330,Family history of ventricular aneurysm,Ventricular aneurysm
7331,Family history of cancer of the oral cavity,Malignant neoplasm of mouth
7332,Family history of pulmonic valve stenosis,Pulmonary Valve Stenosis
7333,Family history of gastroschisis,Gastroschisis
7334,History of abdominal abscess,Abdominal Abscess
7335,History of colonic diverticular access,Abscess with diverticular disease of colon
7336,History of psychotic disorder,Psychotic Disorders
7337,Family history of hemophilia A,Hemophilia A
7338,Family history of lactose intolerance,Lactose Intolerance
7339,Family history of Factor V Leiden mutation,Factor V Leiden mutation
7340,Family history of asplenia,Congenital absence of spleen
7341,Family history of hepatoma,Liver neoplasms
7342,Family history of systemic lupus erythematosus,"Lupus Erythematosus, Systemic"
7343,Family history of interstitial lung disease,"Lung Diseases, Interstitial"
7344,History of semen abnormality,Semen exam: abnormal
7345,Family history of malignant tumor of kidney parenchyma,Malignant tumor of kidney parenchyma
7346,Family history of hypercoagulable state,Thrombophilia
7347,Family history of Graves disease,Graves Disease
7348,Family history of polycythemia,Erythrocytosis
7349,Family history of polymyositis,Polymyositis
7350,History of gluten sensitivity,Gluten sensitivity
7351,History of venous thrombosis,Venous Thrombosis
7352,History of tendinitis,Tendinitis
7353,History of rape,Forcible intercourse
7354,Family history of neurofibromatosis,Neurofibromatoses
7355,Family history of reactive airway disease,Reactive airway disease
7356,Family history of inflammatory bowel disease,Inflammatory Bowel Diseases
7357,Family history of gliobastoma multiforme,Glioblastoma Multiforme
7358,History of rectal abscess,Rectal abscess
7359,History of heat stroke,Heat Stroke
7360,History of VATER syndrome,VATER Association
7361,Family history of narcolepsy,Narcolepsy
7362,FH: Skin disease,Skin and subcutaneous tissue disorders
7363,H/O: gout,Gout
7364,H/O: recurrent cystitis,Personal history finding
7365,H/O: multiple allergies,Hypersensitivity
7366,H/O: amenorrhea,Personal history finding
7367,O/E - irritable,Mental state
7368,O/E - enophthalmos present,Enophthalmos
7369,O/E - dead - sudden death,Sudden death
7370,O/E - pulse borderline fast,Finding of peripheral pulse
7371,O/E - arterial wall palpable,Arterial wall palpable
7372,O/E - liver soft,Finding of sensation of liver
7373,O/E - gallbladder palpable,Gallbladder palpable
7374,O/E - epididymal swelling,Epididymal swelling
7375,On examination - vaginal speculum examination - no abnormality detected,Female genitalia finding
7376,O/E - ankle reflex normal,Ankle reflex normal
7377,O/E - micturition reflex,Observation of reflex
7378,O/E -defecation reflex normal,Finding of defecation
7379,O/E - fluorescein staining,General visual observation
7380,O/E - CNS NOS,Neurological observations
7381,O/E - capillary nevi present,Macular rash
7382,O/E - reduced movement of hip,Limitation of joint movement
7383,O/E - bone abnormality,Bone finding
7384,Previous Abortion,Patient currently pregnant
7385,H/O: genital prolapse,Female Genital Diseases
7386,O/E - sitting/propped up,Body position
7387,Epididymis non-tender,Epididymis tender
7388,H/O: Myocardial infarction in last year,Personal history finding
7389,History of myocardial infarction,Personal history finding
7390,History of myocardial infarction,Cardiovascular Diseases
7391,History of coronary artery bypass grafting,Personal history finding
7392,History of coronary artery bypass grafting,Heart Diseases
7393,O/E - weight-bearing,Musculoskeletal System Finding
7394,O/E - PR - prostate median sulcus not preserved,Prostate finding
7395,O/E - PR - prostate median sulcus preserved,Prostate finding
7396,H/O: manic depressive disorder,Personal history finding
7397,H/O: manic depressive disorder,Mental disorders
7398,FH: Angina in 1st degree female relative <65 years,Angina Pectoris
7399,Family history of myocardial infarct in first degree female relative less than 65 years of age,Coronary Thrombosis
7400,FH: Myocardial infarct in 1st degree male relative <55 years,Coronary Thrombosis
7401,Family history of hemochromatosis,Metabolic Diseases
7402,FH: Angina in 1st degree male relative <55 years,Angina Pectoris
7403,H/O: venous leg ulcer,Skin / mucosa finding
7404,H/O: venous leg ulcer,Personal history finding
7405,No previous immunizations,Immunization status
7406,No itch,Pruritus
7407,O/E - flexible hips,Musculoskeletal System Finding
7408,No thoughts of deliberate self harm,Thoughts of self harm
7409,H/O: prolonged corticosteroid therapy,drug dependent
7410,Bacterial growth absent,Determination of bacterial growth
7411,wheezing unilaterally,Wheezing
7412,History of bowel obstruction,Intestinal Obstruction
7413,History of chronic renal impairment,Chronic Kidney Diseases
7414,History of congenital vascular malformation,Congenital vascular anomaly
7415,Family history of sebaceous carcinoma,Sebaceous Adenocarcinoma
7416,Family history of autosomal translocation,Autosomal translocation
7417,History of lymphosarcoma,"Lymphoma, Diffuse"
7418,Family history of malignant neoplasm of endometrium,Malignant neoplasm of endometrium of corpus uteri
7419,History of merkel cell carcinoma,Merkel cell carcinoma
7420,History of neoplasm of pituitary gland,Pituitary Neoplasms
7421,Family history of hydronephrosis,Hydronephrosis
7422,History of dissection of carotid artery,Dissection of cervicocerebral artery
7423,Family history of achondroplasia,Achondroplasia
7424,History of hepatocellular carcinoma,Liver carcinoma
7425,History of plasmacytoma,Plasmacytoma
7426,Family history of neurofibromatosis,Neurofibromatoses
7427,Family history of Von Willebrand disease,von Willebrand Disease
7428,Family history of stroke due to aneurysm,Hemorrhagic cerebral infarction
7429,History of benign meningioma of brain,Benign neoplasm of cerebral meninges
7430,History of herpes zoster,Herpes zoster disease
7431,History of acute myeloid leukemia,"Leukemia, Myelocytic, Acute"
7432,History of malignant neoplasm of middle ear,Malignant neoplasm of middle ear
7433,History of atypical hyperplasia of breast,Atypical hyperplasia of breast
7434,History of multiple myeloma,Multiple Myeloma
7435,History of cardiomyopathy,Cardiomyopathies
7436,History of pancreatitis,Pancreatitis
7437,Family history of familial multiple polyposis syndrome,Adenomatous Polyposis Coli
7438,"History of low birth weight status, 2-2.5kg",Baby birth weight 2.0-2.5kg
7439,Family history of malignant neoplasm of breast diagnosed before 45 years of age,Malignant neoplasm of breast
7440,History of Cushing disease,Pituitary-dependent Cushing's disease
7441,History of visceral aneurysm,Aneurysm
7442,History of infection of total knee joint prothesis,Infection of total knee joint prosthesis
7443,History of histoplasmosis,Histoplasma capsulatum Infection
7444,History of drug-induced anaphylaxis,Drug-induced anaphylaxis
7445,Family history of malignant neoplasm of urethra,Malignant neoplasm of urethra
7446,History of infection due to vancomycin resistant enterococcus,Infection due to vancomycin resistant enterococcus
7447,History of neuroendocrine malignant neoplasm,Neuroendocrine Tumors
7448,History of acquired spondylolisthesis,Acquired spondylolisthesis
7449,Family history of familial dysautonomia,"Dysautonomia, Familial"
7450,Family history of hypercoagulable state,Thrombophilia
7451,History of squamous cell carcinoma of skin,Squamous cell carcinoma of skin
7452,History of cancer metastatic to lymph nodes,Secondary malignant neoplasm of lymph node
7453,History of carcinoma in situ of breast,Stage 0 Breast Carcinoma
7454,History of lobular carcinoma in situ,Lobular carcinoma in situ of breast
7455,Family history of phenylketonuria,Classical phenylketonuria
7456,History of malignant neoplasm of lip,Cancer of Lip
7457,History of benign carcinoid neoplasm,Carcinoid Tumor
7458,History of spinal cord injury,Spinal Cord Injuries
7459,History of prostatic cyst,Prostatic cyst
7460,History of malignant neoplasm of pharynx,Malignant neoplasm of pharynx
7461,History of malignant neoplasm of nasopharynx,Malignant neoplasm of nasopharynx
7462,History of nocturnal hypoglycemia,Nocturnal hypoglycemia
7463,History of hepatitis C,Hepatitis C
7464,History of cholangiocarcinoma,Cholangiocarcinoma
7465,History of cancer of urethra,Malignant neoplasm of urethra
7466,Family history of malignant neoplasm of breast in first degree relative less than 50 years of age,Malignant neoplasm of breast
7467,History of ischemic colitis,"Colitis, Ischemic"
7468,History of febrile urinary tract infection,Febrile urinary tract infection
7469,History of combat and operational stress reaction,Combat Fatigue
7470,History of prematurity,Prematurity of fetus
7471,Family history of Prader-Willi syndrome,Prader-Willi Syndrome
7472,History of lower extremity skin ulcer,Ulcer of skin of lower extremity
7473,History of immune disorder,Disorder of immune function
7474,History of human papilloma virus infection,Human papilloma virus infection
7475,History of hypospermatogenesis,Laboratory finding of Oligozoospermia
7476,History of sepsis,Bacterial sepsis
7477,Family history of hemoglobinopathy,Hemoglobinopathies
7478,History of hepatoblastoma,Hepatoblastoma
7479,Family history of methylmalonic aciduria,Methylmalonic acidemia
7480,History of pneumococcal infection,Pneumococcal Infections
7481,History of skin and/or subcutaneous tissue disease,Skin and subcutaneous tissue disorders
7482,History of benign neoplasm of bone,Benign bone neoplasm
7483,History of myeloid leukemia,Myeloid Leukemia
7484,History of malignant carcinoid tumor of small intestine,malignant carcinoid tumor of small intestine
7485,History of pseudoaneurysm,Pseudoaneurysm
7486,"History of low birth weight status, less than 500 grams",Birth weight less than 500g
7487,Family history of complex congenital heart disease,Congenital heart disease
7488,History of cerebellar stroke,Cerebrovascular accident
7489,History of Crohns disease,Crohn Disease
7490,History of Haemophilus influenzae type b infection,Haemophilus influenzae Type b Infection
7491,History of acoustic neuroma,Acoustic Neuroma
7492,Family history of protein C deficiency,Protein C Deficiency
7493,History of malignant neoplasm of nasal cavity,Malignant neoplasm of nasal cavity
7494,History of benign neoplasm of larynx,Benign neoplasm of larynx
7495,History of prostatitis,prostatitis
7496,History of cancer of ampulla of duodenum,Malignant neoplasm of ampulla of Vater
7497,History of cancer metastatic to brain,Metastatic malignant neoplasm to brain
7498,History of congenital absence of germinal epithelium of testes,Congenital absence of germinal epithelium of testes
7499,History of malignant neoplasm of external ear,Malignant tumor of external ear
7500,History of recurrent deep vein thrombosis,Recurrent deep vein thrombosis
7501,Family history of neurological developmental delay,Developmental delay (disorder)
7502,History of stress fracture,Stress Fractures
7503,History of parasitic disease,Parasitic Diseases
7504,History of transitional cell carcinoma of kidney,Transitional cell carcinoma of kidney
7505,Family history of osteogenesis imperfecta,Osteogenesis Imperfecta
7506,History of astrocytoma of brain,Astrocytoma of brain
7507,History of nephrotic syndrome,Nephrotic Syndrome
7508,History of acute renal failure,"Kidney Failure, Acute"
7509,History of closed head injury,Closed head injuries
7510,History of cancer metastatic to skin,Secondary malignant neoplasm of skin
7511,History of nutritional deficiency,Malnutrition
7512,History of cornea graft failure,Corneal graft failure
7513,History of gastritis,Gastritis
7514,History of esophagitis,Esophagitis
7515,History of transient ischemic attack due to embolism,Transient ischemic attack due to embolism
7516,Family history of aneurysm of blood vessel of brain,Aneurysm
7517,History of gestational hypertension,Pregnancy associated hypertension
7518,Family history of Tay-Sachs disease,Tay-Sachs Disease
7519,History of malignant neoplasm of pancreas,Malignant neoplasm of pancreas
7520,Fetal exposure to toxin,Exposure to toxin
7521,History of malignant neoplasm of parotid gland,Malignant tumour of parotid gland
7522,Family history of gene mutation,Mutation
7523,Family history of sudden cardiac death,Sudden Cardiac Death
7524,Family history of protein S deficiency,Protein S Deficiency
7525,History of sebaceous carcinoma,Sebaceous Adenocarcinoma
7526,History of thoracoabdominal aortic aneurysm,"Aortic Aneurysm, Thoracoabdominal"
7527,History of portal hypertension,Portal Hypertension
7528,History of cancer metastatic to bone,Secondary malignant neoplasm of bone
7529,History of cancer of gall bladder,Malignant neoplasm of gallbladder
7530,History of small vessel disease due to diabetes mellitus,Vascular Diseases
7531,History of primary hyperparathyroidism,"Hyperparathyroidism, Primary"
7532,Family history of fragile X syndrome,Fragile X Syndrome
7533,History of hip stress fracture,Stress fracture of neck of femur
7534,History of oligodendroglioma of brain,Brain Oligodendroglioma
7535,History of neoplasm of uncertain behavior,Neoplastic disease of uncertain behavior
7536,History of malignant neoplasm of peritoneum,Malignant tumor of peritoneum
7537,History of urethrocutaneous fistula,Urethral fistula to skin
7538,Family history of congenital hydrocephalus,Congenital Hydrocephalus
7539,History of adult respiratory distress syndrome,"Respiratory Distress Syndrome, Adult"
7540,Family history of hyperbetalipoproteinemia,"Hypercholesterolemia, Familial"
7541,History of irritable bowel syndrome,Irritable Bowel Syndrome
7542,History of glioma of brainstem,Brain Stem Glioma
7543,Fetal exposure to angiotensin converting enzyme inhibitor agent,Exposure to angiotensin converting enzyme inhibitor agent
7544,History of benign schwannoma,Neurilemmoma
7545,History of suspected exposure to biological agent,Exposure to biological agent
7546,Family history of Marfan syndrome,Marfan Syndrome
7547,History of typhoid,Typhoid Fever
7548,Family history of short stature,Dwarfism
7549,Family history of beta thalassemia,beta Thalassemia
7550,History of acromegaly,Acromegaly
7551,Smoking History,Smoker
7552,Family history of hypoalphalipoproteinemia,Hypoalphalipoproteinemias
7553,History of meningioma,Meningeal Neoplasms
7554,History of invasive malignant neoplasm of breast,Malignant neoplasm of breast
7555,History of cancer metastatic to liver,Secondary malignant neoplasm of liver
7556,Family history of hematuria,Hematuria
7557,Family history of sebaceous adenoma,Sebaceous adenoma of skin
7558,Family history of multiple endocrine neoplasia,Polyglandular activity in multiple endocrine adenomatosis
7559,History of listeria meningitis,"Meningitis, Listeria"
7560,History of endophthalmitis,Endophthalmitis
7561,Family history of hereditary nonpolyposis colon cancer,Hereditary Nonpolyposis Colorectal Cancer
7562,Encounter due to history of traumatic brain injury,Traumatic Brain Injury
7563,Fetal exposure to alcohol,Exposure to alcohol
7564,History of neutropenia,Neutropenia
7565,History of aspiration pneumonia,Aspiration Pneumonia
7566,Family history of malignant neoplasm of ureter,Malignant neoplasm of ureter
7567,History of carotid body neoplasm,Carotid Body Paraganglioma
7568,History of chronic lymphocytic leukemia,Chronic Lymphocytic Leukemia
7569,History of cancer of floor of mouth,Malignant neoplasm of floor of mouth
7570,History of cancer of unknown primary site,"Neoplasms, Unknown Primary"
7571,Family history of alpha thalassemia,Alpha trait thalassemia
7572,History of Paget's disease of breast,Paget's Disease of the Nipple
7573,Family history of blood coagulation disorder,Blood Coagulation Disorders
7574,History of lower gastrointestinal bleed,Lower gastrointestinal hemorrhage
7575,History of hypercoagulable state,Thrombophilia
7576,History of malignant cutaneous T-cell lymphoma,"Lymphoma, T-Cell, Cutaneous"
7577,History of malignant neoplasm of salivary gland,Malignant neoplasm of salivary gland
7578,History of neuroendocrine malignant neoplasm,Malignant Neoplasms
7579,Family history of breast cancer gene mutation in first degree relative,Breast cancer genetic marker of susceptibility positive
7580,Family history of galactosemia,Galactosemias
7581,Family history of eruptive xanthoma,Eruptive xanthoma
7582,Family history of clubfoot,Acquired clubfoot
7583,Family history of Hashimoto thyroiditis,Hashimoto Disease
7584,Family history of pseudocholinesterase deficiency,Pseudocholinesterase deficiency
7585,History of benign neoplasm of spinal cord,Benign neoplasm of spinal cord
7586,Family history of hypospadias,Hypospadias
7587,History of pituitary adenoma,Pituitary Adenoma
7588,History of atrial myxoma,Atrial myxoma
7589,History of histiocytosis,Histiocytic syndrome
7590,FH: Cholinesterase deficiency,Pseudocholinesterase deficiency
7591,Family history of Muir-Torré syndrome,Torre-Muir syndrome
7592,History of squamous cell carcinoma,Squamous cell carcinoma
7593,History of syncope,Syncope
7594,History of toxoplasmosis,Toxoplasmosis
7595,History of prolactinoma,Prolactinoma
7596,History of malignant neoplasm of tonsil,Malignant neoplasm tonsil
7597,Family history of autosomal aneuploidy,Autosomal aneuploidy
7598,Family history of Canavan disease,Canavan Disease
7599,Family history of antithrombin III deficiency,Antithrombin III Deficiency
7600,Family history of Rett syndrome,Rett Syndrome
7601,History of undescended testes,Bilateral Cryptorchidism
7602,History of myocarditis,Myocarditis
7603,History of bacterial infection,Bacterial Infections
7604,History of - cat allergy,Hypersensitivity
7605,H/O: hormone replacement (HRT),Medication (IADL finding)
7606,H/O: renal dialysis,Personal history finding
7607,H/O: oral contraceptive usage,Female Genital Diseases
7608,Family history of ambiguous genitalia,Ambiguous Genitalia
7609,O/E - poor venous access,Difficult venous access
7610,Family history of connective tissue disorder,Connective Tissue Diseases
7611,On examination - right-leg pulses all present,Finding of peripheral pulse
7612,O/E - furred tongue,Observation of surface of tongue
7613,On examination - dullness over abdominal mass,Gastrointestinal System Finding
7614,O/E - pelvic mass palpated,Finding by palpation
7615,On examination - joint position sense absent,Joint position sense absent
7616,O/E - pupil regularity,Regularity of pupil - finding
7617,O/E - cranial nerve 7 - intact,Seventh cranial nerve finding
7618,O/E - nasal polyp present,Nasal Polyps
7619,O/E-otoscopy:dull light reflex,Light reflex of tympanic membrane - finding
7620,O/E - laryngoscopy NAD,Larynx finding
7621,O/E - vocal cords thickened,Finding of appearance of larynx
7622,O/E - hands - arachnodactyly,Arachnodactyly
7623,H/O: thromboembolism,Personal history finding
7624,No fluorescein staining of cornea,Fluorescein staining of cornea
7625,No bacterial antibody present,Bacterial antibody present
7626,H/O: Admission in last year for hyperglycemic disorder,Hyperglycemia
7627,O/E - pharynx NAD,Pharyngeal finding
7628,History of benign carcinoid neoplasm of gastrointestinal tract,Gastrointestinal Carcinoid Tumor
7629,Family history of single congenital anomaly,Congenital Abnormality
7630,History of urethral parameatal cyst,Urethral parameatal cyst
7631,History of giant cell arteritis,Giant Cell Arteritis
7632,History of gastroesophageal reflux disease,Gastroesophageal reflux disease
7633,History of reticulosarcoma,Reticulosarcoma
7634,History of retinoblastoma,Retinoblastoma
7635,History of gastrointestinal stromal tumor,Gastrointestinal Stromal Tumors
7636,History of malignant meningeal neoplasm,Malignant neoplasm of meninges
7637,Family history of microcephaly,Microcephaly
7638,History of medulloblastoma of brain,Medulloblastoma
7639,History of soft tissue sarcoma,Sarcoma of soft tissue
7640,History of diverticulitis,Diverticulitis
7641,History of Guillain Barre syndrome,Guillain-Barre Syndrome
7642,History of cancer metastatic to lung,Secondary malignant neoplasm of lung
7643,History of squamous cell carcinoma in situ,Intraepithelial Squamous Cell Carcinoma
7644,History of cystic dilatation of duct of bulbourethral gland,Cystic dilatation of duct of bulbourethral gland
7645,History of vertebral stress fracture,Fatigue fracture of vertebra
7646,Family history of chronic renal impairment,Chronic Kidney Diseases
7647,History of methicillin resistant Staphylococcus aureus infection,MRSA - Methicillin resistant Staphylococcus aureus infection
7648,History of malignant neoplasm of retroperitoneum,Malignant retroperitoneal tumor
7649,History of urethral cyst,Urethral cyst
7650,History of ureteral obstruction,Ureteral obstruction
7651,History of rhabdomyosarcoma,Rhabdomyosarcoma
7652,History of mycosis fungoides,Mycosis Fungoides
7653,History of Cushing syndrome,Adrenal Gland Hyperfunction
7654,Family history of macrocephaly,Macrocephaly
7655,Family history of glycogen storage disease,Glycogen Storage Disease
7656,History of congenital hypospadias,Hypospadias
7657,Family history of chronic respiratory disease,Chronic disease of respiratory system
7658,History of congenital adrenal hyperplasia,Congenital adrenal hyperplasia
7659,History of Graves' disease,Graves Disease
7660,History of bradycardia,Bradycardia
7661,History of inverted papilloma,Inverted Papilloma
7662,History of germ cell tumor,Germ cell tumor
