,CUI1,CUI2
0,mitotic spindle pole body separation,regulation of mitotic spindle pole body separation
1,flocculation,regulation of flocculation
2,phosphorelay signal transduction system,regulation of phosphorelay signal transduction system
3,microtubule cytoskeleton organization,regulation of microtubule cytoskeleton organization
4,double-strand break repair via homologous recombination,regulation of double-strand break repair via homologous recombination
5,cell morphogenesis involved in differentiation,regulation of cell morphogenesis involved in differentiation
6,septum digestion after cytokinesis,regulation of septum digestion after cytokinesis
7,mitochondrial RNA catabolic process,regulation of mitochondrial RNA catabolic process
8,Gastric acid secretion,regulation of gastric acid secretion
9,epithelial to mesenchymal transition,regulation of epithelial to mesenchymal transition
10,blood vessel remodeling,regulation of blood vessel remodeling
11,Fc receptor mediated stimulatory signaling pathway,regulation of Fc receptor mediated stimulatory signaling pathway
12,respiratory burst involved in inflammatory response,regulation of respiratory burst involved in inflammatory response
13,system process,regulation of system process
14,respiratory gaseous exchange in organisms,regulation of respiratory system process
15,glucose metabolism,regulation of glucose metabolic process
16,UDP-glucose catabolic process,regulation of UDP-glucose catabolic process
17,DNA Methylation,DNA Methylation Regulation
18,transcription initiation from RNA polymerase II promoter,regulation of transcription initiation from RNA polymerase II promoter
19,mRNA export from nucleus,regulation of mRNA export from nucleus
20,protein ADP-ribosylation,regulation of protein ADP-ribosylation
21,N-terminal protein palmitoylation,regulation of N-terminal protein palmitoylation
22,Ubiquinone Biosynthesis Pathway,regulation of ubiquinone biosynthetic process
23,heme biosynthetic process,regulation of heme biosynthetic process
24,anion transport,regulation of anion transport
25,iron transport,regulation of iron ion transport
26,Activation-induced cell death of T cells,regulation of activation-induced cell death of T cells
27,mitochondrion organization,regulation of mitochondrion organization
28,mitotic spindle organization,regulation of mitotic spindle organization
29,budding cell apical bud growth,regulation of budding cell apical bud growth
30,Cell Communication,regulation of cell communication
31,nitric oxide mediated signal transduction,regulation of nitric oxide mediated signal transduction
32,Excretory function,regulation of excretion
33,Feeding behaviors,regulation of feeding behavior
34,Mitochondrial Fusion,regulation of mitochondrial fusion
35,Cell Death,Regulation of Cell Death Process
36,acetylcholine metabolic process,regulation of acetylcholine metabolic process
37,fungal-type cell wall biogenesis,regulation of fungal-type cell wall biogenesis
38,auxin-activated signaling pathway,regulation of auxin mediated signaling pathway
39,cytokinin-activated signaling pathway,regulation of cytokinin-activated signaling pathway
40,auxin biosynthetic process,regulation of auxin biosynthetic process
41,vascular endothelial growth factor production,regulation of vascular endothelial growth factor production
42,epithelial cell migration,regulation of epithelial cell migration
43,cell communication by chemical coupling,regulation of cell communication by chemical coupling
44,cell communication by electrical coupling,regulation of cell communication by electrical coupling
45,muscle cell apoptotic process,regulation of muscle cell apoptotic process
46,striated muscle cell apoptotic process,regulation of striated muscle cell apoptotic process
47,cardiac muscle cell apoptotic process,regulation of cardiac muscle cell apoptotic process
48,protein glutathionylation,regulation of protein glutathionylation
49,protein kinase A signaling,regulation of protein kinase A signaling
50,macrophage derived foam cell differentiation,regulation of macrophage derived foam cell differentiation
51,fibroblast migration,regulation of fibroblast migration
52,T cell chemotaxis,regulation of T cell chemotaxis
53,cholesterol storage,regulation of cholesterol storage
54,macrophage tolerance induction,regulation of macrophage tolerance induction
55,macrophage cytokine production,regulation of macrophage cytokine production
56,cytoplasmic microtubule depolymerization,regulation of cytoplasmic microtubule depolymerization
57,Glial Cell Proliferation,regulation of glial cell proliferation
58,Schwann cell proliferation,regulation of Schwann cell proliferation
59,release of sequestered calcium ion into cytosol by sarcoplasmic reticulum,regulation of release of sequestered calcium ion into cytosol by sarcoplasmic reticulum
60,cardiac muscle adaptation,regulation of cardiac muscle adaptation
61,myotube differentiation,regulation of myotube differentiation
62,heparan sulfate proteoglycan biosynthetic process,regulation of heparan sulfate proteoglycan biosynthetic process
63,long-chain fatty acid import across plasma membrane,regulation of long-chain fatty acid import across plasma membrane
64,coenzyme A biosynthetic process,regulation of coenzyme A biosynthetic process
65,synaptic vesicle priming,regulation of synaptic vesicle priming
66,peptidyl-threonine phosphorylation,regulation of peptidyl-threonine phosphorylation
67,1-aminocyclopropane-1-carboxylate metabolic process,regulation of 1-aminocyclopropane-1-carboxylate metabolic process
68,starch biosynthetic process,regulation of starch biosynthetic process
69,dolichol biosynthetic process,regulation of dolichol biosynthetic process
70,triglyceride biosynthetic process,regulation of triglyceride biosynthetic process
71,triglyceride catabolic process,regulation of triglyceride catabolic process
72,lipid storage,regulation of lipid storage
73,cAMP-mediated signaling,regulation of cAMP-mediated signaling
74,cGMP-mediated signaling,regulation of cGMP-mediated signaling
75,Digestive System Processes,regulation of digestive system process
76,DNA strand elongation,regulation of DNA strand elongation
77,extracellular matrix disassembly,regulation of extracellular matrix disassembly
78,lamellipodium assembly,regulation of lamellipodium assembly
79,filamentous growth,regulation of filamentous growth
80,collagen catabolic process,regulation of collagen catabolic process
81,Ovulation,regulation of ovulation
82,sequestering of triglyceride,regulation of sequestering of triglyceride
83,stress-activated protein kinase signaling cascade,regulation of stress-activated protein kinase signaling cascade
84,Physiologic calcification,regulation of biomineral tissue development
85,Chromatin Modeling,regulation of chromatin assembly
86,Chromatin Disassembly,regulation of chromatin disassembly
87,fungal-type cell wall organization,regulation of fungal-type cell wall organization
88,cell-substrate adhesion,regulation of cell-substrate adhesion
89,plasminogen activation,regulation of plasminogen activation
90,signal transduction involved in positive regulation of conjugation with cellular fusion,regulation of signal transduction involved in conjugation with cellular fusion
91,mitochondrial translation,regulation of mitochondrial translation
92,receptor biosynthetic process,regulation of receptor biosynthetic process
93,inositol phosphate biosynthetic process,regulation of inositol phosphate biosynthetic process
94,collagen metabolic process,regulation of collagen metabolic process
95,tumor necrosis factor-mediated signaling pathway,regulation of tumor necrosis factor-mediated signaling pathway
96,cholesterol efflux,regulation of cholesterol efflux
97,cytoplasmic mRNA processing body assembly,regulation of cytoplasmic mRNA processing body assembly
98,ion transmembrane transport,regulation of ion transmembrane transport
99,basidiospore formation,regulation of basidiospore formation
100,zygospore formation,regulation of zygospore formation
101,sporangiospore formation,regulation of sporangiospore formation
102,response to interferon-gamma,regulation of response to interferon-gamma
103,very-low-density lipoprotein particle remodeling,regulation of very-low-density lipoprotein particle remodeling
104,smooth muscle cell apoptotic process,regulation of smooth muscle cell apoptotic process
105,cholesterol esterification,regulation of cholesterol esterification
106,plasma lipoprotein particle oxidation,regulation of plasma lipoprotein oxidation
107,very-low-density lipoprotein particle clearance,regulation of very-low-density lipoprotein particle clearance
108,Tooth Calcification,regulation of tooth mineralization
109,phosphatidylcholine catabolic process,regulation of phosphatidylcholine catabolic process
110,iron ion transmembrane transport,regulation of iron ion transmembrane transport
111,histone H4-K20 methylation,regulation of histone H4-K20 methylation
112,lipoprotein oxidation,regulation of lipoprotein oxidation
113,"circadian sleep/wake cycle, wakefulness","regulation of circadian sleep/wake cycle, wakefulness"
114,Penile Erection,regulation of penile erection
115,macromolecule metabolic process,regulation of macromolecule metabolic process
116,endothelial cell migration,regulation of endothelial cell migration
117,sporangium development,regulation of sporangium development
118,keratinocyte proliferation,regulation of keratinocyte proliferation
119,sporulation,regulation of sporulation
120,sexual sporulation resulting in formation of a cellular spore,regulation of sexual sporulation resulting in formation of a cellular spore
121,asexual sporulation resulting in formation of a cellular spore,regulation of asexual sporulation resulting in formation of a cellular spore
122,cellular component biogenesis,regulation of cellular component biogenesis
123,cellular carbohydrate metabolic process,regulation of cellular carbohydrate metabolic process
124,symbiont process,"regulation of symbiosis, encompassing mutualism through parasitism"
125,G0 to G1 transition,regulation of G0 to G1 transition
126,establishment of protein localization,regulation of establishment of protein localization
127,sarcomere organization,regulation of sarcomere organization
128,sterigmatocystin biosynthetic process,regulation of sterigmatocystin biosynthetic process
129,Respiratory Burst,regulation of respiratory burst
130,phosphatidylinositol dephosphorylation,regulation of phosphatidylinositol dephosphorylation
131,platelet-derived growth factor receptor signaling pathway,regulation of platelet-derived growth factor receptor signaling pathway
132,macrophage chemotaxis,regulation of macrophage chemotaxis
133,conidium formation,regulation of conidium formation
134,Cell development,regulation of cell development
135,oocyte development,regulation of oocyte development
136,hydrogen peroxide biosynthetic process,regulation of hydrogen peroxide biosynthetic process
137,Endocrine function,regulation of endocrine process
138,centrosome duplication,regulation of centrosome duplication
139,intracellular pH reduction,regulation of cellular pH reduction
140,cellular localization,regulation of cellular localization
141,multi-organism process,regulation of multi-organism process
142,formation by symbiont of haustorium for nutrient acquisition from host,regulation of formation by symbiont of haustorium for nutrient acquisition from host
143,Transmembrane Transport,regulation of transmembrane transport
144,Cardiac Muscle Contraction,regulation of cardiac muscle contraction
145,cilium movement involved in cell motility,regulation of cilium movement involved in cell motility
146,elastin catabolic process,regulation of elastin catabolic process
147,definitive erythrocyte differentiation,regulation of definitive erythrocyte differentiation
148,primitive erythrocyte differentiation,regulation of primitive erythrocyte differentiation
149,interferon-gamma-mediated signaling pathway,regulation of interferon-gamma-mediated signaling pathway
150,type I interferon signaling pathway,regulation of type I interferon-mediated signaling pathway
151,cell adhesion molecule production,regulation of cell adhesion molecule production
152,mast cell differentiation,regulation of mast cell differentiation
153,pathway-restricted SMAD protein phosphorylation,regulation of pathway-restricted SMAD protein phosphorylation
154,growth hormone receptor signaling pathway,regulation of growth hormone receptor signaling pathway
155,calcium ion transport into cytosol,regulation of calcium ion transport into cytosol
156,post-mating oviposition,regulation of post-mating oviposition
157,heart growth,regulation of heart growth
158,glucagon secretion,regulation of glucagon secretion
159,chemokine-mediated signaling pathway,regulation of chemokine-mediated signaling pathway
160,interleukin-6-mediated signaling pathway,regulation of interleukin-6-mediated signaling pathway
161,interleukin-27-mediated signaling pathway,regulation of interleukin-27-mediated signaling pathway
162,mitochondrial translational initiation,regulation of mitochondrial translational initiation
163,adiponectin secretion,regulation of adiponectin secretion
164,enamel mineralization,regulation of enamel mineralization
165,establishment of protein localization to chromosome,regulation of establishment of protein localization to chromosome
166,establishment of protein localization to telomere,regulation of establishment of protein localization to telomere
167,Lymphocyte Apoptotic Process,regulation of lymphocyte apoptotic process
168,T cell apoptotic process,regulation of T cell apoptotic process
169,activated T cell autonomous cell death,regulation of activated T cell autonomous cell death
170,thymocyte apoptotic process,regulation of thymocyte apoptotic process
171,natural killer cell apoptotic process,regulation of natural killer cell apoptotic process
172,mucus secretion,regulation of mucus secretion
173,Necrosis,regulation of necrotic cell death
174,fat cell proliferation,regulation of fat cell proliferation
175,brown fat cell proliferation,regulation of brown fat cell proliferation
176,white fat cell proliferation,regulation of white fat cell proliferation
177,hepatocyte differentiation,regulation of hepatocyte differentiation
178,ERK1 and ERK2 cascade,regulation of ERK1 and ERK2 cascade
179,ERK5 cascade,regulation of ERK5 cascade
180,nucleotide-binding oligomerization domain containing signaling pathway,regulation of nucleotide-binding oligomerization domain containing signaling pathway
181,nucleotide-binding oligomerization domain containing 1 signaling pathway,regulation of nucleotide-binding oligomerization domain containing 1 signaling pathway
182,nucleotide-binding oligomerization domain containing 2 signaling pathway,regulation of nucleotide-binding oligomerization domain containing 2 signaling pathway
183,oligodendrocyte progenitor proliferation,regulation of oligodendrocyte progenitor proliferation
184,Uterine Contraction,regulation of uterine smooth muscle contraction
185,thrombin-activated receptor signaling pathway,regulation of thrombin-activated receptor signaling pathway
186,spore germination on or near host,modulation of spore germination on or near host
187,germ tube formation on or near host,modulation of germ tube formation on or near host
188,appressorium formation on or near host,regulation of appressorium formation on or near host
189,initiation of appressorium on or near host,regulation of appressorium initiation on or near host
190,formation of symbiont germ tube hook structure on or near host,modulation of symbiont germ tube hook structure formation on or near host
191,maturation of appressorium on or near host,regulation of appressorium maturation on or near host
192,establishment of turgor in appressorium,regulation of establishment of turgor in appressorium
193,cell wall strengthening in symbiont involved in entry into host,modulation of symbiont cell wall strengthening involved in entry into host
194,formation of symbiont penetration peg for entry into host,modulation of symbiont penetration peg formation for entry into host
195,initiation of symbiont penetration peg,modulation of symbiont penetration peg initiation
196,formation of symbiont invasive hypha in host,regulation of symbiont invasive hypha formation in host
197,infection cushion formation on or near host,regulation of infection cushion formation on or near host
198,hyphopodium formation on or near host,regulation of hyphopodium formation on or near host
199,haustorium mother cell formation on or near host,regulation of haustorium mother cell formation on or near host
200,formation of symbiont haustorium neck for entry into host,modulation of symbiont haustorium neck formation for entry into host
201,formation of symbiont penetration hypha for entry into host,modulation of symbiont penetration hypha formation for entry into host
202,spore encystment on host,modulation of spore encystment on host
203,zoospore encystment on host,modulation of zoospore encystment on host
204,sporangium germination on or near host,modulation of sporangium germination on or near host
205,encysted zoospore germination on or near host,modulation of encysted zoospore germination on or near host
206,spore movement on or near host,modulation of spore movement on or near host
207,zoospore movement on or near host,modulation of zoospore movement on or near host
208,zoospore formation,regulation of zoospore formation
209,oospore formation,regulation of oospore formation
210,aeciospore formation,regulation of aeciospore formation
211,uredospore formation,regulation of uredospore formation
212,teliospore formation,regulation of teliospore formation
213,spore-bearing structure development,regulation of spore-bearing organ development
214,oogonium development,regulation of oogonium development
215,aecium development,regulation of aecium development
216,zygosporangium development,regulation of zygosporangium development
217,telium development,regulation of telium development
218,uredinium development,regulation of uredinium development
219,aplanospore formation,regulation of aplanospore formation
220,basidium development,regulation of basidium development
221,ascus development,regulation of ascus development
222,oomycete sporangium development,regulation of oomycete sporangium development
223,formation by symbiont of arbuscule for nutrient acquisition from host,regulation of arbuscule formation for nutrient acquisition from host
224,Mitochondrial Fission,regulation of mitochondrial fission
225,protein deneddylation,regulation of protein deneddylation
226,meiotic joint molecule formation,regulation of meiotic joint molecule formation
227,pheromone-dependent signal transduction involved in conjugation with cellular fusion,regulation of pheromone-dependent signal transduction involved in conjugation with cellular fusion
228,metanephros development,regulation of metanephros development
229,branching involved in ureteric bud morphogenesis,regulation of branching involved in ureteric bud morphogenesis
230,establishment of planar polarity,regulation of establishment of planar polarity
231,morphogenesis of a branching structure,regulation of morphogenesis of a branching structure
232,kidney development,regulation of kidney development
233,release of cytochrome c from mitochondria,regulation of release of cytochrome c from mitochondria
234,cell migration involved in sprouting angiogenesis,regulation of cell migration involved in sprouting angiogenesis
235,nematode larval development,regulation of nematode larval development
236,thyroid hormone mediated signaling pathway,regulation of thyroid hormone mediated signaling pathway
237,osteoclast proliferation,regulation of osteoclast proliferation
238,immune complex clearance by monocytes and macrophages,regulation of immune complex clearance by monocytes and macrophages
239,Monocyte chemotaxis,regulation of monocyte chemotaxis
240,mast cell chemotaxis,regulation of mast cell chemotaxis
241,muscle system process,regulation of muscle system process
242,cell proliferation involved in heart valve morphogenesis,regulation of cell proliferation involved in heart valve morphogenesis
243,cardioblast proliferation,regulation of cardioblast proliferation
244,cardiac muscle hypertrophy,regulation of cardiac muscle hypertrophy
245,Wnt signaling pathway involved in heart development,regulation of Wnt signaling pathway involved in heart development
246,mesenchymal to epithelial transition involved in metanephros morphogenesis,regulation of mesenchymal to epithelial transition involved in metanephros morphogenesis
247,cilium movement,regulation of cilium movement
248,dynamin family protein polymerization involved in membrane fission,regulation of dynamin family protein polymerization involved in membrane fission
249,neural retina development,regulation of neural retina development
250,growth plate cartilage chondrocyte proliferation,regulation of growth plate cartilage chondrocyte proliferation
251,cytoskeleton polarization involved in growth plate cartilage chondrocyte division,regulation of cytoskeleton polarization involved in growth plate cartilage chondrocyte division
252,glycogen metabolic process,regulation of glycogen metabolic process
253,trehalose metabolic process,regulation of trehalose metabolic process
254,(1->6)-beta-D-glucan biosynthetic process,regulation of (1->6)-beta-D-glucan biosynthetic process
255,mitochondrial DNA replication,regulation of mitochondrial DNA replication
256,transcription-coupled nucleotide-excision repair,regulation of transcription-coupled nucleotide-excision repair
257,mRNA Degradation,regulation of mRNA catabolic process
258,polyamine biosynthetic process,regulation of polyamine biosynthetic process
259,Bile Acid Biosynthesis Pathway,regulation of bile acid biosynthetic process
260,phosphate ion transport,regulation of phosphate transport
261,zinc ion transport,regulation of zinc ion transport
262,oligopeptide transport,regulation of oligopeptide transport
263,ER to Golgi vesicle-mediated transport,regulation of ER to Golgi vesicle-mediated transport
264,biological adaptation to stress,regulation of response to stress
265,microtubule-based movement,regulation of microtubule-based movement
266,microtubule nucleation,regulation of microtubule nucleation
267,vacuole organization,regulation of vacuole organization
268,cell-substrate junction assembly,regulation of cell-substrate junction assembly
269,Cell Cycle Arrest,regulation of cell cycle arrest
270,spindle organization,regulation of spindle organization
271,mitotic spindle assembly checkpoint,regulation of mitotic cell cycle spindle assembly checkpoint
272,meiosis I,regulation of meiosis I
273,synaptonemal complex assembly,regulation of synaptonemal complex assembly
274,transmembrane receptor protein serine/threonine kinase signaling pathway,regulation of transmembrane receptor protein serine/threonine kinase signaling pathway
275,SMAD protein complex assembly,regulation of SMAD protein complex assembly
276,cholesterol metabolism,regulation of cholesterol metabolic process
277,phospholipid biosynthetic process,regulation of phospholipid biosynthetic process
278,thiamine biosynthetic process,regulation of thiamine biosynthetic process
279,thiamine diphosphate biosynthetic process,regulation of thiamine diphosphate biosynthetic process
280,glucan biosynthetic process,regulation of glucan biosynthetic process
281,phospholipid catabolism,regulation of phospholipid catabolic process
282,jasmonic acid metabolic process,regulation of jasmonic acid metabolic process
283,jasmonic acid biosynthetic process,regulation of jasmonic acid biosynthetic process
284,salicylic acid biosynthetic process,regulation of salicylic acid biosynthetic process
285,photorespiration,regulation of photorespiration
286,pollen tube growth,regulation of pollen tube growth
287,"systemic acquired resistance, salicylic acid mediated signaling pathway",modulation by symbiont of host salicylic acid-mediated defense response
288,radial pattern formation,regulation of radial pattern formation
289,red or far-red light signaling pathway,regulation of red or far-red light signaling pathway
290,floral organ abscission,regulation of floral organ abscission
291,regulation of translational initiation by eIF2 alpha phosphorylation,regulation of eIF2 alpha phosphorylation by heme
292,regulation of translational initiation by eIF2 alpha phosphorylation,regulation of eIF2 alpha phosphorylation by amino acid starvation
293,regulation of translational initiation by eIF2 alpha phosphorylation,regulation of eIF2 alpha phosphorylation by dsRNA
294,neural crest formation,regulation of neural crest formation
295,proline transport,regulation of proline transport
296,Peptide Transport,regulation of peptide transport
297,chlorophyll metabolic process,regulation of chlorophyll metabolic process
298,vesicle-mediated transport,regulation of vesicle-mediated transport
299,Gene Silencing,regulation of gene silencing
300,Post-Translational Protein Processing,regulation of protein processing
301,peptide hormone processing,regulation of peptide hormone processing
302,Deubiquitination,regulation of protein deubiquitination
303,metal ion transport,regulation of metal ion transport
304,cell projection assembly,regulation of cell projection assembly
305,peptide hormone secretion,regulation of peptide hormone secretion
306,sphingolipid biosynthetic process,regulation of sphingolipid biosynthetic process
307,pancreatic juice secretion,regulation of pancreatic juice secretion
308,Chromosome Condensation,regulation of chromosome condensation
309,"fructose 1,6-bisphosphate metabolic process","regulation of fructose 1,6-bisphosphate metabolic process"
310,production of siRNA involved in RNA interference,regulation of production of siRNA involved in RNA interference
