,CUI1,CUI2
1846,"DNA damage response, signal transduction by p53 class mediator","regulation of DNA damage response, signal transduction by p53 class mediator"
1847,estrogen receptor binding,regulation of estrogen receptor binding
1848,nuclear receptor transcription coactivator activity,regulation of nuclear receptor transcription coactivator activity
1849,"fructose 1,6-bisphosphate metabolic process","regulation of fructose 1,6-bisphosphate metabolic process"
1850,membrane disassembly,regulation of membrane disassembly
1851,establishment of competence for transformation,regulation of establishment of competence for transformation
1852,Defecation,regulation of defecation
1853,production of siRNA involved in RNA interference,regulation of production of siRNA involved in RNA interference
1854,sporulation resulting in formation of a cellular spore,regulation of sporulation resulting in formation of a cellular spore
1855,asexual sporulation,regulation of asexual sporulation
1856,ascospore formation,regulation of ascospore formation
1857,filamentous growth,regulation of filamentous growth
1858,chromatin silencing at silent mating-type cassette,regulation of chromatin silencing at silent mating-type cassette
1859,BMP Receptor Signaling Pathway,regulation of BMP signaling pathway
1860,intracellular steroid hormone receptor signaling pathway,regulation of intracellular steroid hormone receptor signaling pathway
1861,intracellular estrogen receptor signaling pathway,regulation of intracellular estrogen receptor signaling pathway
1862,androgen receptor signaling pathway,regulation of androgen receptor signaling pathway
1863,collagen catabolic process,regulation of collagen catabolic process
1864,reproductive fruiting body development,regulation of reproductive fruiting body development
1865,sorocarp development,regulation of sorocarp development
1866,Neutrophil chemotaxis,regulation of neutrophil chemotaxis
1867,"Chemotaxis, Leukocyte",regulation of leukocyte chemotaxis
1868,chromatin silencing at centromere,regulation of chromatin silencing at centromere
1869,border follicle cell delamination,regulation of border follicle cell delamination
1870,Ovulation,regulation of ovulation
1871,sequestering of triglyceride,regulation of sequestering of triglyceride
1872,Granulocyte differentiation,regulation of granulocyte differentiation
1873,epithelial cell differentiation,regulation of epithelial cell differentiation
1874,polarized epithelial cell differentiation,regulation of polarized epithelial cell differentiation
1875,alpha-glucan metabolic process,regulation of alpha-glucan metabolic process
1876,alpha-glucan biosynthetic process,regulation of alpha-glucan biosynthetic process
1877,linear element assembly,regulation of linear element assembly
1878,septation initiation signaling,regulation of septation initiation signaling
1879,myosin II filament assembly,regulation of myosin II filament assembly
1880,myosin II filament disassembly,regulation of myosin II filament disassembly
1881,myosin II filament organization,regulation of myosin II filament organization
1882,gene silencing by RNA,regulation of gene silencing by RNA
1883,chromatin silencing by small RNA,regulation of chromatin silencing by small RNA
1884,primary miRNA processing,regulation of primary miRNA processing
1885,pre-miRNA processing,regulation of pre-miRNA processing
1886,histone deacetylation at centromere,regulation of histone deacetylation at centromere
1887,stress-activated protein kinase signaling cascade,regulation of stress-activated protein kinase signaling cascade
1888,neuron projection regeneration,regulation of neuron projection regeneration
1889,axon regeneration,regulation of axon regeneration
1890,microtubule polymerization or depolymerization,regulation of microtubule polymerization or depolymerization
1891,mRNA 3'-end processing,regulation of mRNA 3'-end processing
1892,induction of conjugation upon nitrogen starvation,regulation of induction of conjugation upon nitrogen starvation
1893,sorocarp stalk cell differentiation,regulation of sorocarp stalk cell differentiation
1894,aggregation involved in sorocarp development,regulation of aggregation involved in sorocarp development
1895,neuron projection development,regulation of neuron projection development
1896,"endo-1,4-beta-xylanase activity","regulation of endo-1,4-beta-xylanase activity"
1897,Physiologic calcification,regulation of biomineral tissue development
1898,pseudopodium assembly,regulation of pseudopodium assembly
1899,lateral pseudopodium assembly,regulation of lateral pseudopodium assembly
1900,actin phosphorylation,regulation of actin phosphorylation
1901,retinal ganglion cell axon guidance,regulation of retinal ganglion cell axon guidance
1902,Ran protein signal transduction,regulation of Ran protein signal transduction
1903,T cell costimulation,regulation of T cell costimulation
1904,mating projection assembly,regulation of mating projection assembly
1905,fast-twitch skeletal muscle fiber contraction,regulation of fast-twitch skeletal muscle fiber contraction
1906,slow-twitch skeletal muscle fiber contraction,regulation of slow-twitch skeletal muscle fiber contraction
1907,Chromatin Modeling,regulation of chromatin assembly
1908,Chromatin Disassembly,regulation of chromatin disassembly
1909,fungal-type cell wall organization,regulation of fungal-type cell wall organization
1910,heterochromatin assembly,regulation of heterochromatin assembly
1911,actin cytoskeleton reorganization,regulation of actin cytoskeleton reorganization
1912,brain-derived neurotrophic factor receptor signaling pathway,regulation of brain-derived neurotrophic factor receptor signaling pathway
1913,cell-substrate adhesion,regulation of cell-substrate adhesion
1914,receptor internalization,regulation of receptor internalization
1915,synaptic vesicle fusion to presynaptic active zone membrane,regulation of synaptic vesicle fusion to presynaptic active zone membrane
1916,plasminogen activation,regulation of plasminogen activation
1917,killing of cells of other organism,regulation of killing of cells of other organism
1918,heat generation,regulation of heat generation
1919,heat dissipation,regulation of heat dissipation
1920,lipopolysaccharide-mediated signaling pathway,regulation of lipopolysaccharide-mediated signaling pathway
1921,response to nutrient levels,regulation of response to nutrient levels
1922,TOR signaling,regulation of TOR signaling
1923,locomotion involved in locomotory behavior,regulation of locomotion involved in locomotory behavior
1924,signal transduction involved in positive regulation of conjugation with cellular fusion,regulation of signal transduction involved in conjugation with cellular fusion
1925,ARF protein signal transduction,regulation of ARF protein signal transduction
1926,type IV site-specific deoxyribonuclease activity,regulation of type IV site-specific deoxyribonuclease activity
1927,response to food,regulation of response to food
1928,sequestering of zinc ion,regulation of sequestering of zinc ion
1929,establishment of actomyosin contractile ring localization,regulation of establishment of actomyosin contractile ring localization
1930,cellular transposition,regulation of transposition
1931,Retrotransposition,"regulation of transposition, RNA-mediated"
1932,telomere maintenance via semi-conservative replication,regulation of telomere maintenance via semi-conservative replication
1933,adenosine transport,regulation of adenosine transport
1934,gonadotropin secretion,regulation of gonadotropin secretion
1935,luteinizing hormone secretion,regulation of luteinizing hormone secretion
1936,icosanoid secretion,regulation of icosanoid secretion
1937,prostaglandin secretion,regulation of prostaglandin secretion
1938,activin secretion,regulation of activin secretion
1939,inhibin secretion,regulation of inhibin secretion
1940,aldosterone metabolic process,regulation of aldosterone metabolic process
1941,aldosterone biosynthetic process,regulation of aldosterone biosynthetic process
1942,intracellular lipid transport,regulation of intracellular lipid transport
1943,intracellular sterol transport,regulation of intracellular sterol transport
1944,intracellular cholesterol transport,regulation of intracellular cholesterol transport
1945,Rab protein signal transduction,regulation of Rab protein signal transduction
1946,Ral protein signal transduction,regulation of Ral protein signal transduction
1947,Rap protein signal transduction,regulation of Rap protein signal transduction
1948,Cdc42 protein signal transduction,regulation of Cdc42 protein signal transduction
1949,multicellular organismal process,regulation of multicellular organismal process
1950,Developmental process,regulation of developmental process
1951,cytokinetic process,regulation of cytokinetic process
1952,protein exit from endoplasmic reticulum,regulation of protein exit from endoplasmic reticulum
1953,microvillus organization,regulation of microvillus organization
1954,follicle cell microvillus organization,regulation of follicle cell microvillus organization
1955,Host-Seeking Behavior,regulation of host-seeking behavior
1956,mitochondrial translation,regulation of mitochondrial translation
1957,connective tissue growth factor production,regulation of connective tissue growth factor production
1958,chemokine production,regulation of chemokine production
1959,fractalkine production,regulation of fractalkine production
1960,granulocyte macrophage colony-stimulating factor production,regulation of granulocyte macrophage colony-stimulating factor production
1961,hepatocyte growth factor production,regulation of hepatocyte growth factor production
1962,type I interferon production,regulation of type I interferon production
1963,interferon-alpha production,regulation of interferon-alpha production
1964,interferon-beta production,regulation of interferon-beta production
1965,interferon-gamma production,regulation of interferon-gamma production
1966,interleukin-1 alpha production,regulation of interleukin-1 alpha production
1967,interleukin-1 beta production,regulation of interleukin-1 beta production
1968,interleukin-1 production,regulation of interleukin-1 production
1969,interleukin-10 production,regulation of interleukin-10 production
1970,interleukin-11 production,regulation of interleukin-11 production
1971,interleukin-12 production,regulation of interleukin-12 production
1972,interleukin-13 production,regulation of interleukin-13 production
1973,interleukin-14 production,regulation of interleukin-14 production
1974,interleukin-15 production,regulation of interleukin-15 production
1975,interleukin-16 production,regulation of interleukin-16 production
1976,interleukin-17 production,regulation of interleukin-17 production
1977,interleukin-18 production,regulation of interleukin-18 production
1978,interleukin-19 production,regulation of interleukin-19 production
1979,interleukin-2 production,regulation of interleukin-2 production
1980,interleukin-20 production,regulation of interleukin-20 production
1981,interleukin-21 production,regulation of interleukin-21 production
1982,interleukin-22 production,regulation of interleukin-22 production
1983,interleukin-23 production,regulation of interleukin-23 production
1984,interleukin-24 production,regulation of interleukin-24 production
1985,interleukin-25 production,regulation of interleukin-25 production
1986,interleukin-26 production,regulation of interleukin-26 production
1987,interleukin-27 production,regulation of interleukin-27 production
1988,interleukin-3 production,regulation of interleukin-3 production
1989,interleukin-4 production,regulation of interleukin-4 production
1990,interleukin-5 production,regulation of interleukin-5 production
1991,interleukin-6 production,regulation of interleukin-6 production
1992,interleukin-7 production,regulation of interleukin-7 production
1993,interleukin-8 production,regulation of interleukin-8 production
1994,interleukin-9 production,regulation of interleukin-9 production
1995,TRAIL production,regulation of TRAIL production
1996,tumor necrosis factor production,regulation of tumor necrosis factor production
1997,lymphotoxin A production,regulation of lymphotoxin A production
1998,mast cell cytokine production,regulation of mast cell cytokine production
1999,receptor biosynthetic process,regulation of receptor biosynthetic process
2000,receptor catabolic process,regulation of receptor catabolic process
2001,low-density lipoprotein particle receptor catabolic process,regulation of low-density lipoprotein particle receptor catabolic process
2002,glomerulus development,regulation of glomerulus development
2003,neurotrophin production,regulation of neurotrophin production
2004,nerve growth factor production,regulation of nerve growth factor production
2005,transforming growth factor beta1 production,regulation of transforming growth factor beta1 production
2006,transforming growth factor beta2 production,regulation of transforming growth factor beta2 production
2007,transforming growth factor beta3 production,regulation of transforming growth factor beta3 production
2008,activin receptor signaling pathway,regulation of activin receptor signaling pathway
2009,SREBP signaling pathway,regulation of SREBP signaling pathway
2010,mononuclear cell proliferation,regulation of mononuclear cell proliferation
2011,inositol phosphate biosynthetic process,regulation of inositol phosphate biosynthetic process
2012,inositol trisphosphate biosynthetic process,regulation of inositol trisphosphate biosynthetic process
2013,collagen metabolic process,regulation of collagen metabolic process
2014,collagen biosynthetic process,regulation of collagen biosynthetic process
2015,mast cell apoptotic process,regulation of mast cell apoptotic process
2016,Myeloid Cell Apoptotic Process,regulation of myeloid cell apoptotic process
2017,T-Cell Differentiation in the Thymus,regulation of T cell differentiation in thymus
2018,extrathymic T cell differentiation,regulation of extrathymic T cell differentiation
2019,immature T cell proliferation,regulation of immature T cell proliferation
2020,immature T cell proliferation in thymus,regulation of immature T cell proliferation in thymus
2021,calcineurin-NFAT signaling cascade,regulation of calcineurin-NFAT signaling cascade
2022,tumor necrosis factor-mediated signaling pathway,regulation of tumor necrosis factor-mediated signaling pathway
2023,penicillinase activity,regulation of penicillinase activity
2024,nuclear DNA replication,regulation of nuclear cell cycle DNA replication
2025,secretion of lysosomal enzymes,regulation of secretion of lysosomal enzymes
2026,cholesterol efflux,regulation of cholesterol efflux
2027,raffinose metabolic process,regulation of raffinose metabolic process
2028,Cellular Stress Response,regulation of cellular response to stress
2029,protein glycosylation in Golgi,regulation of protein glycosylation in Golgi
2030,mammary gland epithelial cell proliferation,regulation of mammary gland epithelial cell proliferation
2031,integrin activation,regulation of integrin activation
2032,Focal adhesion pathway,regulation of cell adhesion mediated by integrin
2033,cell-cell adhesion mediated by integrin,regulation of cell-cell adhesion mediated by integrin
2034,osteoblast proliferation,regulation of osteoblast proliferation
2035,cytoplasmic mRNA processing body assembly,regulation of cytoplasmic mRNA processing body assembly
2036,maintenance of sister chromatid cohesion,regulation of maintenance of sister chromatid cohesion
2037,maintenance of mitotic sister chromatid cohesion,regulation of maintenance of mitotic sister chromatid cohesion
2038,maintenance of meiotic sister chromatid cohesion,regulation of maintenance of meiotic sister chromatid cohesion
2039,response to cytokine,regulation of response to cytokine stimulus
2040,erythrocyte clearance,regulation of erythrocyte clearance
2041,homotypic cell-cell adhesion,regulation of homotypic cell-cell adhesion
2042,heterotypic cell-cell adhesion,regulation of heterotypic cell-cell adhesion
2043,Erythrocyte aggregation function,regulation of erythrocyte aggregation
2044,toll-like receptor 1 signaling pathway,regulation of toll-like receptor 1 signaling pathway
2045,toll-like receptor 2 signaling pathway,regulation of toll-like receptor 2 signaling pathway
2046,toll-like receptor 3 signaling pathway,regulation of toll-like receptor 3 signaling pathway
2047,toll-like receptor 4 signaling pathway,regulation of toll-like receptor 4 signaling pathway
2048,toll-like receptor 5 signaling pathway,regulation of toll-like receptor 5 signaling pathway
2049,toll-like receptor 6 signaling pathway,regulation of toll-like receptor 6 signaling pathway
2050,toll-like receptor 7 signaling pathway,regulation of toll-like receptor 7 signaling pathway
2051,toll-like receptor 8 signaling pathway,regulation of toll-like receptor 8 signaling pathway
2052,toll-like receptor 9 signaling pathway,regulation of toll-like receptor 9 signaling pathway
2053,toll-like receptor 10 signaling pathway,regulation of toll-like receptor 10 signaling pathway
2054,toll-like receptor 11 signaling pathway,regulation of toll-like receptor 11 signaling pathway
2055,toll-like receptor 12 signaling pathway,regulation of toll-like receptor 12 signaling pathway
2056,toll-like receptor 13 signaling pathway,regulation of toll-like receptor 13 signaling pathway
2057,apolipoprotein binding,regulation of apolipoprotein binding
2058,ascospore wall chitin biosynthetic process,regulation of ascospore wall chitin biosynthetic process
2059,ion transmembrane transport,regulation of ion transmembrane transport
2060,ascospore wall chitin catabolic process,regulation of ascospore wall chitin catabolic process
2061,macrophage fusion,regulation of macrophage fusion
2062,sexual sporulation,regulation of sexual sporulation
2063,basidiospore formation,regulation of basidiospore formation
2064,zygospore formation,regulation of zygospore formation
2065,sporangiospore formation,regulation of sporangiospore formation
2066,Arp2/3 complex-mediated actin nucleation,regulation of Arp2/3 complex-mediated actin nucleation
2067,response to interferon-gamma,regulation of response to interferon-gamma
2068,type III interferon production,regulation of type III interferon production
2069,glial cell apoptotic process,regulation of glial cell apoptotic process
2070,chylomicron remodeling,regulation of chylomicron remodeling
2071,very-low-density lipoprotein particle remodeling,regulation of very-low-density lipoprotein particle remodeling
2072,high-density lipoprotein particle assembly,regulation of high-density lipoprotein particle assembly
2073,plasma lipoprotein particle clearance,regulation of lipoprotein particle clearance
2074,chylomicron remnant clearance,regulation of chylomicron remnant clearance
2075,low-density lipoprotein particle clearance,regulation of low-density lipoprotein particle clearance
2076,high-density lipoprotein particle clearance,regulation of high-density lipoprotein particle clearance
2077,smooth muscle cell apoptotic process,regulation of smooth muscle cell apoptotic process
2078,protein localization to cell surface,regulation of protein localization to cell surface
2079,cell wall (1->3)-beta-D-glucan biosynthetic process,regulation of cell wall (1->3)-beta-D-glucan biosynthetic process
2080,ascospore wall beta-glucan biosynthetic process,regulation of ascospore wall beta-glucan biosynthetic process
2081,ascospore wall (1->3)-beta-D-glucan biosynthetic process,regulation of ascospore wall (1->3)-beta-D-glucan biosynthetic process
2082,cholesterol esterification,regulation of cholesterol esterification
2083,lipoprotein lipid oxidation,regulation of lipoprotein lipid oxidation
2084,plasma lipoprotein particle oxidation,regulation of plasma lipoprotein oxidation
2085,very-low-density lipoprotein particle clearance,regulation of very-low-density lipoprotein particle clearance
2086,Tooth Calcification,regulation of tooth mineralization
2087,centromere complex assembly,regulation of centromere complex assembly
2088,turning behavior involved in mating,regulation of turning behavior involved in mating
2089,phosphatidylcholine catabolic process,regulation of phosphatidylcholine catabolic process
2090,cellular macromolecule biosynthetic process,regulation of cellular macromolecule biosynthetic process
2091,cortisol biosynthetic process,regulation of cortisol biosynthetic process
2092,iron ion transmembrane transport,regulation of iron ion transmembrane transport
2093,histone H4-K20 methylation,regulation of histone H4-K20 methylation
2094,protein folding in endoplasmic reticulum,regulation of protein folding in endoplasmic reticulum
2095,phosphatidylinositol 3-kinase activity,regulation of phosphatidylinositol 3-kinase activity
2096,melanization defense response,regulation of melanization defense response
2097,lamellocyte differentiation,regulation of lamellocyte differentiation
2098,hemocyte proliferation,regulation of hemocyte proliferation
2099,preblastoderm mitotic cell cycle,regulation of preblastoderm mitotic cell cycle
2100,syncytial blastoderm mitotic cell cycle,regulation of syncytial blastoderm mitotic cell cycle
2101,gene silencing by miRNA,regulation of gene silencing by miRNA
2102,"synaptic transmission, glutamatergic","regulation of synaptic transmission, glutamatergic"
2103,multicellular organism growth,regulation of multicellular organism growth
2104,organ growth,regulation of organ growth
2105,meristem growth,regulation of meristem growth
2106,hippo signaling,regulation of hippo signaling
2107,inosine transport,regulation of inosine transport
2108,hypoxanthine transport,regulation of hypoxanthine transport
2109,PPAR Signaling Pathway,regulation of peroxisome proliferator activated receptor signaling pathway
2110,thymine transport,regulation of thymine transport
2111,Roundabout signaling pathway,regulation of Roundabout signaling pathway
2112,chemokine (C-X-C motif) ligand 9 production,regulation of chemokine (C-X-C motif) ligand 9 production
2113,gluconate transmembrane transport,regulation of gluconate transmembrane transport
2114,phosphate ion transmembrane transport,regulation of phosphate transmembrane transport
2115,transforming growth factor beta receptor signaling pathway involved in determination of left/right asymmetry,regulation of transforming growth factor receptor beta signaling pathway involved in determination of left/right asymmetry
2116,SNARE complex assembly,regulation of SNARE complex assembly
2117,SNARE complex disassembly,regulation of SNARE complex disassembly
2118,chemokine (C-C motif) ligand 6 production,regulation of chemokine (C-C motif) ligand 6 production
2119,chemokine (C-C motif) ligand 6 secretion,regulation of chemokine (C-C motif) ligand 6 secretion
2120,interferon-beta secretion,regulation of interferon-beta secretion
2121,non-canonical Wnt signaling pathway,regulation of non-canonical Wnt signaling pathway
2122,entry of bacterium into host cell,regulation of entry of bacterium into host cell
2123,interleukin-18-mediated signaling pathway,regulation of interleukin-18-mediated signaling pathway
2124,toll-like receptor 15 signaling pathway,regulation of toll-like receptor 15 signaling pathway
2125,toll-like receptor 21 signaling pathway,regulation of toll-like receptor 21 signaling pathway
2126,macrophage migration inhibitory factor signaling pathway,regulation of macrophage migration inhibitory factor signaling pathway
2127,monocyte extravasation,regulation of monocyte extravasation
2128,"CD8-positive, alpha-beta T cell extravasation","regulation of CD8-positive, alpha-beta T cell extravasation"
2129,"CD8-positive, alpha-beta cytotoxic T cell extravasation","regulation of CD8-positive, alpha-beta cytotoxic T cell extravasation"
2130,T-helper 17 cell extravasation,regulation of T-helper 17 cell extravasation
2131,astrocyte chemotaxis,regulation of astrocyte chemotaxis
2132,hematopoietic stem cell migration,regulation of hematopoietic stem cell migration
2133,interleukin-4-dependent isotype switching to IgE isotypes,regulation of interleukin-4-dependent isotype switching to IgE isotypes
2134,memory T cell activation,regulation of memory T cell activation
2135,"CD4-positive, alpha-beta T cell activation","regulation of CD4-positive, alpha-beta T cell activation"
2136,T-helper 1 cell activation,regulation of T-helper 1 cell activation
2137,T-helper 2 cell activation,regulation of T-helper 2 cell activation
2138,CD24 biosynthetic process,regulation of CD24 biosynthetic process
2139,hepatic stellate cell activation,regulation of hepatic stellate cell activation
2140,cell proliferation involved in compound eye morphogenesis,regulation of cell proliferation involved in compound eye morphogenesis
2141,"CD4-positive, alpha-beta T cell proliferation","regulation of CD4-positive, alpha-beta T cell proliferation"
2142,"CD8-positive, alpha-beta T cell proliferation","regulation of CD8-positive, alpha-beta T cell proliferation"
2143,T-helper 1 cell cytokine production,regulation of T-helper 1 cell cytokine production
2144,T-helper 2 cell cytokine production,regulation of T-helper 2 cell cytokine production
2145,granzyme A production,regulation of granzyme A production
2146,natural killer cell chemotaxis,regulation of natural killer cell chemotaxis
2147,B cell chemotaxis,regulation of B cell chemotaxis
2148,endothelial cell chemotaxis to fibroblast growth factor,regulation of endothelial cell chemotaxis to fibroblast growth factor
2149,insulin secretion involved in cellular response to glucose stimulus,regulation of insulin secretion involved in cellular response to glucose stimulus
2150,metanephric mesenchymal cell migration,regulation of metanephric mesenchymal cell migration
