,CUI1,CUI2
3585,camalexin biosynthetic process,regulation of camalexin biosynthetic process
3586,ephrin receptor signaling pathway,regulation of ephrin receptor signaling pathway
3587,extracellular matrix assembly,regulation of extracellular matrix assembly
3588,heart looping,regulation of heart looping
3589,neuron death,regulation of neuron death
3590,neuron death,regulation of neuron death
3591,lung ciliated cell differentiation,regulation of lung ciliated cell differentiation
3592,sorocarp spore cell differentiation,regulation of sorocarp spore cell differentiation
3593,histone H2A K63-linked ubiquitination,regulation of histone H2A K63-linked ubiquitination
3594,flagellated sperm motility,regulation of flagellated sperm motility
3595,leaf morphogenesis,regulation of leaf morphogenesis
3596,syringal lignin biosynthetic process,regulation of syringal lignin biosynthetic process
3597,response to cycloalkane,regulation of response to cycloalkane
3598,toluene metabolic process,regulation of toluene metabolic process
3599,response to toluene,regulation of response to toluene
3600,tetrapyrrole biosynthetic process,regulation of tetrapyrrole biosynthetic process
3601,release of sequestered calcium ion into cytosol by Golgi,regulation of Golgi calcium ion export
3602,acylglycerol transport,regulation of acylglycerol transport
3603,DNA Demethylation,regulation of DNA demethylation
3604,Lymphocyte chemotaxis,regulation of lymphocyte chemotaxis
3605,postsynaptic membrane organization,regulation of postsynaptic membrane organization
3606,histone H3-K27 acetylation,regulation of histone H3-K27 acetylation
3607,nucleolar large rRNA transcription by RNA polymerase I,regulation of transcription of nucleolar large rRNA by RNA polymerase I
3608,high voltage-gated calcium channel activity,regulation of high voltage-gated calcium channel activity
3609,mitochondrial DNA metabolic process,regulation of mitochondrial DNA metabolic process
3610,Post-Translational Protein Processing,regulation of post-translational protein modification
3611,relaxation of cardiac muscle,regulation of relaxation of cardiac muscle
3612,capsule organization,regulation of capsule organization
3613,capsule organization,regulation of capsule organization
3614,exoribonuclease activity,regulation of exoribonuclease activity
3615,retrograde neuronal dense core vesicle transport,regulation of retrograde dense core granule transport
3616,cellular response to iron ion starvation,regulation of cellular response to iron ion starvation
3617,DNA-5-methylcytosine glycosylase activity,regulation of DNA-5-methylcytosine glycosylase activity
3618,inward rectifier potassium channel activity,regulation of inward rectifier potassium channel activity
3619,mitotic cell cycle phase transition,regulation of mitotic cell cycle phase transition
3620,meiotic cell cycle phase transition,regulation of meiotic cell cycle phase transition
3621,indoleacetic acid biosynthetic process via tryptophan,regulation of indoleacetic acid biosynthetic process via tryptophan
3622,amyloid-beta formation,regulation of amyloid-beta formation
3623,toxin transport,regulation of toxin transport
3624,toxin transport,regulation of toxin transport
3625,cilium-dependent cell motility,regulation of cilium-dependent cell motility
3626,bacterial-type flagellum-dependent cell motility,regulation of bacterial-type flagellum-dependent cell motility
3627,hematopoietic stem cell proliferation,regulation of hematopoietic stem cell proliferation
3628,extrinsic apoptotic signaling pathway via death domain receptors,regulation of extrinsic apoptotic signaling pathway via death domain receptors
3629,serine phosphorylation of STAT protein,regulation of peptidyl-serine phosphorylation of STAT protein
3630,cysteine-type endopeptidase activity involved in apoptotic process,regulation of cysteine-type endopeptidase activity involved in apoptotic process
3631,type B pancreatic cell proliferation,regulation of type B pancreatic cell proliferation
3632,cellobiose catabolic process,regulation of cellobiose catabolic process
3633,coenzyme F420-dependent bicyclic nitroimidazole catabolic process,regulation of coenzyme F420-dependent bicyclic nitroimidazole catabolic process
3634,heptasaccharide transport,regulation of heptasaccharide transport
3635,maltohexaose transport,regulation of maltohexaose transport
3636,methane biosynthetic process from carbon monoxide,regulation of methane biosynthetic process from carbon monoxide
3637,methane biosynthetic process from methanethiol,regulation of methane biosynthetic process from methanethiol
3638,secondary metabolite biosynthetic process,regulation of secondary metabolite biosynthetic process
3639,flavonol biosynthetic process,regulation of flavonol biosynthetic process
3640,defense response to bacterium,regulation of defense response to bacterium
3641,flocculation via cell wall protein-carbohydrate interaction,regulation of flocculation via cell wall protein-carbohydrate interaction
3642,phosphatidylserine biosynthetic process,regulation of phosphatidylserine biosynthetic process
3643,butyryl-CoA catabolic process to butanol,regulation of butyryl-CoA catabolic process to butanol
3644,butyryl-CoA catabolic process to butyrate,regulation of butyryl-CoA catabolic process to butyrate
3645,butyryl-CoA catabolic process to butyrate,regulation of butyryl-CoA catabolic process to butyrate
3646,starch utilization system complex assembly,regulation of starch utilization system complex assembly
3647,shoot system morphogenesis,regulation of shoot system morphogenesis
3648,emericellamide A biosynthetic process,regulation of emericellamide A biosynthetic process
3649,gerfelin biosynthetic process,regulation of gerfelin biosynthetic process
3650,tensidol A biosynthetic process,regulation of tensidol A biosynthetic process
3651,protein adenylylation,regulation of protein adenylylation
3652,brevianamide F biosynthetic process,regulation of brevianamide F biosynthetic process
3653,cordyol C biosynthetic process,regulation of cordyol C biosynthetic process
3654,pentadecane biosynthetic process,regulation of pentadecane biosynthetic process
3655,hexadecanal biosynthetic process,regulation of hexadecanal biosynthetic process
3656,olefin biosynthetic process,regulation of olefin biosynthetic process
3657,nonadec-1-ene metabolic process,regulation of nonadec-1-ene metabolic process
3658,nonadec-1-ene biosynthetic process,regulation of nonadec-1-ene biosynthetic process
3659,"(Z)-nonadeca-1,14-diene metabolic process","regulation of (Z)-nonadeca-1,14-diene metabolic process"
3660,18-methylnonadec-1-ene biosynthetic process,regulation of 18-methylnonadec-1-ene biosynthetic process
3661,methanophenazine biosynthetic process,regulation of methanophenazine biosynthetic process
3662,sarcinapterin biosynthetic process,regulation of sarcinapterin biosynthetic process
3663,calcium ion transmembrane transporter activity,regulation of calcium ion transmembrane transporter activity
3664,response to reactive oxygen species,regulation of response to reactive oxygen species
3665,Muscle relaxation phase,regulation of relaxation of muscle
3666,relaxation of smooth muscle,regulation of relaxation of smooth muscle
3667,autophagosome maturation,regulation of autophagosome maturation
3668,extracellular matrix assembly,regulation of extracellular matrix assembly
3669,cardiac chamber morphogenesis,regulation of cardiac chamber morphogenesis
3670,cardiac chamber morphogenesis,regulation of cardiac chamber morphogenesis
3671,NIK/NF-kappaB signaling,regulation of NIK/NF-kappaB signaling
3672,hydrogen peroxide-mediated programmed cell death,regulation of hydrogen peroxide-mediated programmed cell death
3673,spermidine biosynthetic process,regulation of spermidine biosynthetic process
3674,sterol regulatory element binding protein cleavage,regulation of sterol regulatory element binding protein cleavage
3675,phosphatidylglycerol biosynthetic process,regulation of phosphatidylglycerol biosynthetic process
3676,voltage-gated calcium channel activity,regulation of voltage-gated calcium channel activity
3677,transforming growth factor beta3 activation,regulation of transforming growth factor beta3 activation
3678,tetrapyrrole biosynthetic process from glutamate,regulation of tetrapyrrole biosynthetic process from glutamate
3679,tetrapyrrole biosynthetic process from glycine and succinyl-CoA,regulation of tetrapyrrole biosynthetic process from glycine and succinyl-CoA
3680,response to alcohol,regulation of response to alcohol
3681,response to benzene,regulation of response to benzene
3682,response to toluene,regulation of response to toluene
3683,tetrapyrrole biosynthetic process,regulation of tetrapyrrole biosynthetic process
3684,Lymphangiogenesis,regulation of lymphangiogenesis
3685,acid-sensing ion channel activity,regulation of acid-sensing ion channel activity
3686,vesicle transport along microtubule,regulation of vesicle transport along microtubule
3687,actomyosin contractile ring localization,regulation of actomyosin contractile ring localization
3688,NAD+ ADP-ribosyltransferase activity,regulation of NAD+ ADP-ribosyltransferase activity
3689,superoxide dismutase activity,regulation of superoxide dismutase activity
3690,cell proliferation involved in kidney development,regulation of cell proliferation involved in kidney development
3691,nucleolar large rRNA transcription by RNA polymerase I,regulation of transcription of nucleolar large rRNA by RNA polymerase I
3692,cell septum assembly,regulation of cell septum assembly
3693,protein localization to cell division site,regulation of protein localization to cell division site
3694,anterograde neuronal dense core vesicle transport,regulation of anterograde dense core granule transport
3695,inward rectifier potassium channel activity,regulation of inward rectifier potassium channel activity
3696,mitotic cell cycle phase transition,regulation of mitotic cell cycle phase transition
3697,proline biosynthetic process,regulation of proline biosynthetic process
3698,cartilage condensation,regulation of cartilage condensation
3699,histone H3-K18 acetylation,regulation of histone H3-K18 acetylation
3700,Fas signaling pathway,regulation of Fas signaling pathway
3701,mesenchymal cell apoptotic process involved in nephron morphogenesis,regulation of mesenchymal cell apoptotic process involved in nephron morphogenesis
3702,mesenchymal cell apoptotic process involved in nephron morphogenesis,regulation of mesenchymal cell apoptotic process involved in nephron morphogenesis
3703,cell motility involved in somitogenic axis elongation,regulation of cell motility involved in somitogenic axis elongation
3704,proteinase activated receptor activity,regulation of proteinase activated receptor activity
3705,"CD4-positive, alpha-beta T cell costimulation","regulation of CD4-positive, alpha-beta T cell costimulation"
3706,galactotriose transport,regulation of galactotriose transport
3707,methane biosynthetic process from dimethylamine,regulation of methane biosynthetic process from dimethylamine
3708,methane biosynthetic process from carbon monoxide,regulation of methane biosynthetic process from carbon monoxide
3709,pentasaccharide transport,regulation of pentasaccharide transport
3710,RNA Interference,regulation of RNA interference
3711,cellular response to oxidative stress,regulation of cellular response to oxidative stress
3712,filamentous growth of a population of unicellular organisms,regulation of filamentous growth of a population of unicellular organisms
3713,filamentous growth of a population of unicellular organisms in response to heat,regulation of filamentous growth of a population of unicellular organisms in response to heat
3714,filamentous growth of a population of unicellular organisms in response to chemical stimulus,regulation of filamentous growth of a population of unicellular organisms in response to chemical stimulus
3715,glutamate receptor signaling pathway,regulation of glutamate receptor signaling pathway
3716,brassinosteroid mediated signaling pathway,regulation of brassinosteroid mediated signaling pathway
3717,[2Fe-2S] cluster assembly,regulation of [2Fe-2S] cluster assembly
3718,butyryl-CoA catabolic process to butanol,regulation of butyryl-CoA catabolic process to butanol
3719,iron-sulfur-molybdenum cofactor assembly,regulation of iron-sulfur-molybdenum cofactor assembly
3720,diorcinol biosynthetic process,regulation of diorcinol biosynthetic process
3721,ferricrocin biosynthetic process,regulation of ferricrocin biosynthetic process
3722,fumonisin biosynthetic process,regulation of fumonisin biosynthetic process
3723,fumonisin biosynthetic process,regulation of fumonisin biosynthetic process
3724,orcinol biosynthetic process,regulation of orcinol biosynthetic process
3725,violaceol I biosynthetic process,regulation of violaceol I biosynthetic process
3726,phospholipase C-activating G protein-coupled receptor signaling pathway,regulation of phospholipase C-activating G protein-coupled receptor signaling pathway
3727,vascular endothelial growth factor signaling pathway,regulation of vascular endothelial growth factor signaling pathway
3728,emericellin biosynthetic process,regulation of emericellin biosynthetic process
3729,helvolic acid biosynthetic process,regulation of helvolic acid biosynthetic process
3730,naphtho-gamma-pyrone biosynthetic process,regulation of naphtho-gamma-pyrone biosynthetic process
3731,heptadecane biosynthetic process,regulation of heptadecane biosynthetic process
3732,hexadecanal biosynthetic process,regulation of hexadecanal biosynthetic process
3733,nonadec-1-ene metabolic process,regulation of nonadec-1-ene metabolic process
3734,"(Z)-nonadeca-1,14-diene biosynthetic process","regulation of (Z)-nonadeca-1,14-diene biosynthetic process"
3735,isoprenoid biosynthetic process,regulation of isoprene biosynthetic process
3736,methanophenazine metabolic process,regulation of methanophenazine metabolic process
3737,sarcinapterin biosynthetic process,regulation of sarcinapterin biosynthetic process
3738,tatiopterin biosynthetic process,regulation of tatiopterin biosynthetic process
3739,salinity response,regulation of response to salt stress
3740,mitochondrial outer membrane permeabilization,regulation of mitochondrial outer membrane permeabilization involved in apoptotic signaling pathway
3741,relaxation of smooth muscle,regulation of relaxation of smooth muscle
3742,autophagosome maturation,regulation of autophagosome maturation
3743,camalexin biosynthetic process,regulation of camalexin biosynthetic process
3744,ERBB Family Signaling Pathway,regulation of ERBB signaling pathway
3745,cardiac chamber formation,regulation of cardiac chamber formation
3746,holin activity,regulation of holin activity
3747,convergent extension involved in axis elongation,regulation of convergent extension involved in axis elongation
3748,odontoblast differentiation,regulation of odontoblast differentiation
3749,vasculature development,regulation of vasculature development
3750,response to propan-1-ol,regulation of response to propan-1-ol
3751,response to butan-1-ol,regulation of response to butan-1-ol
3752,response to acetate,regulation of response to acetate
3753,transcription factor catabolic process,regulation of transcription factor catabolic process
3754,"ent-pimara-8(14),15-diene biosynthetic process","regulation of ent-pimara-8(14),15-diene biosynthetic process"
3755,"ent-pimara-8(14),15-diene biosynthetic process","regulation of ent-pimara-8(14),15-diene biosynthetic process"
3756,synaptic vesicle lumen acidification,regulation of synaptic vesicle lumen acidification
3757,synaptic vesicle lumen acidification,regulation of synaptic vesicle lumen acidification
3758,alkane biosynthetic process,regulation of alkane biosynthetic process
3759,telomeric repeat-containing RNA transcription by RNA polymerase II,regulation of telomeric RNA transcription from RNA pol II promoter
3760,compound eye retinal cell apoptotic process,regulation of compound eye retinal cell apoptotic process
3761,homoserine biosynthetic process,regulation of homoserine biosynthetic process
3762,NMS complex assembly,regulation of NMS complex assembly
3763,signal transduction by p53 class mediator,regulation of signal transduction by p53 class mediator
3764,muscle tissue development,regulation of muscle tissue development
3765,calcium-transporting ATPase activity,regulation of ATPase-coupled calcium transmembrane transporter activity
3766,hematopoietic stem cell proliferation,regulation of hematopoietic stem cell proliferation
3767,hematopoietic stem cell differentiation,regulation of hematopoietic stem cell differentiation
3768,cellotriose transport,regulation of cellotriose transport
3769,laminaritriose transport,regulation of laminaritriose transport
3770,maltoheptaose metabolic process,regulation of maltoheptaose metabolic process
3771,maltotetraose transport,regulation of maltotetraose transport
3772,methane biosynthetic process from trimethylamine,regulation of methane biosynthetic process from trimethylamine
3773,methane biosynthetic process from 3-(methylthio)propionic acid,regulation of methane biosynthetic process from 3-(methylthio)propionic acid
3774,methane biosynthetic process from methanethiol,regulation of methane biosynthetic process from methanethiol
3775,methane biosynthetic process from methylamine,regulation of methane biosynthetic process from methylamine
3776,nigerotriose transport,regulation of nigerotriose transport
3777,pentasaccharide transport,regulation of pentasaccharide transport
3778,secondary metabolite biosynthetic process,regulation of secondary metabolite biosynthetic process
3779,kojic acid biosynthetic process,regulation of kojic acid biosynthetic process
3780,cellular alcohol biosynthetic process,regulation of cellular alcohol catabolic process
3781,filamentous growth of a population of unicellular organisms in response to chemical stimulus,regulation of filamentous growth of a population of unicellular organisms in response to chemical stimulus
3782,filamentous growth of a population of unicellular organisms in response to neutral pH,regulation of filamentous growth of a population of unicellular organisms in response to neutral pH
3783,purine nucleotide metabolic process,regulation of purine nucleotide metabolic process
3784,chanoclavine-I biosynthetic process,regulation of chanoclavine-I biosynthetic process
3785,demethylkotanin biosynthetic process,regulation of demethylkotanin biosynthetic process
3786,emericellamide A biosynthetic process,regulation of emericellamide A biosynthetic process
3787,gerfelin biosynthetic process,regulation of gerfelin biosynthetic process
3788,violaceol II biosynthetic process,regulation of violaceol II biosynthetic process
3789,phospholipase C-activating G protein-coupled receptor signaling pathway,regulation of phospholipase C-activating G protein-coupled receptor signaling pathway
3790,protein insertion into mitochondrial membrane involved in apoptotic signaling pathway,regulation of protein insertion into mitochondrial membrane involved in apoptotic signaling pathway
3791,p38MAPK cascade,regulation of p38MAPK cascade
3792,vascular endothelial growth factor signaling pathway,regulation of vascular endothelial growth factor signaling pathway
3793,fumigaclavine C biosynthetic process,regulation of fumigaclavine C biosynthetic process
3794,tridecane metabolic process,regulation of tridecane metabolic process
3795,"(Z)-nonadeca-1,14-diene metabolic process","regulation of (Z)-nonadeca-1,14-diene metabolic process"
3796,isoprenoid metabolic process,regulation of isoprene metabolic process
3797,isoprenoid biosynthetic process,regulation of isoprene biosynthetic process
3798,17-methylnonadec-1-ene metabolic process,regulation of 17-methylnonadec-1-ene metabolic process
3799,sarcinapterin metabolic process,regulation of sarcinapterin metabolic process
3800,salinity response,regulation of response to salt stress
3801,potassium ion transmembrane transporter activity,regulation of potassium ion transmembrane transporter activity
3802,calcium ion transmembrane transporter activity,regulation of calcium ion transmembrane transporter activity
3803,mitochondrial outer membrane permeabilization,regulation of mitochondrial outer membrane permeabilization involved in apoptotic signaling pathway
3804,peptide antigen transport,regulation of peptide antigen transport
3805,protein homotetramerization,regulation of protein homotetramerization
3806,ERBB Family Signaling Pathway,regulation of ERBB signaling pathway
3807,formation of translation initiation ternary complex,regulation of formation of translation initiation ternary complex
3808,formation of translation preinitiation complex,regulation of formation of translation preinitiation complex
3809,formation of translation preinitiation complex,regulation of formation of translation preinitiation complex
3810,canonical Wnt signaling pathway involved in cardiac muscle cell fate commitment,regulation of canonical Wnt signaling pathway involved in cardiac muscle cell fate commitment
3811,flagellated sperm motility,regulation of flagellated sperm motility
3812,transforming growth factor beta activation,regulation of transforming growth factor beta activation
3813,transforming growth factor beta2 activation,regulation of transforming growth factor beta2 activation
3814,toluene catabolic process,regulation of toluene catabolic process
3815,response to butan-1-ol,regulation of response to butan-1-ol
3816,response to benzene,regulation of response to benzene
3817,ferulate catabolic process,regulation of ferulate catabolic process
3818,syringal lignin catabolic process,regulation of syringal lignin catabolic process
3819,syringal lignin catabolic process,regulation of syringal lignin catabolic process
3820,transcription factor catabolic process,regulation of transcription factor catabolic process
3821,cysteine metabolism,regulation of cysteine metabolic process
3822,Mitophagy,regulation of mitophagy
3823,acid-sensing ion channel activity,regulation of acid-sensing ion channel activity
3824,presynaptic membrane organization,regulation of presynaptic membrane organization
3825,mitotic chromosome decondensation,regulation of mitotic chromosome decondensation
3826,mitotic spindle assembly,regulation of mitotic spindle assembly
3827,gamma-aminobutyric acid catabolic process,regulation of gamma-aminobutyric acid catabolic process
3828,histone deacetylase activity,regulation of histone deacetylase activity
3829,myoblast fusion,regulation of myoblast fusion
3830,myoblast fusion,regulation of myoblast fusion
3831,signal transduction by p53 class mediator,regulation of signal transduction by p53 class mediator
3832,deadenylation-independent decapping of nuclear-transcribed mRNA,regulation of deadenylation-independent decapping of nuclear-transcribed mRNA
3833,high voltage-gated calcium channel activity,regulation of high voltage-gated calcium channel activity
3834,mitochondrial DNA metabolic process,regulation of mitochondrial DNA metabolic process
3835,calcium ion binding,regulation of calcium ion binding
3836,calcium ion binding,regulation of calcium ion binding
3837,exoribonuclease activity,regulation of exoribonuclease activity
3838,sclerotium development,regulation of sclerotium development
3839,cell proliferation involved in outflow tract morphogenesis,regulation of cell proliferation involved in outflow tract morphogenesis
3840,polynucleotide 3'-phosphatase activity,regulation of polynucleotide 3'-phosphatase activity
3841,polynucleotide 3'-phosphatase activity,regulation of polynucleotide 3'-phosphatase activity
3842,cell cycle phase transition,regulation of cell cycle phase transition
3843,amyloid-beta formation,regulation of amyloid-beta formation
3844,histone H3-K18 acetylation,regulation of histone H3-K18 acetylation
3845,NADP metabolic process,regulation of NADP metabolic process
3846,extrinsic apoptotic signaling pathway via death domain receptors,regulation of extrinsic apoptotic signaling pathway via death domain receptors
3847,membrane repolarization,regulation of membrane repolarization
3848,proteinase activated receptor activity,regulation of proteinase activated receptor activity
3849,cellobiose catabolic process,regulation of cellobiose catabolic process
3850,hexasaccharide transport,regulation of hexasaccharide transport
3851,laminarabiose transport,regulation of laminarabiose transport
3852,laminarabiose transport,regulation of laminarabiose transport
3853,maltoheptaose transport,regulation of maltoheptaose transport
3854,maltoheptaose metabolic process,regulation of maltoheptaose metabolic process
3855,maltotriulose transport,regulation of maltotriulose transport
3856,mannotriose transport,regulation of mannotriose transport
3857,methane biosynthetic process from trimethylamine,regulation of methane biosynthetic process from trimethylamine
3858,nigerotriose transport,regulation of nigerotriose transport
3859,flavonol biosynthetic process,regulation of flavonol biosynthetic process
3860,filamentous growth of a population of unicellular organisms in response to starvation,regulation of filamentous growth of a population of unicellular organisms in response to starvation
3861,filamentous growth of a population of unicellular organisms in response to neutral pH,regulation of filamentous growth of a population of unicellular organisms in response to neutral pH
3862,flocculation via cell wall protein-carbohydrate interaction,regulation of flocculation via cell wall protein-carbohydrate interaction
3863,protein targeting to vacuolar membrane,regulation of protein targeting to vacuolar membrane
3864,[4Fe-4S] cluster assembly,regulation of [4Fe-4S] cluster assembly
3865,shoot system morphogenesis,regulation of shoot system morphogenesis
