,CUI1,CUI2
5753,Primary closed reduction of fracture and unlocked unreamed intramedullary nail fixation,Internal Fixators
5754,Primary closed reduction of fracture and wire fixation,Internal Fixators
5755,Revision to closed reduction of fracture and locked reamed intramedullary nail fixation,Internal Fixators
5756,Revision to closed reduction of fracture and locked unreamed intramedullary nail fixation,Internal Fixators
5757,Revision to closed reduction of fracture and unlocked reamed intramedullary nail fixation,Internal Fixators
5758,Revision to closed reduction of fracture and unlocked unreamed intramedullary nail fixation,Internal Fixators
5759,Revision to closed reduction of fracture and wire fixation,Internal Fixators
5760,Revision to closed reduction of fracture and internal fixation with screw(s),Internal Fixators
5761,Closed reduction of fracture of bone and fixation to skeleton however further qualified,External Fixation Devices
5762,Closed reduction of fracture of bone and fixation using functional bracing system,External Fixation Devices
5763,Remanipulation of fracture of bone and external fixation however further qualified,External Fixation Devices
5764,Primary external fixation(without reduction) of proximal femoral fracture,External Fixation Devices
5765,Revision to external fixation(without reduction) of proximal femoral fracture,External Fixation Devices
5766,Primary closed reduction and external fixation of proximal femoral fracture,External Fixation Devices
5767,Revision to closed reduction and external fixation of proximal femoral fracture,External Fixation Devices
5768,Primary functional bracing of fracture,External Fixation Devices
5769,Primary external fixation of fracture,External Fixation Devices
5770,Revision to functional bracing of fracture,External Fixation Devices
5771,Revision to external fixation of fracture,External Fixation Devices
5772,Primary closed reduction of fracture and functional bracing,External Fixation Devices
5773,Primary closed reduction of fracture and external fixation,External Fixation Devices
5774,Revision to closed reduction of fracture and functional bracing,External Fixation Devices
5775,Revision to closed reduction of fracture and external fixation,External Fixation Devices
5776,Other specified closed reduction of fracture of bone and external fixation,External Fixation Devices
5777,Plaster cast traction,Plaster Casts
5778,Application of internal fixator NEC,Internal Fixators
5779,Adjustment to internal fixation device NEC,Internal Fixators
5780,Adjustment to external fixator NEC,External fixation system
5781,"Removal of external fixator device, invasive",External fixation system
5782,Internal fixation of bone NEC,Internal Fixators
5783,External fixation of bone NEC,External fixation system
5784,Other specified internal fixation of bone,Internal Fixators
5785,"Fracture Fixation, Internal",Internal Fixators
5786,Attention to electromagnetic stimulator in bone,Electromagnetic bone stimulator
5787,Primary open reduction of fracture dislocation and external fixation,External Fixation Devices
5788,Primary closed reduction of dislocation and external fixation,External Fixation Devices
5789,Primary closed reduction of fracture dislocation and external fixation,External Fixation Devices
5790,Revision to closed reduction of dislocation and external fixation,External Fixation Devices
5791,Revision to open reduction of dislocation and functional bracing,External Fixation Devices
5792,Revision to closed reduction of fracture dislocation and external fixation,External Fixation Devices
5793,Revision to open reduction of fracture dislocation and external fixation,External Fixation Devices
5794,Immobilization by bandaging,Bandage
5795,Bandaging and sling support,Bandage
5796,Physiological hearing assistance,Auditory appliance
5797,Suture of male perineum,Surgical sutures
5798,Open reduction of rib fracture with external fixation,External Fixation Devices
5799,Reduction of fracture of tibia with internal fixation,Internal Fixators
5800,Hiletron neutron teletherapy,Radioactivity
5801,Microselectron brachytherapy,Ionizing radiation
5802,Gastrostomy feeding,Feeding tube
5803,Adjustment of neurostimulator in peripheral nerve,"Neurostimulator, device (physical object)"
5804,Suction clearance of external auditory canal,Suction catheter
5805,Eustachian tube diathermy,Diathermy device
5806,Inflation of Eustachian tube using balloon,Balloon dilatation catheter
5807,Ultrasonic labyrinthectomy,Thermal ultrasound probe
5808,Examination of ear under microscope,Microscopes
5809,Diagnostic antroscopy via inferior meatus,Endoscopes
5810,Diagnostic antroscopy via middle meatus,Endoscopes
5811,Pharyngeal reconstruction using prosthesis,Prosthesis
5812,Diathermy treatment of pharyngeal pouch,Diathermy device
5813,Diathermy of laryngeal telangiectasis,Diathermy device
5814,Microlaryngoscopy and bronchoscopy,Microscopes
5815,Bronchoscopic destruction of lesion - cryotherapy,Cryoprobe
5816,Bronchoscopic snare resection of lesion,Snare instrument
5817,Oversewing of bulla of lung,Surgical sutures
5818,Percutaneous directional coronary atherectomy,Atherectomy device
5819,Percutaneous low speed rotational coronary atherectomy,Angioplasty catheter
5820,Percutaneous high speed rotational coronary atherectomy,Angioplasty catheter
5821,Transluminal radiofrequency mitral valvotomy,Radiofrequency controlled thermal probe
5822,Transluminal radiofrequency aortic valvotomy,Radiofrequency controlled thermal probe
5823,Transluminal radiofrequency pulmonary valvotomy,Radiofrequency controlled thermal probe
5824,Suturing together of atrioventricular valve bridging leaflets,Surgical sutures
5825,Suture of left atrium,Surgical sutures
5826,Patch enlargement of right ventricular outflow tract,Surgical patch
5827,Closure of ventricular septal defect by direct suture,Surgical sutures
5828,Patch enlargement of conduit,Surgical patch
5829,Diathermy ablation operation for arrhythmia,Diathermy device
5830,Cryoablation operation for arrhythmia,Cryoprobe
5831,Radiofrequency ablation operation for arrhythmia,Radiofrequency controlled thermal probe
5832,Transpulmonary endovascular oversewing of ductus arteriosus,Surgical sutures
5833,Transection and oversewing of pulmonary trunk,Surgical sutures
5834,Clipping of artery,Vascular clip
5835,Simple suture of arteriovenous fistula,Surgical sutures
5836,Vascular cannulation procedure,Cannula device
5837,Temporal artery cannula insertion,Cannula device
5838,Subclavian artery cannula insertion,Cannula device
5839,Axillary artery cannula insertion,Cannula device
5840,Brachial artery cannula insertion,Cannula device
5841,Radial artery cannula insertion,Cannula device
5842,Ulnar artery cannula insertion,Cannula device
5843,Femoral artery cannula insertion,Cannula device
5844,Posterior tibial artery cannula insertion,Cannula device
5845,Dorsalis pedis artery cannula insertion,Cannula device
5846,Umbilical artery cannula insertion,Cannula device
5847,"Cannulation of vascular fistula, graft or prosthetic device",Cannula device
5848,Cannulation of arteriovenous dialysis fistula,Cannula device
5849,Cannulation of arteriovenous interposition graft,Cannula device
5850,Cannulation of arterial graft,Vascular cannula
5851,Cannulation of subcutaneous reservoir,Cannula device
5852,Vascular cannula unblockage,Cannula device
5853,Vascular cannula replacement,Cannula device
5854,Vascular cannula removal,Cannula device
5855,Removal of Hickman line,Cannula device
5856,Single period of cardiopulmonary bypass,Heart-Lung Machine
5857,Multiple periods of cardiopulmonary bypass,Heart-Lung Machine
5858,Fine needle aspiration of lymph node,Fine needle
5859,Fine needle aspiration of supraclavicular lymph node,Fine needle
5860,Fine needle aspiration of cervical lymph node,Fine needle
5861,Fine needle aspiration of axillary lymph node,Fine needle
5862,Fine needle aspiration of mediastinal lymph node,Fine needle
5863,Fine needle aspiration of abdominal lymph node,Fine needle
5864,Fine needle aspiration of pelvic lymph node,Fine needle
5865,Fine needle aspiration of inguinal lymph node,Fine needle
5866,Fine needle aspiration of deep inguinal lymph node,Fine needle
5867,Fine needle aspiration of popliteal lymph node,Fine needle
5868,Fine needle aspiration of epitrochlear lymph node,Fine needle
5869,Diathermy to cystic hygroma,Diathermy device
5870,Fine needle aspiration of lesion of spleen,Fine needle
5871,Suture of spleen,Surgical sutures
5872,Bone marrow trephine,Trephine
5873,Sternal trephine,Trephine
5874,Iliac crest trephine,Trephine
5875,Dental scaling and polishing,Dental scaler
5876,"Scaling, Supragingival",Dental scaler
5877,"Scaling, Subgingival",Dental scaler
5878,Cementation of temporary bridge to tooth,Temporary dental bridge
5879,Suture tooth socket,Surgical sutures
5880,Suture of floor of mouth,Surgical sutures
5881,Suture of cheek,Surgical sutures
5882,Creation of cervical tube esophagostomy,Feeding tube
5883,Heater probe treatment of esophageal lesion,Thermal probe
5884,Snare resection of esophageal lesion,Snare instrument
5885,Esophageal self-bougienage,Bougie
5886,Creation of tube gastrostomy,Feeding tube
5887,Balloon dilatation of pyloric stricture,Balloon dilatation catheter
5888,Heater probe treatment of gastric lesion,Thermal probe
5889,Stomach Stapling,"Staple, Surgical"
5890,Closure of perforated duodenum using omental patch,Surgical patch
5891,Balloon dilatation of duodenal stricture,Balloon dilatation catheter
5892,Snare resection of duodenum,Snare instrument
5893,Heater probe treatment of duodenal lesion,Thermal probe
5894,Destruction of lesion of small intestine using thermal probe,Thermal probe
5895,Cryotherapy of lesion - small intestine,Cryoprobe
5896,Oversewing of distal bowel,Surgical sutures
5897,Oversewing of rectal stump,Surgical sutures
5898,Destruction of lesion of large intestine using thermal probe,Thermal probe
5899,Cryotherapy of lesion - large intestine,Cryoprobe
5900,Closure of perforated large intestine,Surgical sutures
5901,Irrigation of colon via cecostomy tube,biomedical tube device
5902,Non-endoscopic biopsy of gastrointestinal tract,Gastrointestinal biopsy device
5903,Biopsy using Nabeya capsule,Gastrointestinal biopsy device
5904,Biopsy using Nabeya capsule,Nabeya capsule
5905,Biopsy using mesh-covered balloon,Gastrointestinal biopsy device
5906,Biopsy using mesh-covered balloon,Mesh-covered balloon
5907,Biopsy using Quinton tube,Gastrointestinal biopsy device
5908,Biopsy using Quinton tube,Quinton tube
5909,Biopsy using Rubin tube,Gastrointestinal biopsy device
5910,Biopsy using Rubin tube,Rubin tube
5911,Biopsy using Watson capsule,Gastrointestinal biopsy device
5912,Biopsy using Watson capsule,Watson capsule
5913,Suturing of pancreatic duct,Surgical sutures
5914,Fine needle aspiration of pancreas and peripancreatic tissue,Fine needle
5915,Fine needle aspiration of peripancreatic tissue,Fine needle
5916,Stapling of pancreas,"Staple, Surgical"
5917,Fine needle aspiration of gallbladder,Fine needle
5918,Suturing of choledochotomy,Surgical sutures
5919,Suturing of bile duct,Surgical sutures
5920,Suture of hepatic duct,Surgical sutures
5921,Fine needle aspiration of bile duct,Fine needle
5922,Pushpull operation for ureteric calculus,Cystoscopes
5923,Nephroscopic ultrasound fragmentation of ureteric calculus,Ultrasonic lithotripter probe
5924,Ureteroscopic fragmentation of ureteric calculus,Ultrasonic lithotripter probe
5925,Ureteroscopic ultrasound fragmentation of ureteric calculus,Ultrasonic lithotripter probe
5926,Cystoscopic operation on the ureter,Cystoscopes
5927,Cystoscopic lithotripsy of ureteric calculus,Cystoscopes
5928,Cystoscopic upward disimpaction of ureteric calculus,Cystoscopes
5929,Cystoscopic upward disimpaction of ureteric calculus,Ureteral Catheters
5930,Push-bang operation for ureteric calculus,Cystoscopes
5931,Push-bang operation for ureteric calculus,Shock wave lithotripter
5932,Push-bang operation for ureteric calculus,Ureteral Catheters
5933,Cystoscopic ureteric intubation procedure,Cystoscopes
5934,Cystoscopy and bulb catheter ureteropyelography,Cystoscopes
5935,Surgical closure of bladder neck,Surgical sutures
5936,Needle biopsy of prostate,Biopsy needle
5937,Dilatation of urethra using filiform and follow-on soft bougies,Filiform bougie
5938,Cryotherapy of vulval wart,Cryoprobe
5939,Diathermy of lesion of vulva,Diathermy device
5940,Diathermy of lesion of female perineum,Diathermy device
5941,Diathermy cauterization of lesion of vagina,Diathermy device
5942,Diathermy of cervix,Diathermy device
5943,Cryotherapy endometrial ablation,Cryoprobe
5944,Radiofrequency endometrial ablation,Radiofrequency controlled thermal probe
5945,Macdonald's cervical cerclage,Surgical sutures
5946,Shirodkar's cervical cerclage,Surgical sutures
5947,Laser ablation of anastomosing vessels in placenta,Laser-generated electromagnetic radiation
5948,Nonrotational forceps delivery,Obstetrical Forceps
5949,Outlet forceps delivery,Obstetrical Forceps
5950,"Forceps delivery, face to pubes",Obstetrical Forceps
5951,Forceps application to aftercoming head,Obstetrical Forceps
5952,Pajot's maneuver,Obstetrical Forceps
5953,Repair of right mediolateral episiotomy,Surgical sutures
5954,Repair of vaginal tear,Surgical sutures
5955,Repair of vaginal vault tear,Surgical sutures
5956,Repair of uterine scar dehiscence,Surgical sutures
5957,Pre-biopsy localization of breast lesion using self retaining wire,Self-retaining wire
5958,Percutaneous fine needle aspiration of mastectomy scar,Fine needle
5959,Primary suturing of breast,Surgical sutures
5960,Delayed suturing of breast,Surgical sutures
5961,Radiofrequency destruction of pituitary gland,Radiofrequency controlled thermal probe
5962,Inguinal herniorrhaphy using synthetic patch,Prosthetic patch
5963,Repair of femoral hernia using surgical sutures,Surgical sutures
5964,Femoral herniorrhaphy using synthetic patch,Prosthetic patch
5965,Repair of incisional hernia using sutures,Surgical sutures
5966,Keel repair of incisional hernia,Surgical sutures
5967,Repair of incisional hernia using synthetic patch,Prosthetic patch
5968,Application of abdominal corset,Surgical corset
5969,Resuture of skin dehiscence abdominal incision,Surgical sutures
5970,Resuture of deep dehiscence abdominal incision,Surgical sutures
5971,Needle biopsy of lesion of abdominal wall,Biopsy needle
5972,Needle aspiration of lesion of abdominal wall,Needle device
5973,Needle aspiration of lesion of umbilicus,Needle device
5974,Probing of lesion of umbilicus,Probes
5975,Umbilical cord clamping,Clamp (device)
5976,Umbilical cord clamp replacement,Umbilical cord clamp
5977,Under running of peritoneal cavity bleeding vessel,Surgical sutures
5978,Fine needle aspiration of mass in the neck,Fine needle
5979,Fixation of fracture using pins,Medical pins
5980,Primary open reduction of fracture of neck of femur and open fixation using Deyerle multiple hip pinning,Internal Fixators
5981,Fixation of fracture using wire,Internal Fixators
5982,Fixation of fracture using screws,Internal Fixators
5983,Primary open reduction of fracture of neck of femur and open fixation using Charnley compression screw,Internal Fixators
5984,Primary open reduction of fracture of neck of femur and open fixation using dynamic hip screw,Internal Fixators
5985,Primary open reduction of fracture of neck of femur and open fixation using Richards screw,Internal Fixators
5986,Fixation of fracture using cannulated screws,Internal Fixators
5987,Closed reduction and internal fixation of proximal femoral fracture with Richard's cannulated hip screw,Internal Fixators
5988,Fixation of fracture using plate,Internal Fixators
5989,Closed reduction of intracapsular fracture of neck of femur and fixation using Smith-Petersen nail,Internal Fixators
5990,Primary open reduction of fracture of neck of femur and open fixation using Holt nail,Internal Fixators
5991,Primary open reduction of fracture of neck of femur and open fixation using Ross Brown nail,Internal Fixators
5992,"Fracture Fixation, Internal",Internal Fixators
5993,External skeletal fixation procedure,External Fixation Devices
5994,Electromagnetic bone stimulator procedures,Electromagnetic bone stimulator
5995,Application of external electromagnetic bone stimulator,Electromagnetic bone stimulator
5996,Adjustment of electromagnetic bone stimulator,Electromagnetic bone stimulator
5997,Removal of external electromagnetic bone stimulator,Electromagnetic bone stimulator
5998,Removal of internal electromagnetic bone stimulator,Electromagnetic bone stimulator
5999,Operation involving external fixators,External fixation system
6000,Insertion of additional external fixator pin,External fixation system
6001,Application of additional component to external fixator frame,External fixation system
6002,Dynamization of external fixator by addition of articulating device,External fixation system
6003,Adjustment to alignment of external fixator,External fixation system
6004,Adjustment to length of external fixator,External fixation system
6005,Dynamization of external fixator,External fixation system
6006,Dynamization of external fixator by release of constraining device,External fixation system
6007,Repositioning of external fixator pin,External fixation system
6008,Removal of external fixator pin,External fixation system
6009,Removal of component of external fixator frame,External fixation system
6010,Adjustment to attachment point of traction system,External fixation system
6011,Radiofrequency cardiac valvotomy,Radiofrequency controlled thermal probe
6012,Drainage of subungual hematoma with hot wire,Hot wire
6013,Pancreatic venous sampling,Needle device
6014,Renal venous sampling,Needle device
6015,Renal transplant venous sampling,Needle device
6016,Diaphanography of breast,Transilluminator
6017,Probing of lacrimal punctum with irrigation,Probes
6018,Venous sampling catheter procedure,Needle device
6019,Petrosal Sinus Sampling,Needle device
6020,Bilateral simultaneous inferior petrosal sinus sampling,Vascular Catheters
6021,Bilateral simultaneous inferior petrosal sinus sampling,Needle device
6022,Jugular vein sampling catheter procedure,Needle device
6023,Portal venous sampling catheter,Needle device
6024,Hepatic vein sampling catheter procedure,Needle device
6025,Adrenal vein sampling catheter procedure,Needle device
6026,Gonadal vein sampling catheter procedure,Vascular Catheters
6027,Gonadal vein sampling catheter procedure,Needle device
6028,Parathyroid sampling catheter procedure,Needle device
6029,Red blood cell maturation age determination procedure,Microscopes
6030,First glass clear,Microscopes
6031,First glass contains specks or sediments,Microscopes
6032,First glass contains mucous,Microscopes
6033,First glass contains threads or strands,Microscopes
6034,Second glass clear result,Microscopes
6035,Second glass contains specks or sediments procedure,Microscopes
6036,Second glass contains mucous procedure,Microscopes
6037,Second glass contains threads or strands procedure,Microscopes
6038,Cerebrospinal fluid microscopy,Microscopes
6039,Stool microscopy,Microscopes
6040,Breast fluid microscopy,Microscopes
6041,Electron microscopy of feces,Microscopes
6042,Electron microscopy of vesicle fluid,Microscopes
6043,24 Hour ECG,Holter Monitors
6044,Oral diagnostic probing,Probes
6045,Parotid duct probing,Probes
6046,Submandibular duct probing,Probes
6047,Oral inflammatory sinus tract probing,Probes
6048,Point pH monitoring,electrode
6049,Period pH monitoring,electrode
6050,Two glass urine test - first glass,Microscopes
6051,Two glass urine test - second glass,Microscopes
6052,Applanation tonometry,Applanation tonometer
6053,Pneumatic tonometry,Pneumatic tonometer
6054,Digital tonometry,Applanation tonometer
6055,Lacrimal syringing,Syringes
6056,Lacrimal syringing - lower punctum,Syringes
6057,Corneal specular microscopy,Microscopes
6058,Extended tonometry,Tonometer
6059,Extended tonometry - office hours,Tonometer
6060,Extended tonometry - 24 hours,Tonometer
6061,Scanning laser ophthalmoscopy,Scanning laser ophthalmoscope
6062,Ultrasonic endarterectomy,Atherectomy device
6063,Mechanical endarterectomy,Atherectomy device
6064,Radiofrequency endarterectomy,Atherectomy device
6065,Directional atherectomy,Atherectomy device
6066,Low speed rotational atherectomy,Atherectomy device
6067,High speed rotational atherectomy,Atherectomy device
6068,Internal fixation using Kirschner wire,Internal Fixators
6069,Internal fixation using tension band,Internal Fixators
6070,Internal fixation using staple,Internal Fixators
6071,Internal fixation using screw,Internal Fixators
6072,Internal fixation using plate,Internal Fixators
6073,Internal fixation using intramedullary nail,Internal Fixators
6074,"Fracture Fixation, Internal",Internal Fixators
6075,External skeletal fixation procedure,External Fixation Devices
6076,External fixation using unilateral bar,External Fixation Devices
6077,External fixation using static unilateral bar,External Fixation Devices
6078,External fixation using dynamic unilateral bar,External Fixation Devices
6079,External fixation using bilateral bars,External Fixation Devices
6080,External fixation using bilateral bars with cross-linkage,External Fixation Devices
6081,External fixation using circumferential rings,External Fixation Devices
6082,Realignment and suture of posterior urethra,Surgical sutures
6083,Single Kirschner wiring of fracture,Internal Fixators
6084,Multiple Kirschner wiring of fracture,Internal Fixators
6085,Cerclage wiring of fracture,Surgical sutures
6086,Cerclage wiring of fracture,Bone Wires
6087,Tension band wiring of fracture,Internal Fixators
6088,Cardiovascular stress test using bicycle ergometer,Bicycle ergometer
6089,Banding of descending vein,Surgical band
6090,Circumferential suture of tendon,Surgical sutures
6091,Repair of incisional hernia using anterior sheath overlap,Surgical sutures
6092,Suturing of tendon using Bunnell suture technique,Surgical sutures
6093,Reattachment of rotator cuff to humeral prosthetic component,Surgical sutures
6094,Simple suture of tendon,Surgical sutures
6095,Electrical peripheral nerve stimulation,"Neurostimulator, device (physical object)"
6096,Magnetic stimulation of peripheral nerves,"Neurostimulator, device (physical object)"
6097,Tetanic burst stimulation,"Neurostimulator, device (physical object)"
6098,Transcranial magnetic stimulation,"Neurostimulator, device (physical object)"
6099,Primary repair of femoral hernia using sutures,Surgical sutures
6100,Suture of anterior abdominal wall,Surgical sutures
6101,Posterior pharyngeal implant pharyngoplasty,Prosthesis
6102,Primary open reduction and internal fixation of proximal femoral fracture with screw/nail and plate device,Internal Fixators
6103,Primary open reduction of fracture of long bone and fixation using flexible nail,Internal Fixators
6104,Primary open reduction of fragment of bone and fixation using screw,Internal Fixators
6105,Primary open reduction of fragment of bone and fixation using wire system,Internal Fixators
6106,Primary open reduction of fracture of elbow and fixation with Hook fixation plate,Internal Fixators
6107,Closed reduction and internal fixation of proximal femoral fracture with screw/nail device alone,Internal Fixators
6108,Maintenance of electromagnetic bone stimulator,Electromagnetic bone stimulator
6109,Creation of tube esophagostomy,Feeding tube
6110,Attention to central venous catheter,Cannula device
6111,Cystoscopic extraction of ureteric calculus,Cystoscopes
6112,Rigid cystoscopy and cystodiathermy,Diathermy device
6113,Flexible cystoscopy and cystodiathermy,Diathermy device
6114,Transurethral cryotherapy of prostate,Cryoprobe
6115,Needle aspiration of prostate,Fine needle
6116,Transperineal needle biopsy of prostate,Biopsy needle
6117,Suture of vagina,Surgical sutures
6118,Cervical Cerclage,Surgical sutures
6119,Midforceps delivery without rotation,Obstetrical Forceps
6120,Suture of skin of head or neck,Surgical sutures
6121,Suture/repair of spleen,Surgical sutures
6122,Continuous ECG monitoring,Holter Monitors
6123,Catheter suction calculus removal,Suction catheter
6124,Lacrimal passage probing,Probes
6125,Joint probing,Probes
6126,Sinus probing,Probes
6127,12 lead ECG,Holter Monitors
6128,Vaginal smear biopsy,Smear sampling device
6129,Temporary implant radiotherapy,Ionizing radiation
6130,Neurostimulation of brain tissue,"Neurostimulator, device (physical object)"
6131,Closed reduction of fracture of femur with internal fixation,Internal Fixators
6132,Electrocoagulation of brain,Diathermy device
6133,Aneurysm clipping,Vascular clip
6134,Electrocoagulation,Diathermy device
6135,Closed reduction of fracture of tarsals and metatarsals with internal fixation,Internal Fixators
6136,Percutaneous needle biopsy,Biopsy needle
6137,Crosbie duodenal biopsy,Crosby capsule
6138,Intramedullary Nailing,Internal Fixators
6139,Umbilical vessel catheterization,Cannula device
6140,Examination of optic disc,Ophthalmoscopes
6141,Cryocautery to internal nose,Cryoprobe
6142,Fixation of bone fragment using Kirschner wire,Internal Fixators
6143,Adjustment to Kirschner wire,External fixation system
6144,Franzen needle aspiration of prostate,Franzen needle
6145,Closed reduction of fracture of tarsals and metatarsals with internal fixation,Internal Fixators
6146,External electrode cardioversion,electrode
6147,S+P - Syringe and probe nasolacrimal duct,Syringes
6148,S+P - Syringe and probe nasolacrimal duct,Probes
6149,Needle biopsy of kidney,Biopsy needle
6150,Bankart anterior stabilization of shoulder joint,Surgical sutures
6151,Needle biopsy of spleen,Biopsy needle
6152,Neville-Barnes forceps delivery,Neville Barnes forceps
6153,Simpson's forceps delivery,Simpson forceps
6154,Menghini needle biopsy of liver,Menghini needle
6155,Clipping of vein,Vascular clip
6156,Tru-cut biopsy of lesion of abdominal wall,Tru-cut needle
