,CUI1,CUI2
1639,Other specified therapeutic nephroscopic operation on ureter,Endoscopes
1640,Cystoscopy and transurethral resection of bladder lesion,Endoscopes
1641,Rigid therapeutic bronchoscopy,Endoscopes
1642,Iodine seed radiotherapy,Radiation
1643,Threshold automated static perimetry,Automated static perimeter
1644,Cryocuff treatment,Cryoprobe
1645,Suture ruptured corpus luteum,Surgical sutures
1646,Radiotherapy for immunosuppression,Ionizing radiation
1647,Guillotine tonsillectomy and adenoidectomy,Guillotine
1648,Panretinal photocoagulation for glaucoma,Light Coagulation
1649,Deuterium on tritium neutron teletherapy,"Radiation, Nonionizing"
1650,Endocryotherapy to retina,Cold Sensation
1651,Local cooling therapy,Cold Sensation
1652,Radionuclide therapy for glandular suppression,Radiation
1653,MRI of brain with T2 mapping,Magnetic resonance imaging unit
1654,MRI of brain with functional imaging,Magnetic resonance imaging unit
1655,Suture of corpus cavernosum,Surgical sutures
1656,Transillumination of maxillary sinus,Transilluminator
1657,Interstitial Radiation Therapy,Ionizing radiation
1658,Tension band wiring of fracture,Stainless steel wire suture
1659,Aneurysmectomy with graft replacement of abdominal aorta,Surgical sutures
1660,Destruction of lesion of choroid by xenon arc photocoagulation,Light
1661,Short wave diathermy to trunk,Diathermy device
1662,Primary open reduction of fracture and internal fixation with plate,Internal Fixators
1663,Microwave therapy to back,Diathermy device
1664,Diathermy incision - action,Unipolar diathermy
1665,Repair of retina for retinal tear or defect by xenon arc photocoagulation,Light
1666,Suture of tongue,Surgical sutures
1667,Bathing patient with alcohol sponge,Alcohol sponge
1668,Intracavitary radium application,Gamma Rays
1669,"Prescribing contact lens for aphakia, bilateral",Eyeglasses
1670,Home apnea monitor education,"Apnea alarm, device"
1671,Repair of omentum,Surgical sutures
1672,Fine needle biopsy of penis,Fine biopsy needle
1673,Suture of fascia to skeletal attachment of hand,Surgical sutures
1674,Suture of pelvic periosteum,Surgical sutures
1675,Cardiac electrophysiologic stimulation and recording study,Holter Monitors
1676,Suture of tonsillar fossa,Surgical sutures
1677,MRI of chest and myocardium,Magnetic resonance imaging unit
1678,Disposable enema procedure,Enema tube
1679,Endoscopic brush biopsy of small intestine,Brush device
1680,Bougienage - action,Bougie
1681,Fast-electron therapy,Electrons
1682,Revision to functional bracing of fracture,External Fixation Devices
1683,Evacuation of uterus,Curette
1684,Catheter suction clot removal,Suction catheter
1685,Primary suturing,Surgical sutures
1686,Percutaneous transluminal angioplasty of aorta NEC,Angioplasty catheter
1687,Revision to open reduction of fracture and other internal fixation,Internal Fixators
1688,Primary hybrid total replacement of hip joint NEC,Hip Joint Implantable Prostheses (device)
1689,Ureteroscopic pyelolysis,Endoscopes
1690,Peripheral venous cannula insertion - antecubital fossa,catheter device
1691,Central venous cannula insertion,Vascular cannula
1692,Central venous cannula insertion via subclavian vein,Vascular cannula
1693,Attention to bladder drainage,catheter device
1694,Functional endoscopic sinus surgery - therapeutic antroscopy via middle meatus,Endoscopes
1695,Cystourethroscopy with biopsy of ureter (procedure),Endoscopes
1696,Portal venous system cannula insertion,Vascular cannula
1697,Diagnostic arthroscopy of wrist joint,Endoscopes
1698,Cannulation of arteriovenous interposition graft,Vascular cannula
1699,Duodenoscopy through artificial stoma,Endoscopes
1700,Complicated catheterization of bladder,catheter device
1701,Laparoscopy with removal of adnexal structures,Endoscopes
1702,Introduction of catheter into artery of extremity,catheter device
1703,"Removal of cerebral ventricular reservoir, Ommaya or Rickham",catheter device
1704,"Selective introduction of catheter into aorta, initial placement",catheter device
1705,Diagnostic endoscopic examination of sigmoid colon using rigid sigmoidoscope,Endoscopes
1706,Functional endoscopic sinus surgery - therapeutic endoscopy of nose or sinus NOS,Endoscopes
1707,Gastroscopy through artificial stoma,Endoscopes
1708,Other therapeutic endoscopic operation on lower bowel using fibreoptic sigmoidoscope NOS,Endoscopes
1709,Other therapeutic endoscopic operations on ureter,Endoscopes
1710,Thermocoagulation of Gasserian ganglion,Electricity
1711,Endoscopy of retroperitoneum,Endoscopes
1712,Diathermy loop cone biopsy of cervix,Loop diathermy device
1713,Cyclotron neutron teletherapy,Neutrons
1714,Chronic peritoneal dialysis,Peritoneal dialysis solution (product)
1715,Balloon dilatation of right ventricular outflow tract,Balloon dilatation catheter
1716,Ultrasound destruction of ciliary body,Thermal ultrasound probe
1717,Cryotherapy to retina,Cold Sensation
1718,Primary open reduction of fracture and locked reamed intramedullary nail fixation,Internal Fixators
1719,Ureteroscopic fragmentation of ureteric calculus,Ultrasonic lithotripter probe
1720,Provision of electronic low vision aid,Eyeglasses
1721,Non-prepucial skin flap reconstruction of urethra,Bladder mucosa
1722,Midforceps delivery without rotation,Obstetrical Forceps
1723,Single Kirschner wiring of fracture,Bone Wires
1724,Tru-cut biopsy of prostate,Core biopsy needle
1725,Primary laser excision of lumbar intervertebral disc,Laser-generated electromagnetic radiation
1726,Low power laser therapy to knee,Laser-generated electromagnetic radiation
1727,Preoperative course of deep X-ray therapy,"Radiation, Nonionizing"
1728,Cryotherapy of genital warts,Cryoprobe
1729,Cystoscopy and cystodiathermy,Diathermy device
1730,Special dosimetry,Devices
1731,Cardiac pacing,Artificial cardiac pacemaker
1732,Repair of aneurysm by electrocoagulation,Electricity
1733,Repair of retina for retinal tear or defect by cryotherapy,Cold Sensation
1734,Continuous electrocardiogram,Holter Monitors
1735,Osteotomy of mandible by Gigli saw,Gigli's wire saw
1736,Application of Kirschner wire,Bone Wires
1737,Core needle biopsy of breast,Core biopsy needle
1738,Laparoscopy with excision of lesion,Laparoscopes
1739,Core needle biopsy of uterus,Core biopsy needle
1740,Atriocommissuropexy of mitral valve,Surgical sutures
1741,Cardiac electrophysiologic stimulation and recording study,Stimulator
1742,Aneurysmectomy with anastomosis of abdominal artery,Surgical sutures
1743,Trephine sclerectomy,Trephine
1744,"Special dosimetry, TLD",Devices
1745,Construction of median tarsorrhaphy,Surgical sutures
1746,Suture of cornea,Surgical sutures
1747,Thrombectomy with catheter of iliac vein by abdominal and leg incision,catheter device
1748,Barton forceps cephalic delivery with rotation,Obstetrical Forceps
1749,External beam with internal radiotherapy,Devices
1750,External beam - surgery with postoperative radiotherapy,Devices
1751,Laser excision - action,Laser-generated electromagnetic radiation
1752,Epistaxis control by cryosurgery,Cryoprobe
1753,Other specified endoscopic bilateral occlusion of fallopian tubes,Laparoscopes
1754,Primary open reduction of fracture of ankle and extramedullary fixation NEC,Internal Fixators
1755,External radiotherapy NOS,Radiation
1756,Angioscopy of intracranial vein,Endoscopes
1757,Percutaneous replacement of ureteric stent,Endoscopes
1758,Bronchoscopy with transbronchial lung biopsy,Endoscopes
1759,Portal vein cannula insertion,Vascular cannula
1760,Fiberoptic esophagoscopy and cauterization,Endoscopes
1761,Cystoscopic operation for ureteric calculus,Endoscopes
1762,Rigid cystoscopy and transurethral resection of bladder lesion,Endoscopes
1763,Arthroscopy of wrist with internal fixation for fracture,Endoscopes
1764,Endoscopy of lung,Endoscopes
1765,Dilation of nasolacrimal duct with insertion of tube or stent,catheter device
1766,Catheterization of renal vein,Vascular cannula
1767,Arthroscopically aided anterior cruciate ligament repair,Endoscopes
1768,Endoscopic brush biopsy of jejunum,Endoscopes
1769,Direct laryngoscopy with arytenoidectomy with operating microscope,Endoscopes
1770,Therapeutic fiberoptic endoscopic operations on trachea,Endoscopes
1771,Endoscopic catheterization of pancreatic duct system,catheter device
1772,Open insertion of Hickman central venous catheter,catheter device
1773,Therapeutic endoscopic operations on duodenum,Endoscopes
1774,Extracranial ventricular shunt replaced,catheter device
1775,Diagnostic endoscopic examination of trachea using rigid bronchoscope,Endoscopes
1776,Diathermy procedure by intent of surgical action,Diathermy device
1777,Loop diathermy of cervix,Electricity
1778,Radiotherapy for inflammation,Ionizing radiation
1779,Cryotherapy to lesion of palate,Cryoprobe
1780,Cryotherapy to lesion of eyelid,Cryoprobe
1781,Manipulative removal of calculus from parotid duct,Manual method
1782,Destructive procedure on skin using laser surgery,Laser-generated electromagnetic radiation
1783,Balloon dilatation of implanted tricuspid valve,Medical Balloon Device
1784,Deuterium on tritium neutron teletherapy,Neutrons
1785,Cryodenervation of spinal facet joint of lumbar vertebra,Cryoprobe
1786,Calculation of radiotherapy isodose distribution,Devices
1787,Calculation of brachytherapy,Devices
1788,Dry Needling,Acupuncture needle
1789,Thermal stimulation of acupuncture needle,Acupuncture needle
1790,Endocryotherapy to retina,Cryoprobe
1791,Nasal tube feeding,Feeding tube
1792,Provision of integral spectacle distance telescope,Eyeglasses
1793,Provision of non-optical low vision aid,Eyeglasses
1794,Oversewing of distal bowel,Surgical sutures
1795,"Resuture of heart valve prosthesis, poppet",Surgical sutures
1796,Percutaneous balloon angioplasty of superior vena cava,Angioplasty catheter
1797,Secondary suture of skin,Surgical sutures
1798,Rhinoplasty augmentation with synthetic implant,Artificial Implants
1799,Short wave diathermy to abdomen,Diathermy device
1800,Endoscopic brush biopsy of rectum,Brush device
1801,Krypton laser photocoagulation,Laser-generated electromagnetic radiation
1802,"Dental Implantation, Subperiosteal","Implantable dental prosthesis, device"
1803,Intracavitary radium application,Radioactivity
1804,Use of tilt table,Table - furniture
1805,Percutaneous fine needle biopsy of pleura,Fine biopsy needle
1806,Suture of mesentery (procedure),Surgical sutures
1807,Pericardiorrhaphy,Surgical sutures
1808,"Application of ice collar, cap or bag",Ice
1809,Aneurysmectomy with graft replacement by interposition,Surgical sutures
1810,Flexible fiberoptic laryngoscopy with removal of lesion (procedure),Fiberoptic laryngoscope
1811,Suture of bursa (procedure),Surgical sutures
1812,Subtrochanteric osteotomy with internal fixation and cast,Internal Fixators
1813,Cryotherapy of skin (procedure),Cold Sensation
1814,Fixation of tongue with mechanical K wire,Bone Wires
1815,Short wave diathermy,Diathermy device
1816,Application of prosthesis for missing ear,Auricular prosthesis
1817,Betatron electron therapy,Electrons
1818,Supportive pharmacotherapy,Devices
1819,Remanipulation of fracture of bone and external fixation however further qualified,External Fixation Devices
1820,Primary external fixation(without reduction) of proximal femoral fracture,External Fixation Devices
1821,Maintenance of drainage tube of kidney,biomedical tube device
1822,Laser retinal adhesion formation,Laser-generated electromagnetic radiation
1823,Other therapeutic endoscopic operation on lower bowel using fibreoptic sigmoidoscope NOS,Fiberoptic cable
1824,Percutaneous transluminal angioplasty of superior mesenteric artery NEC,Angioplasty catheter
1825,Teleradiotherapy particulate radiation,Radiation
1826,External cardioversion NEC,electrode
1827,Endoscopy of urethra,Endoscopes
1828,Diagnostic endoscopic examination of trachea and biopsy of trachea using rigid bronchoscope,Endoscopes
1829,Diagnostic bronchoscopy via tracheostomy,Endoscopes
1830,Diagnostic endoscopic examination of sigmoid colon and biopsy of lesion of sigmoid colon using rigid sigmoidoscope,Endoscopes
1831,Bronchoscopic snare resection of lesion,Endoscopes
1832,Endoscopic procedure on vulva,Endoscopes
1833,Laparoscopic treatment of ectopic pregnancy with salpingectomy,Endoscopes
1834,Arthroscopy of elbow with complete synovectomy,Endoscopes
1835,Arterial cannula procedure,Vascular cannula
1836,Laparoscopic appendectomy,Endoscopes
1837,Swan-Ganz Catheterization,catheter device
1838,Removal of urethral catheter,catheter device
1839,Amsler chart assessment,Perimeter measuring device
1840,Other therapeutic fibreoptic endoscopic operation on oesophagus NOS,Endoscopes
1841,Other therapeutic endoscopic operation on ureter OS,Endoscopes
1842,Fiberoptic endoscopic destruction of lesion below trachea,Endoscopes
1843,Other specified diagnostic endoscopic examination of peritoneum,Endoscopes
1844,Open cannulation of vein,catheter device
1845,Endoscopic bilateral ringing of fallopian tubes,Laparoscopes
1846,Percutaneous angioplasty of brachial artery,Angioplasty catheter
1847,Purpose of radiotherapy,Radiation
1848,Percutaneous balloon angioplasty of celiac artery,Angioplasty catheter
1849,Balloon atrioventricular valvotomy,Balloon dilatation catheter
1850,Insertion of corneal tension suture,Surgical sutures
1851,Revision cemented total knee replacement,Bone Cements
1852,Cryotherapy of vulval wart,Cryoprobe
1853,Terminalizing reconstruction of urethra using graft other than skin,Bladder mucosa
1854,MRI of aorta,Magnetic resonance imaging unit
1855,Endoscopic transurethral microwave thermotherapy to prostate,Microwave probe
1856,Prosthetic hybrid total replacement of hip joint,Hip Joint Implantable Prostheses (device)
1857,Isodose computation for brachytherapy,Ionizing radiation
1858,Fine needle biopsy of rectum,Fine biopsy needle
1859,Patch closure of endocardial cushion defect with repair of mitral cleft,Tissue Grafts
1860,Intracranial aneurysmectomy with anastomosis,Surgical sutures
1861,Thermocoagulation of Gasserian ganglion,Radiofrequency controlled thermal probe
1862,Suture of lip,Surgical sutures
1863,Destruction of hemorrhoids by cryotherapy,Cold Sensation
1864,Fulguration of stomach lesion,Electricity
1865,Percutaneous core needle biopsy of lung,Core biopsy needle
1866,Suture of wound of teat,Surgical sutures
1867,Uterine implantation of radium,Radioactivity
1868,Initial implantation of electrode into cardiac atrium,electrode
1869,Open reduction of fracture of arm with internal fixation,Internal Fixators
1870,Aneurysmectomy with graft replacement of head and neck artery,Surgical sutures
1871,Reattachment of choroid and retina by xenon arc photocoagulation,Light
1872,Suture of ovary,Surgical sutures
1873,Tube feeding by Barron pump,Feeding tube
1874,Fulguration of retina,Electricity
1875,Primary external fixation of fracture,External Fixation Devices
1876,Extracorporeal shockwave lithotripsy of unspecified ureteric calculus,Shock wave lithotripter
1877,High-energy beam therapy,Radioactivity
1878,Rigid bronchoscopic lavage of trachea,Endoscopes
1879,Diagnostic tracheoscopy via tracheostomy,Endoscopes
1880,Change of urethral catheter,catheter device
1881,Examination of tympanic membrane,Endoscopes
1882,Fiberoptic colonoscopy through colostomy,Endoscopes
1883,Diagnostic ureterorenoscopy,Endoscopes
1884,Arthroscopic trimming of meniscus,Endoscopes
1885,"Functional endoscopic sinus surgery, limited",Endoscopes
1886,Percutaneous insertion of intra-aortic balloon catheter,Vascular cannula
1887,Removal of ventriculopleural shunt,catheter device
1888,Cystourethroscopy with internal male urethrotomy (procedure),Endoscopes
1889,Diagnostic rigid esophagoscopy,Endoscopes
1890,Endoscopic insertion of permanent colonic stent,Endoscopes
1891,Endoscopic pleurodesis NEC,Endoscopes
1892,High-pass resolution perimetry,Perimeter measuring device
1893,Destruction of chorioretinal lesion by diathermy,Diathermy device
1894,Resection of gastric ulcer by cautery,Diathermy device
1895,Cystoscopic catheter drainage for ureteric calculus,Urinary catheter
1896,Cryotherapy to intercostal nerve,Cryoprobe
1897,Percutaneous balloon angioplasty of abdominal aorta,Angioplasty catheter
1898,"Scaling, Supragingival",Dental scaler
1899,Fine needle aspiration of epitrochlear lymph node,Fine biopsy needle
1900,Laser iridectomy,Laser-generated electromagnetic radiation
1901,Endometrial biopsy by suction,Curette
1902,Magnetic resonance imaging of abdomen,Magnetic resonance imaging unit
1903,MRI of upper arm,Magnetic resonance imaging unit
1904,Magnetic Resonance Imaging (MRI) of Ankle,Magnetic resonance imaging unit
1905,Optical low vision aid provision,Eyeglasses
1906,Petrosal Sinus Sampling,Vascular Catheters
1907,Total prosthetic replacement of knee joint using cement,Bone Cements
1908,Laparoscopic interval appendectomy,Laparoscopes
1909,Short wave diathermy to face,Diathermy device
1910,Cryotherapy of basal cell carcinoma,Cryoprobe
1911,Preoperative course of deep X-ray therapy,Devices
1912,Total skin electron beam therapy,Electrons
1913,Staging laparoscopy,Laparoscopes
1914,Thrombectomy with catheter of subclavian artery by neck incision,catheter device
1915,"Masters' stress test, two-step",Holter Monitors
1916,Pump extraction of milk from lactating breast,pump (device)
1917,Chiropractic application of ice,Cold Sensation
1918,Tracing of carotid pulse with ECG lead,Holter Monitors
1919,Suture of intestine,Surgical sutures
1920,Plombage of lung,Inert matter
1921,Intra-articular radionuclide therapy,Radiation
1922,Aspiration curettage of uterus for termination of pregnancy,Vacuum aspirator
1923,Radionuclide therapy,Radiation
1924,Laparoscopy with biopsy,Laparoscopes
1925,Hand tendon pulley reconstruction with tendon prosthesis,Prosthesis
1926,Burr hole procedure,Trephine
1927,"Electrocardiogram, rhythm",Holter Monitors
1928,Tru-cut needle biopsy of testis,Core biopsy needle
1929,Grenz ray therapy up to 10 kV,Radioactivity
1930,Combined radiotherapy,Devices
1931,Directional atherectomy,Atherectomy device
1932,Pulsed laser fragmentation - action,Laser-generated electromagnetic radiation
1933,Electrocoagulation,Bipolar diathermy
1934,Coarctation angioplasty,Angioplasty catheter
1935,X-ray beam therapy,"Radiation, Nonionizing"
1936,Primary suture of skin NEC,Surgical sutures
1937,Conversion to hybrid total hip replacement NEC,Hip Joint Implantable Prostheses (device)
1938,Ureteroscopic adjustment of ureteric stent,Endoscopes
1939,Nasal endoscopy with total ethmoidectomy (procedure),Endoscopes
1940,Insertion of subclavian feeding line,Vascular cannula
1941,Enteroscopy,Endoscopes
1942,Bronchoscopy and biopsy of bronchus,Endoscopes
1943,Cystostomy with insertion of ureteral catheter,catheter device
1944,Indirect laryngoscopy with vocal cord injection,Endoscopes
1945,Percutaneous angioscopy,Endoscopes
1946,Insertion of catheter for central venous pressure monitoring,Vascular cannula
1947,Bilateral endoscopic destruction of fallopian tubes,Endoscopes
1948,Endoscopic removal of foreign body from larynx,Endoscopes
1949,Preload cavity radiotherapy - sealed,Radiation
1950,Other specified diagnostic endoscopic examination of larynx,Endoscopes
1951,Therapeutic endoscopic operations on trachea using rigid bronchoscope,Endoscopes
1952,Other specified diagnostic fibreoptic endoscopic examination of trachea,Endoscopes
1953,Other specified therapeutic fibreoptic bronchoscopy,Endoscopes
1954,Other specified diagnostic endoscopic examination of lower bowel using fibreoptic sigmoidoscope,Endoscopes
1955,Other therapeutic endoscopic operations on kidney,Endoscopes
1956,Other specified diagnostic endoscopy of the kidney,Endoscopes
1957,Percutaneous nephroscopic balloon dilatation of ureter,Endoscopes
1958,"Threshold automated static perimetry, central 30 degrees",Automated static perimeter
1959,Ureteroscopic laser fragmentation of ureteric calculus,Ultrasonic lithotripter probe
1960,Preoperative course of radiotherapy,Ionizing radiation
1961,Radiofrequency destruction of scar neuroma,Radiofrequency controlled thermal probe
1962,Cryotherapy to cranial nerve,Cryoprobe
1963,Percutaneous balloon angioplasty of intracranial artery,Angioplasty catheter
1964,Removal of acupuncture needle,Acupuncture needle
1965,Cataract extraction and insertion of intraocular lens,Ocular Prosthesis
1966,Primary open reduction of fracture and external fixation,External Fixation Devices
1967,MR proton spectroscopy of head,Magnetic resonance imaging unit
1968,Parathyroid sampling catheter procedure,Vascular Catheters
1969,Short wave diathermy to wrist,Diathermy device
1970,Laser enucleation of the prostate with intravesical morcellation,Laser-generated electromagnetic radiation
1971,Electrocoagulation of lesion - small intestine,Diathermy device
1972,Low power laser therapy to hand,Laser-generated electromagnetic radiation
1973,Closure by clip procedure,Clip
1974,Intraventricular pacing,Artificial cardiac pacemaker
1975,Open reduction of rib fracture with external fixation,External Fixation Devices
1976,"Fitting of spectacles, low vision aid, single element",Eyeglasses
1977,Suture of liver,Surgical sutures
1978,Closure with prosthetic implant,Artificial Implants
1979,Correction of trichiasis by epilation with cryotherapy,Cryoprobe
1980,Electrocoagulation of uterus,Electricity
1981,Insertion of keratoprosthesis,Ocular Prosthesis
1982,"Radiation therapy treatment planning, patient contour and localization of internal structures",Devices
1983,Proctoscopy,Proctoscopes
1984,Suture of great vessel,Surgical sutures
1985,Percutaneous balloon valvuloplasty of pulmonary valve,Medical Balloon Device
1986,Laparoscopic fundoplication,Laparoscopes
1987,Embolectomy with catheter of popliteal-tibio-peroneal artery by leg incision,Vascular Catheters
1988,Radiation physics consultation with therapeutic radiologist,Devices
1989,U-tube hepaticoenterostomy,biomedical tube device
1990,Embolectomy with catheter of innominate artery by neck incision,Vascular Catheters
1991,Suture of capsule of upper extremity,Surgical sutures
1992,Magnet extraction of foreign body from retina,Magnet <device>
1993,Application of support hose,"Binder, device"
1994,Equalization of leg by epiphyseal stapling,"Staple, Surgical"
1995,Suture of laceration of nose,Surgical sutures
1996,Heart suturing,Surgical sutures
1997,Splinting of ureter,Splint Device
1998,Magnet extraction of foreign body from ciliary body,Magnet <device>
1999,Linear accelerator photon therapy,Photons
2000,Revision to external fixation(without reduction) of proximal femoral fracture,External Fixation Devices
2001,Laser bladder lesion therapy,Laser-generated electromagnetic radiation
2002,Duckett hypospadias repair,Bladder mucosa
2003,Loop diathermy excision,Unipolar diathermy
2004,Percutaneous needle biopsy of spleen,Biopsy needle
2005,Peripheral venous cannula insertion - scalp,catheter device
2006,Functional endoscopic sinus surgery - therapeutic antroscopy via inferior meatus,Endoscopes
2007,Ureteroscopic ureteric stent procedure,Endoscopes
2008,Laparoscopic pyloromyotomy,Endoscopes
2009,Fiberoptic colonoscopy,Endoscopes
2010,"Introduction of catheter into aorta, initial placement",catheter device
2011,Introduction of catheter into vertebral artery,catheter device
2012,Attention to central venous catheter,Vascular cannula
2013,Other specified rigid therapeutic bronchoscopy,Endoscopes
2014,Therapeutic ureteroscopic operation on ureter,Endoscopes
2015,Diagnostic rigid bronchoscopy,Endoscopes
2016,Endoscopic snare resection of lesion of trachea using rigid bronchoscope,Snare instrument
2017,Cystoscopy and laser destruction of bladder lesion,Laser-generated electromagnetic radiation
2018,Cryotherapy to thoracic sympathetic nerve,Cryoprobe
2019,Radiofrequency destruction of nerves and ganglia,Radiofrequency controlled thermal probe
2020,Radiofrequency destruction of abdominal cutaneous nerve,Radiofrequency controlled thermal probe
2021,Dental scaling and polishing,Dental scaler
2022,Balloon truncal valvotomy,Balloon dilatation catheter
2023,Frost suture to eyelids,Surgical sutures
2024,Revision cemented unicompartmental knee replacement,Bone Cements
2025,MRI of lungs,Magnetic resonance imaging unit
2026,Cine MRI of joint movement - wrist,Magnetic resonance imaging unit
2027,Jugular vein sampling catheter procedure,Vascular Catheters
2028,Delayed primary suture of skin,Surgical sutures
2029,Low power laser therapy to trunk,Laser-generated electromagnetic radiation
2030,"Repair of inflatable penile prosthesis, with pump, reservoir and cylinders",pump (device)
2031,Delivery by Scanzoni maneuver,Obstetrical Forceps
2032,Cryotherapy,Cold Sensation
2033,Cauterization with laser,Laser-generated electromagnetic radiation
2034,Closure of foramen ovale with prosthesis by closed heart technique,Prosthesis
2035,Thermokeratoplasty,Heat (physical force)
2036,Fine needle biopsy of mediastinum,Fine biopsy needle
2037,Endoscopic brush biopsy of trachea,Brush device
2038,Core needle biopsy of epididymis,Core biopsy needle
2039,Intraoperative cardiac pacing and mapping,Artificial cardiac pacemaker
2040,Thrombectomy with catheter of iliac vein by abdominal incision,catheter device
2041,Prescribing spectacles for aphakia,Eyeglasses
2042,Sleep apnea monitoring with alarm,"Apnea alarm, device"
2043,Anoscopy for removal of foreign body,Anoscope
2044,Teleradiotherapy with radioactive cesium,"Radiation, Nonionizing"
2045,Removal of coronary artery obstruction by percutaneous transluminal balloon with thrombolytic agent,"Percutaneous transluminal angioplasty balloon, device"
2046,Repair of paraumbilical hernia with prosthesis,Prosthesis
2047,Treatment planning for teletherapy,Devices
2048,Suture of joint capsule with arthroplasty of foot,Surgical sutures
2049,Suture of thoracic duct by cervical approach,Surgical sutures
2050,Therapeutic radiology port film interpretation and verification,Devices
