,CUI1,CUI2
3684,Muscle-testing by bicycle dynamometer,Bicycle ergometer
3685,Endoscopic snare resection of lesion of sigmoid colon using rigid sigmoidoscope,Snare instrument
3686,Laparoscopic lysis of adhesions,Laparoscopes
3687,Other specified forceps cephalic delivery,Obstetrical Forceps
3688,Primary open reduction of fracture of bone and extramedullary fixation,Internal Fixators
3689,Removal of shunt from intracranial subdural space,catheter device
3690,Cystoscopy and transurethral biopsy of prostate,Endoscopes
3691,Check cystoscopy and bladder biopsy,Endoscopes
3692,Nasal endoscopy with nasal polypectomy,Endoscopes
3693,Removal of central venous line,Vascular cannula
3694,Bronchoscopic closure of fistula,Endoscopes
3695,Female genital system contrast procedure,Radiographic contrast media
3696,Instillation of therapeutic substance into bladder,catheter device
3697,Endoscopic insertion of prostatic stent,Endoscopes
3698,Bronchoscopic cauterization of fistula,Endoscopes
3699,"Catheterization, Ureteral",catheter device
3700,Arthroscopy of wrist with excision of triangular fibrocartilage,Endoscopes
3701,Endoscopic control of gastric bleeding,Endoscopes
3702,Laparoscopic biopsy of liver lesion,Endoscopes
3703,Enteroscopy via paracentesis,Endoscopes
3704,Therapeutic arthroscopic operations on cavity of knee joint,Endoscopes
3705,Pyelography: other,Radiographic contrast media
3706,Renewal of valve of cerebroventricular shunt,catheter device
3707,Fiberoptic endoscopic insertion of prosthesis into upper gastrointestinal tract,Endoscopes
3708,Percutaneous transluminal angioplasty of axillary artery,Angioplasty catheter
3709,Percutaneous angioplasty of popliteal artery,Angioplasty catheter
3710,Cryotherapy to Gasserian ganglion,Cryoprobe
3711,Curietron brachytherapy,Radioactivity
3712,Making of beam direction shell for radiotherapy,Devices
3713,Percutaneous balloon angioplasty of common femoral artery,Angioplasty catheter
3714,Angioplasty of crural artery,Angioplasty catheter
3715,Laser therapy to lesion of eyelid,Laser-generated electromagnetic radiation
3716,Bronchoscopic destruction of lesion - laser,Bronchoscopes
3717,Examination of ear under microscope,Microscopes
3718,Cine MRI of joint movement - ankle,Magnetic resonance imaging unit
3719,Provision of headband telescope,Eyeglasses
3720,Suture of flexor tendon of hand,Surgical sutures
3721,Teleradiotherapy particulate radiation,Radiation
3722,Combing of hair,Comb animal structure
3723,Resuture of skin,Surgical sutures
3724,Suction evacuation of retained products of conception,Suction evacuation
3725,Angioplasty of vertebral artery,Angioplasty catheter
3726,Snare resection of lesion of rectum,Snare instrument
3727,Radiolabeled antibody therapy,Radiation
3728,Microwave therapy to face,Diathermy device
3729,Postoperative course of deep X-ray therapy,Devices
3730,Fitting of pessary,Pessaries
3731,Suture of ulcer of skin,Surgical sutures
3732,Percutaneous balloon valvuloplasty of heart,Medical Balloon Device
3733,Internal fixation of humerus without fracture reduction,Internal Fixators
3734,Aneurysmectomy with anastomosis of thoracic artery,Surgical sutures
3735,Magnet extraction of foreign body from sclera,Magnet <device>
3736,Control of epistaxis by suture,Surgical sutures
3737,"Repair of artery with tissue patch graft of vein, autogenous or homograft",Veins
3738,Exploration with a probe,Probes
3739,Probing of nasolacrimal duct with irrigation,Syringes
3740,Atherectomy by laser,Atherectomy device
3741,Endoscopic transurethral fulguration of prostate,Electricity
3742,"Deep radiation therapy, 200-300 KVP","Radiation, Nonionizing"
3743,"Needle bone biopsy, deep",Biopsy needle
3744,Open reduction of closed humeral fracture with internal skeletal fixation,Internal Fixators
3745,Grenz ray therapy up to 10 kV,"Radiation, Nonionizing"
3746,Radiotherapy treatment groups,Radiation
3747,Laser ablation,Laser-generated electromagnetic radiation
3748,Cystodiathermy - action,Bipolar diathermy
3749,Four layer compression bandaging for skin ulcer,"Binder, device"
3750,Percutaneous needle lymphatic biopsy,Biopsy needle
3751,Peripheral venous cannula insertion,Vascular cannula
3752,Bronchoscopic aspiration of secretions,Endoscopes
3753,Bronchoscopic destruction of lesion - cautery,Endoscopes
3754,Maxillary sinus endoscopy with biopsy,Endoscopes
3755,Arterial catheterization,catheter device
3756,Endoscopy and washing,Endoscopes
3757,Endoscopy of pericardium,Endoscopes
3758,Suturing of sinus of Valsalva fistula,Surgical sutures
3759,Introduction of catheter into superior vena cava,catheter device
3760,Voiding urethrocystography,Radiographic contrast media
3761,Diagnostic endoscopic examination of duodenum and biopsy of lesion of duodenum,Endoscopes
3762,Indwelling catheter removed,catheter device
3763,"Endoscopy, Gastrointestinal",Endoscopes
3764,Arthroscopy NEC (procedure) in SNOMEDCT,Endoscopes
3765,Oral laryngoscopy,Endoscopes
3766,Fiberoptic endoscopic snare resection of lesion of upper gastrointestinal tract,Endoscopes
3767,Chiropractic diathermy,Diathermy device
3768,Endoscopic fiberoptic laser destruction of lesion below trachea,Bronchoscopes
3769,Manipulative removal of calculus from submandibular duct,Manual method
3770,Laser iridotomy,Laser-generated electromagnetic radiation
3771,Cryotherapy to stellate ganglion,Cryoprobe
3772,Angioplasty of arterial graft,Angioplasty catheter
3773,MRI of head,Magnetic resonance imaging unit
3774,PET study for localization of tumor,Positron emission tomography unit
3775,Aspiration of chronic ambulatory peritoneal dialysis catheter,Peritoneal dialysis solution (product)
3776,External fixation using dynamic unilateral bar,External Fixation Devices
3777,External electrode cardioversion,electrode
3778,Strickland suture of tendon,Surgical sutures
3779,Microwave therapy to pelvis,Diathermy device
3780,Cystoscopy and cystodiathermy,Diathermy device
3781,"Prescribing, fitting and revision of contact lens",Contact Lenses
3782,"CT guidance for treatment planning, teletherapy","Radiation, Nonionizing"
3783,Female urethrorrhaphy,Surgical sutures
3784,Aneurysmectomy with anastomosis of head and neck artery,Surgical sutures
3785,Suture of thoracic duct by abdominal approach,Surgical sutures
3786,Intraaortic balloon pump removal,Intra-aortic balloon pump device
3787,Repair of fracture with osteotomy and correction of alignment with internal fixation device,Internal Fixators
3788,Fulguration of carcinoma of urethra,Electricity
3789,Intraoperative transluminal angioplasty of renal artery,Angioplasty catheter
3790,Open biopsy of endometrium,Curette
3791,Skin prick test,Hypodermic Needles
3792,Repair of tendon by direct suture,Surgical sutures
3793,Endoscopic brush biopsy of duodenum,Brush device
3794,"Application of clamp to cerebral aneurysm, Crutchfield or Silverstone",Clip
3795,Apexcardiogram with ECG lead,Holter Monitors
3796,"Removal of coronary artery obstruction by percutaneous transluminal balloon, single vessel","Percutaneous transluminal angioplasty balloon, device"
3797,Suture of ocular tendon,Surgical sutures
3798,Repair of ostium primum defect with prosthesis,Prosthesis
3799,Cryosurgery with thermocouple control,Cold Sensation
3800,Insertion of Miller-Abbott tube for intestinal decompression,biomedical tube device
3801,Fine needle biopsy of bladder,Fine biopsy needle
3802,Repair of fallopian tube with prosthesis,Prosthesis
3803,Open cryotherapy to lesion of rectum,Cryoprobe
3804,Diagnostic proctoscopy,Proctoscopes
3805,High-energy beam therapy,"Radiation, Nonionizing"
3806,Neutron Capture Therapy,Neutrons
3807,Primary open reduction and external fixation of femoral fracture,External Fixation Devices
3808,Prescription of spectacles,Eyeglasses
3809,Primary suture of skin of head or neck NEC,Surgical sutures
3810,Subclavian artery cannula insertion,Vascular cannula
3811,Inferior mesenteric vein cannula insertion,Vascular cannula
3812,Open colonoscopy,Endoscopes
3813,Urethral irrigation of bladder,catheter device
3814,Amnioscopy,Endoscopes
3815,Endoscopic bilateral clipping of fallopian tubes,Endoscopes
3816,Laparoscopic-assisted right colectomy,Endoscopes
3817,Thoracoscopic lobectomy of lung,Endoscopes
3818,Irrigation by cannulation of sphenoid sinus,Cannula device
3819,Direct laryngoscopy with foreign body removal,Endoscopes
3820,Proctosigmoidoscopy with biopsy,Endoscopes
3821,Hysterosalpingography with gas contrast,Radiographic contrast media
3822,Lower bowel endoscopy - removal of object,Endoscopes
3823,Other specified therapeutic arthroscopic operation on cavity of knee joint,Endoscopes
3824,Other specified other therapeutic fibreoptic endoscopic operation on oesophagus,Endoscopes
3825,Other specified other therapeutic endoscopic operation on oesophagus using rigid oesophagoscope,Endoscopes
3826,Diathermy procedure of visual system,Diathermy device
3827,Nephroscopy NEC,Endoscopes
3828,Catheterisation of both right and left sides of heart NEC,catheter device
3829,Fine needle aspiration of lesion of peritoneal cavity,Fine needle
3830,Angioplasty of subclavian artery,Angioplasty catheter
3831,Angioplasty of pulmonary vein,Angioplasty catheter
3832,Bronchoscopic destruction of lesion - cryotherapy,Cryoprobe
3833,Balloon dilatation of implanted mitral valve,Balloon dilatation catheter
3834,Suture of fascia to skeletal attachment,Surgical sutures
3835,Primary open reduction of fracture and internal fixation with tension band wiring,Internal Fixators
3836,MRI arthrography,Magnetic resonance imaging unit
3837,Proctoscopy by transabdominal approach,Proctoscopes
3838,Pre-biopsy localization of breast lesion using self retaining wire,Self-retaining wire
3839,"Breathing exercise, blow bottle","Bottle, device"
3840,Percutaneous transluminal angioplasty of vein,Angioplasty catheter
3841,Flexible fiberoptic sigmoidoscopy for removal of foreign body,Fiberoptic cable
3842,MRI of aortic arch and great vessel,Magnetic resonance imaging unit
3843,Microwave therapy to lower limb,Diathermy device
3844,Ureteroscopic endoburst operation,Balloon dilatation catheter
3845,"Consultation in computer dosimetry and isodose chart, teletherapy",Devices
3846,Extracorporeal shockwave lithotripsy for renal calculus,Shock wave lithotripter
3847,Oversewing - action,Surgical sutures
3848,Deep fine needle aspiration biopsy under radiologic guidance,Fine biopsy needle
3849,Achillorrhaphy,Surgical sutures
3850,Suture of eye proper,Surgical sutures
3851,Determination of ventricular ejection fraction with probe technique,Probes
3852,Operation of Ambu resuscitator,Resuscitator
3853,Provision of spectacles,Eyeglasses
3854,"Radiation therapy, central axis depth dose computation",Devices
3855,Aneurysmectomy of upper limb artery,Surgical sutures
3856,"Heart Arrest, Induced",Heart-Lung Machine
3857,Thrombectomy with catheter of innominate artery by neck incision,catheter device
3858,Aneurysmectomy with anastomosis of upper limb artery,Surgical sutures
3859,Placing bedrails,Bedside rails
3860,Embolectomy with catheter of aortoiliac artery by leg incision,Vascular Catheters
3861,Basic comprehensive audiometry testing,Audiometric testing equipment
3862,Treatment planning for brachytherapy,Ionizing radiation
3863,Light Coagulation,Light
3864,Extraction of primary membranous cataract by discission (procedure),Needle device
3865,Cryotherapy of ciliary body (procedure),Cold Sensation
3866,Cryotherapy to lesion of retina,Cryoprobe
3867,Cryotherapy to lesion of skin of head or neck,Cold Sensation
3868,Punch biopsy of lesion of skin of head or neck,Punch
3869,Neutron Capture Therapy,"Radiation, Nonionizing"
3870,Cystodiathermy - action,Unipolar diathermy
3871,Primary open reduction of fracture of long bone and fixation using flexible nail,Internal Fixators
3872,Extracorporeal shockwave lithotripsy of ureter,Shock wave lithotripter
3873,Other specified creation of shunt from subclavian artery to pulmonary artery using interposition tube prosthesis,Shunt Device
3874,Total prosthetic replacement of knee joint using cement,Bone Cements
3875,Ligation of fallopian tubes with Fallope ring by endoscopy,Endoscopes
3876,Functional endoscopic sinus surgery - diagnostic antroscopy via middle meatus,Endoscopes
3877,Bronchoscopy with lobar gas sampling,Endoscopes
3878,Bronchoscopic destruction of lesion - cryotherapy,Endoscopes
3879,Transurethral resection of bladder papilloma,Endoscopes
3880,Endoscopic replacement of prostatic stent,Endoscopes
3881,Flexible cystoscopy and laser destruction of bladder lesion,Flexible endoscope
3882,Insertion of catheter in anterior chamber of eye for permanent drainage in glaucoma,catheter device
3883,Endoscopic excision of lesion of stomach,Endoscopes
3884,Pulmonary Artery Catheterization,catheter device
3885,Laparoscopy with fulguration of lesion,Endoscopes
3886,laparoscopic unilateral repair of inguinal hernia with graft or prosthesis,Endoscopes
3887,Laparoscopic interval appendectomy,Endoscopes
3888,Catheterization of left heart,catheter device
3889,Other fibreoptic therapeutic endoscopic operation on upper gastrointestinal tract NOS,Endoscopes
3890,Intestinal scope-stomal,Endoscopes
3891,Introduction of catheter into carotid artery,catheter device
3892,Other specified diagnostic endoscopic examination of ventricle of brain,Endoscopes
3893,Catheterization of pancreatic cyst,catheter device
3894,Fiberoptic endoscopic examination of upper gastrointestinal tract and biopsy of lesion of upper gastrointestinal tract,Endoscopes
3895,Therapeutic rigid esophagoscopy,Endoscopes
3896,Local cooling therapy,Cryoprobe
3897,"Electrocardiography, Ambulatory",Holter Monitors
3898,Fiberoptic endoscopic laser destruction of lesion of trachea,Bronchoscopes
3899,Microwave therapy to prostate,Microwave probe
3900,Endoscopic bilateral cauterization of fallopian tubes,Laparoscopes
3901,Microtron electron teletherapy,Electrons
3902,Magnetic Resonance Imaging (MRI) of Heart,Magnetic resonance imaging unit
3903,MRI pelvimetry,Magnetic resonance imaging unit
3904,Gynaecological smear procedure,Smear sampling device
3905,PET study for tumor uptake of glucose,Positron emission tomography unit
3906,Provision of task lighting,Eyeglasses
3907,Submandibular duct probing,Probes
3908,Radioimmunotherapy,Radiation
3909,Suture repair of systemic venous pathway,Surgical sutures
3910,Small incision phakoemulsification of cataract and insertion of intraocular lens,Ocular Prosthesis
3911,Short wave diathermy to lower limb,Diathermy device
3912,Tru-cut transperineal biopsy of prostate,Tru-cut needle
3913,"Radiosurgery, Stereotactic",Radiation
3914,Construction of canthorrhaphy,Surgical sutures
3915,Megavoltage radiation therapy,Radioactivity
3916,total hip replacement insertion of prosthesis using methyl methacrylate,Hip Joint Implantable Prostheses (device)
3917,Partial hip replacement by cup with acetabuloplasty,Hip Joint Implantable Prostheses (device)
3918,"Application of ice collar, cap or bag",Cold Sensation
3919,Probing of nasolacrimal duct with irrigation,Probes
3920,Pereyra procedure including anterior colporrhaphy,Needle device
3921,Pulmonary artery wedge pressure monitoring,Pulmonary artery flotation catheter
3922,Atherectomy by laser,Laser-generated electromagnetic radiation
3923,Destruction of lesion of choroid by cryotherapy,Cold Sensation
3924,Aneurysmectomy of heart,Surgical sutures
3925,Fine needle aspiration of breast,Fine needle
3926,Laserpexy,Laser-generated electromagnetic radiation
3927,Arthroplasty with prosthetic replacement of trapezium (procedure),Artificial Implants
3928,Total breech delivery with forceps to aftercoming head,Obstetrical Forceps
3929,Reattachment of retina by electrocoagulation,Electricity
3930,Pulmonary artery wedge pressure determination,Pulmonary artery flotation catheter
3931,Combined X-ray therapy,"Radiation, Nonionizing"
3932,Supportive pharmacotherapy,Radiation
3933,Revision to closed reduction and external fixation of proximal femoral fracture,External Fixation Devices
3934,Simple enema administered,Enema tube
3935,Harris hypospadias repair,Bladder mucosa
3936,Primary open reduction and internal fixation of proximal femoral fracture with screw/nail and plate device,Internal Fixators
3937,Other specified diagnostic endoscopic examination of peritoneum,Laparoscopes
3938,Other specified primary open reduction of fracture of bone and intramedullary fixation,Internal Fixators
3939,Pulmonary artery catheter insertion via femoral vein,catheter device
3940,Superior mesenteric vein cannula insertion,catheter device
3941,Urethroscopic removal of lesion in urethra,Endoscopes
3942,Direct insertion of left atrial catheter,catheter device
3943,Diagnostic arthroscopy of knee with synovial biopsy,Endoscopes
3944,Bronchoscopy with brush biopsy,Endoscopes
3945,Diathermy,Diathermy device
3946,Endoscopic partial meniscectomy of knee,Endoscopes
3947,Proctosigmoidoscopy for dilation,Endoscopes
3948,Diagnostic tracheoscopy,Endoscopes
3949,Diagnostic fiberoptic endoscopic examination of pharynx and larynx,Endoscopes
3950,Endoscopic destruction of lesion of trachea using rigid bronchoscope NEC,Endoscopes
3951,Operative enteroscopy,Endoscopes
3952,Menghini needle biopsy of liver,Menghini needle
3953,Other specified therapeutic endoscopic operation on pleura,Endoscopes
3954,Diagnostic fiberoptic bronchoscopy,Endoscopes
3955,Fiberoptic endoscopic extirpation of lesion of upper gastrointestinal tract,Endoscopes
3956,Diagnostic endoscopic examination of peritoneum,Endoscopes
3957,Cryotherapy to lesion of peripheral nerve,Cryoprobe
3958,Complete protective suture of eyelid,Surgical sutures
3959,Forceps extraction of lens,Forceps
3960,Electroacupuncture after Voll,Acupuncture needle
3961,MRI of foot,Magnetic resonance imaging unit
3962,Provision of low vision stand magnifier,Eyeglasses
3963,PET myocardial stress study using N13 ammonia,Positron emission tomography unit
3964,Balloon dilatation of stricture - small intestine,Balloon dilatation catheter
3965,Cryotherapy of lesion - small intestine,Cryoprobe
3966,Biopsy using Watson capsule,Watson capsule
3967,Attention to nephrostomy tube,biomedical tube device
3968,Transurethral Microwave Thermotherapy,Microwave probe
3969,Palliative course of deep X-ray therapy,Radioactivity
3970,Postoperative course of deep X-ray therapy,Radioactivity
3971,Microwave therapy to upper limb,Diathermy device
3972,Replacement of contact lens,Contact Lenses
3973,Prostatomembranous urethrorrhaphy,Surgical sutures
3974,Flexible fiberoptic laryngoscopy with stroboscopy (procedure),Fiberoptic laryngoscope
3975,Construction of median tarsorrhaphy with transposition of tarsal plate,Surgical sutures
3976,Magnetic Resonance Imaging (MRI) of Orbit,Magnetic resonance imaging unit
3977,Correction of trichiasis by epilation with cryotherapy,Cold Sensation
3978,Suture of periosteum of phalanges of foot,Surgical sutures
3979,Electrocoagulation of round ligament,Electricity
3980,Periosteal suture of tibia and fibula,Surgical sutures
3981,Intracranial aneurysmectomy,Surgical sutures
3982,Internal fixation of femur,Internal Fixators
3983,Peritoneal Dialysis,Peritoneal dialysis solution (product)
3984,Monitoring of ECG at surgery,Holter Monitors
3985,"Discission of membranous cataract, secondary",Needle device
3986,Destruction of lesion of choroid by cryotherapy,Cryoprobe
3987,Radionuclide Ventriculography,Gamma counter
3988,Positional nystagmus test with recording,Physiologic monitoring recorder
3989,Laparoscopy with guided transhepatic cholangiography,Laparoscopes
3990,Intracranial aneurysmectomy with graft replacement,Surgical sutures
3991,Aneurysmectomy with graft replacement of abdominal artery,Surgical sutures
3992,Fiberoptic endoscopic destruction of lesion below trachea,Bronchoscopes
3993,Fast neutron therapy,Neutrons
3994,Primary reduction of fracture of long bone and fixation using Hicks plate,Internal Fixators
3995,Photodestruction of lesion of skin of head or neck NEC,Light Coagulation
3996,Combined radiotherapy,Devices
3997,Resuture of previous incision of anterior abdominal wall NEC,Surgical sutures
3998,Magnetic foreign body removed from eye,Magnet <device>
3999,Rigid bronchoscopic removal of foreign body,Endoscopes
4000,Central venous cannula insertion via antecubital fossa vein,catheter device
4001,Diagnostic arthroscopy of elbow joint,Endoscopes
4002,Diagnostic endoscopic examination of bronchus and biopsy of lesion of lung using rigid bronchoscope,Endoscopes
4003,Vascular cannula removal,Vascular cannula
4004,Second look laparoscopy,Endoscopes
4005,Endoscopy of intestinal conduit,Endoscopes
4006,Lymphatic system endoscopy,Endoscopes
4007,External ear endoscopy,Endoscopes
4008,Indirect laryngoscopy with removal of lesion (procedure),Endoscopes
4009,Arthroscopy of wrist with complete synovectomy,Endoscopes
4010,Salpingography,Radiographic contrast media
4011,Thoracoscopic pleurodesis,Endoscopes
4012,Removal of cerebral ventricular catheter,catheter device
4013,Other specified diagnostic endoscopic examination of duodenum,Endoscopes
4014,Therapeutic endoscopic operations on trachea using rigid bronchoscope,Endoscopes
4015,Fiberoptic endoscopic laser destruction of lesion of upper gastrointestinal tract,Endoscopes
4016,Therapeutic fiberoptic esophagoscopy,Endoscopes
4017,Threshold-related automated static perimetry,Automated static perimeter
4018,Cryotherapy to cervical sympathetic nerve,Cryoprobe
4019,Transurethral punch biopsy of prostate,Punch
4020,Fiberoptic esophagoscopy and snare resection,Snare instrument
4021,Calculation of teletherapy,Devices
4022,Calculation of brachytherapy,Ionizing radiation
4023,Cryotherapy to lesion of lateral canthus,Cryoprobe
4024,Diathermy of laryngeal telangiectasis,Diathermy device
4025,Insertion of acupuncture needle,Acupuncture needle
4026,Magnetic Resonance Imaging (MRI) of Shoulder,Magnetic resonance imaging unit
4027,MRI of pelvic vessels,Magnetic resonance imaging unit
4028,Magnetic Resonance Spectroscopy,Magnetic resonance imaging unit
4029,Balloon tuboplasty,Balloon dilatation catheter
4030,Provision of scleral contact lens,Contact Lenses
4031,Repair of vaginal tear,Surgical sutures
4032,Destruction of lesion of large intestine using thermal probe,Thermal probe
4033,Photodestruction of skin lesion,Light Coagulation
4034,Magnetic resonance imaging guidance,Magnetic resonance imaging unit
4035,Suture of obstetric laceration of vagina,Surgical sutures
4036,Extracapsular cataract extraction and insertion of intraocular lens,Ocular Prosthesis
4037,Radioimmunotherapy,Devices
4038,Short wave diathermy to neck,Diathermy device
4039,Diathermy of wart,Diathermy device
4040,Low power laser therapy to wrist,Laser-generated electromagnetic radiation
4041,Endoscopy with brush biopsy and washing,Brush device
4042,"Direct laryngoscopy, diagnostic, with operating microscope",Operating microscope
4043,Arthrogram of stifle joint,Devices
4044,Coagulation or electrocoagulation of inner ear,Electricity
4045,Aneurysmectomy of abdominal vein,Surgical sutures
4046,Electrocoagulation of lesion of vagina,Electricity
4047,Corneoscleral suture,Surgical sutures
4048,Thrombectomy with catheter of carotid artery by neck incision,catheter device
4049,Coagulation or electrocoagulation of gasserian ganglion,Electricity
4050,Thrombectomy with catheter of innominate artery by thoracic incision,catheter device
4051,Trephine sclerectomy with implant,Trephine
4052,Destruction of chorioretinal lesion by cryotherapy,Cryoprobe
4053,Aneurysm clipping,Clip
4054,Wiring of sternum,Bone Wires
4055,Fulguration of urethral caruncle,Electricity
4056,"Arthroplasty, acetabular and proximal femoral prosthetic replacement, with autograft",Hip Joint Implantable Prostheses (device)
4057,Aneurysmectomy of ascending aorta with anastomosis,Surgical sutures
4058,Indirect laryngoscopy with vocal cord injection,Mirror
4059,"Infusion of intra-arterial thrombolytic agent with percutaneous transluminal coronary angioplasty, single vessel",Angioplasty catheter
4060,Ion laser photocoagulation,Ion laser
4061,Aponeurorrhaphy of hand,Surgical sutures
4062,Fine needle aspiration of gallbladder,Fine biopsy needle
4063,Teleradiotherapy with radioactive cesium,Radioactive implant
4064,Closed reduction of fracture of radius AND ulna with internal fixation,Internal Fixators
4065,Suture of stomach,Surgical sutures
4066,Fiberoptic endoscopic snare resection of lesion of upper gastrointestinal tract,Snare instrument
4067,Primary open reduction spinal fracture and external fixation,External Fixation Devices
4068,Percutaneous transluminal angioplasty of carotid artery,Angioplasty catheter
4069,Revision to open reduction of dislocation and functional bracing,External Fixation Devices
4070,Snare resection of duodenum,Snare instrument
4071,Photochemotherapy with tar and ultraviolet B,Ultraviolet Rays
4072,Disposal of radioactive source,Radiation
4073,Simple electrodesiccation of lesion of penis,Electricity
4074,Fulguration of Skene's glands,Electricity
4075,"Radiation therapy isodose plan, wedge fields",Radiation
4076,Total skin electron beam therapy,Radioactivity
4077,Total skin electron beam therapy,Electron beam
4078,Three dimensional treatment planning,Radiation
4079,"Consultation in computer dosimetry and isodose chart, teletherapy",Radiation
4080,Destruction using electrical energy,Electricity
4081,Laparoscopy with fulguration of lesion,Electricity
4082,Surface Radiotherapy,Ionizing radiation
4083,Transurethral fulguration of bladder,Electricity
4084,Destruction of lesion of rectum by electrodesiccation,Electricity
4085,Cystourethroscopy with insertion of radioactive substance,Radioactivity
4086,Isodose computation for brachytherapy,Radiation
4087,Monochromator phototest,Light
4088,Palliative course of radiotherapy,Ionizing radiation
4089,X-ray beam therapy,Roentgen Rays
4090,Grenz ray therapy up to 10 kV,Grenz radiation
4091,Superficial X-ray therapy 10-60 kV,Grenz radiation
